question,answer,exact_text,context,groundedness,relevance,standalone
What do investors look for in startup founders today?,Investors are looking for the next Larry and Sergey.,Now all the VCs are looking for the next Larry and Sergey.,"just make a good outcome less likely. The one advantage of a high valuation is that you get less dilution. But there is another less sexy way to achieve that: just take less money. 9. Investors look for founders like the current stars. Ten years ago investors were looking for the next Bill Gates. This was a mistake, because Microsoft was a very anomalous startup. They started almost as a contract programming operation, and the reason they became huge was that IBM happened to drop the PC standard in their lap. Now all the VCs are looking for the next Larry and Sergey. This is a good trend, because Larry and Sergey are closer to the ideal startup founders. Historically investors thought it was important for a founder to be an expert in business. So they were willing to fund teams of MBAs who planned to use the money to pay programmers to build their product for them. This is like funding Steve Ballmer in the hope that the programmer he'll hire is Bill Gates kind of backward, as the events of the Bubble showed. Now most VCs know they should be funding technical guys. This is more pronounced among the very top funds; the lamer ones still want to fund MBAs. If you're a hacker, it's good news that investors are looking for Larry and Sergey. The bad news is, the only investors who can do it right are the ones who knew them when they were a couple of CS grad students, not the confident media stars they are today. What investors still don't get is how clueless and tentative great founders can seem at the very beginning. 10. The contribution of investors tends to be underestimated. Investors do more for startups than give them money. They're helpful in doing deals and arranging introductions, and some of the smarter ones, particularly angels, can give good advice about the product. In fact, I'd say what separates the great investors from the mediocre ones is the quality of their advice. Most investors give advice, but the top ones give good advice. Whatever help investors give a startup tends to be underestimated. It's to everyone's advantage to let the world think the founders thought of everything. The goal of the investors is for the company to become valuable, and the company seems more valuable if it seems like all the good ideas came from within. This trend is compounded by the obsession that the press has with founders. In a company founded by two people, 10% of the ideas might come from the first guy they hire. Arguably they've done a bad job of hiring otherwise. And yet this guy will be almost entirely overlooked by the press. I say this as a founder: the contribution of founders is always overestimated. The danger here is that new founders, looking at existing founders, will think that they're supermen that one couldn't possibly equal oneself. Actually they have a hundred different types of",5,5,4
Why did industrialization spread quickly in certain regions?,Because there was a strong middle class in those countries where a private citizen could make a fortune without having it confiscated.,It only spread to places where there was a strong middle class countries where a private citizen could make a fortune without having it confiscated.,"spread. Agriculture, cities, and industrialization all spread widely. If startups end up being like the movie business, with just a handful of centers and one dominant one, that's going to have novel consequences. There are already signs that startups may not spread particularly well. The spread of startups seems to be proceeding slower than the spread of the Industrial Revolution, despite the fact that communication is so much faster now. Within a few decades of the founding of Boulton & Watt there were steam engines scattered over northern Europe and North America. Industrialization didn't spread much beyond those regions for a while. It only spread to places where there was a strong middle class countries where a private citizen could make a fortune without having it confiscated. Otherwise it wasn't worth investing in factories. But in a country with a strong middle class it was easy for industrial techniques to take root. An individual mine or factory owner could decide to install a steam engine, and within a few years he could probably find someone local to make him one. So steam engines spread fast. And they spread widely, because the locations of mines and factories were determined by features like rivers, harbors, and sources of raw materials. Startups don't seem to spread so well, partly because they're more a social than a technical phenomenon, and partly because they're not tied to geography. An individual European manufacturer could import industrial techniques and they'd work fine. This doesn't seem to work so well with startups: you need a community of expertise, as you do in the movie business. Plus there aren't the same forces driving startups to spread. Once railroads or electric power grids were invented, every region had to have them. An area without railroads or power was a rich potential market. But this isn't true with startups. There's no need for a Microsoft of France or Google of Germany. Governments may decide they want to encourage startups locally, but government policy can't call them into being the way a genuine need could. How will this all play out? If I had to predict now, I'd say that startups will spread, but very slowly, because their spread will be driven not by government policies (which won't work) or by market need (which doesn't exist) but, to the extent that it happens at all, by the same random factors that have caused startup culture to spread thus far. And such random factors will increasingly be outweighed by the pull of existing startup hubs. Silicon Valley is where it is because William Shockley wanted to move back to Palo Alto, where he grew up, and the experts he lured west to work with him liked it so much they stayed. Seattle owes much of its position as a tech center to the same cause: Gates and Allen wanted to move home. Otherwise Albuquerque might have Seattle's place in the rankings. Boston is a tech center because it's the intellectual capital of the",4,5,4
What programming languages are top hackers using for server-based software?,"Perl, Python, and even Lisp.","Today a lot of the top hackers are using languages far removed from C and C++: Perl, Python, and even Lisp.","drove an impressive collection of dials displaying real-time server statistics (a hit with visitors, but indispensable for us too), modifications (including bug fixes) to open-source software, and a great many configuration files and settings. Trevor Blackwell wrote a spectacular program for moving stores to new servers across the country, without shutting them down, after we were bought by Yahoo. Programs paged us, sent faxes and email to users, conducted transactions with credit card processors, and talked to one another through sockets, pipes, http requests, ssh, udp packets, shared memory, and files. Some of Viaweb even consisted of the absence of programs, since one of the keys to Unix security is not to run unnecessary utilities that people might use to break into your servers. It did not end with software. We spent a lot of time thinking about server configurations. We built the servers ourselves, from components-- partly to save money, and partly to get exactly what we wanted. We had to think about whether our upstream ISP had fast enough connections to all the backbones. We serially dated RAID suppliers. But hardware is not just something to worry about. When you control it you can do more for users. With a desktop application, you can specify certain minimum hardware, but you can't add more. If you administer the servers, you can in one step enable all your users to page people, or send faxes, or send commands by phone, or process credit cards, etc, just by installing the relevant hardware. We always looked for new ways to add features with hardware, not just because it pleased users, but also as a way to distinguish ourselves from competitors who (either because they sold desktop software, or resold Web-based applications through ISPs) didn't have direct control over the hardware. Because the software in a Web-based application will be a collection of programs rather than a single binary, it can be written in any number of different languages. When you're writing desktop software, you're practically forced to write the application in the same language as the underlying operating system-- meaning C and C++. And so these languages (especially among nontechnical people like managers and VCs) got to be considered as the languages for serious software development. But that was just an artifact of the way desktop software had to be delivered. For server-based software you can use any language you want. Today a lot of the top hackers are using languages far removed from C and C++: Perl, Python, and even Lisp. With server-based software, no one can tell you what language to use, because you control the whole system, right down to the hardware. Different languages are good for different tasks. You can use whichever is best for each. And when you have competitors, you can means you must(we'll return to this later), because if you don't take advantage of this possibility, your competitors will. Most of our competitors used C and C++, and this made their software visibly inferior because",5,4,4
What is the biggest danger for startups when raising money?,The biggest danger is surprise.,The biggest danger is surprise.,"hope that as startups get cheaper and the number of investors increases, raising money will become, if not easy, at least straightforward. In the meantime, the brokenness of the funding process offers a big opportunity. Most investors have no idea how dangerous they are. They'd be surprised to hear that raising money from them is something that has to be treated as a threat to a company's survival. They just think they need a little more information to make up their minds.They don't get that there are 10 other investors who also want a little more information, and that the process of talking to them all can bring a startup to a standstill for months. Because investors don't understand the cost of dealing with them, they don't realize how much room there is for a potential competitor to undercut them. I know from my own experience how much faster investors could decide, because we've brought our own time down to 20 minutes (5 minutes of reading an application plus a 10 minute interview plus 5 minutes of discussion). If you were investing more money you'd want to take longer, of course. But if we can decide in 20 minutes, should it take anyone longer than a couple days? Opportunities like this don't sit unexploited forever, even in an industry as conservative as venture capital. So either existing investors will start to make up their minds faster, or new investors will emerge who do. In the meantime founders have to treat raising money as a dangerous process. Fortunately, I can fix the biggest danger right here. The biggest danger is surprise. It's that startups will underestimate the difficulty of raising money that they'll cruise through all the initial steps, but when they turn to raising money they'll find it surprisingly hard, get demoralized, and give up. So I'm telling you in advance: raising money is hard. When investors can't make up their minds, they sometimes describe it as if it were a property of the startup. You're too early for us, they sometimes say. But which of them, if they were taken back in a time machine to the hour Google was founded, wouldn't offer to invest at any valuation the founders chose? An hour old is not too early if it's the right startup. What you're too early really means is we can't figure out yet whether you'll succeed. Investors influence one another both directly and indirectly. They influence one another directly through the buzz that surrounds a hot startup. But they also influence one another indirectly through the founders. When a lot of investors are interested in you, it increases your confidence in a way that makes you much more attractive to investors. No VC will admit they're influenced by buzz. Some genuinely aren't. But there are few who can say they're not influenced by confidence. One VC who read this essay wrote: We try to avoid companies that got bootstrapped with consulting. It creates very bad behaviors/instincts that",5,5,4
Why do teenage kids persecute nerds?,"Partly because teenagers are still half children, and many children are just intrinsically cruel.","Partly because teenagers are still half children, and many children are just intrinsically cruel.","elementary school, but this isn't their whole life, as it later becomes. Around the age of eleven, though, kids seem to start treating their family as a day job. They create a new world among themselves, and standing in this world is what matters, not standing in their family. Indeed, being in trouble in their family can win them points in the world they care about. The problem is, the world these kids create for themselves is at first a very crude one. If you leave a bunch of eleven-year-olds to their own devices, what you get is Lord of the Flies. Like a lot of American kids, I read this book in school. Presumably it was not a coincidence. Presumably someone wanted to point out to us that we were savages, and that we had made ourselves a cruel and stupid world. This was too subtle for me. While the book seemed entirely believable, I didn't get the additional message. I wish they had just told us outright that we were savages and our world was stupid. Nerds would find their unpopularity more bearable if it merely caused them to be ignored. Unfortunately, to be unpopular in school is to be actively persecuted. Why? Once again, anyone currently in school might think this a strange question to ask. How could things be any other way? But they could be. Adults don't normally persecute nerds. Why do teenage kids do it? Partly because teenagers are still half children, and many children are just intrinsically cruel. Some torture nerds for the same reason they pull the legs off spiders. Before you develop a conscience, torture is amusing. Another reason kids persecute nerds is to make themselves feel better. When you tread water, you lift yourself up by pushing water down. Likewise, in any social hierarchy, people unsure of their ownposition will try to emphasize it by maltreating those they think rank below. I've read that this is why poor whites in the United States are the group most hostile to blacks. But I think the main reason other kids persecute nerds is that it's part of the mechanism of popularity. Popularity is only partially about individual attractiveness. It's much more about alliances. To become more popular, you need to be constantly doing things that bring you close to other popular people, and nothing brings people closer than a common enemy. Like a politician who wants to distract voters from bad times at home, you can create an enemy if there isn't a real one. By singling out and persecuting a nerd, a group of kids from higher in the hierarchy create bonds between themselves. Attacking an outsider makes them all insiders. This is why the worst cases of bullying happen with groups. Ask any nerd: you get much worse treatment from a group of kids than from any individual bully, however sadistic. If it's any consolation to the nerds, it's nothing personal. The group of kids who band together to pick",5,4,4
What do big companies prioritize to avoid disasters in software design?,Big companies want to decrease the standard deviation of design outcomes because they want to avoid disasters.,"But when you damp oscillations, you lose the high points as well as the low.","from another problem that afflicts the sciences: math envy. Everyone in the sciences secretly believes that mathematicians are smarter than they are. I think mathematicians also believe this. At any rate, the result is that scientists tend to make their work look as mathematical as possible. In a field like physics this probably doesn't do much harm, but the further you get from the natural sciences, the more of a problem it becomes. A page of formulas just looks so impressive. (Tip: for extra impressiveness, use Greek variables.) And so there is a great temptation to work on problems you can treat formally, rather than problems that are, say, important. If hackers identified with other makers, like writers and painters, they wouldn't feel tempted to do this. Writers and painters don't suffer from math envy. They feel as if they're doing something completely unrelated. So are hackers, I think. If universities and research labs keep hackers from doing the kind of work they want to do, perhaps the place for them is in companies. Unfortunately, most companies won't let hackers do what they want either. Universities and research labs force hackers to be scientists, and companies force them to be engineers. I only discovered this myself quite recently. When Yahoo bought Viaweb, they asked me what I wanted to do. I had never liked the business side very much, and said that I just wanted to hack. When I got to Yahoo, I found that what hacking meant to them was implementing software, not designing it. Programmers were seen as technicians who translated the visions (if that is the word) of product managers into code. This seems to be the default plan in big companies. They do it because it decreases the standard deviation of the outcome. Only a small percentage of hackers can actually design software, and it's hard for the people running a company to pick these out. So instead of entrusting the future of the software to one brilliant hacker, most companies set things up so that it is designed by committee, and the hackers merely implement the design. If you want to make money at some point, remember this, because this is one of the reasons startups win. Big companies want to decrease the standard deviation of design outcomes because they want to avoid disasters. But when you damp oscillations, you lose the high points as well as the low. This is not a problem for big companies, because they don't win by making great products. Big companies win by sucking less than other big companies. So if you can figure out a way to get in a design war with a company big enough that its software is designed by product managers, they'll never be able to keep up with you. These opportunities are not easy to find, though. It's hard to engage a big company in a design war, just as it's hard to engage an opponent inside a castle in hand to hand",5,5,4
What programming languages were created for their own designers to use?,"C, Lisp, and Smalltalk","C, Lisp, and Smalltalk were created for their own designers to use.","You can see the same thing in programming languages. C, Lisp, and Smalltalk were created for their own designers to use. Cobol, Ada, and Java, were created for other people to use. If you think you're designing something for idiots, the odds are that you're not designing something good, even for idiots. Even if you're designing something for the most sophisticated users, though, you're still designing for humans. It's different in research. In math you don't choose abstractions because they're easy for humans to understand; you choose whichever make the proof shorter. I think this is true for the sciences generally. Scientific ideas are not meant to be ergonomic. Over in the arts, things are very different. Design is all about people. The human body is a strange thing, but when you're designing a chair, that's what you're designing for, and there's no way around it. All the arts have to pander to the interests and limitations of humans. In painting, for example, all other things being equal a painting with people in it will be more interesting than one without. It is not merely an accident of history that the great paintings of the Renaissance are all full of people. If they hadn't been, painting as a medium wouldn't have the prestige that it does. Like it or not, programming languages are also for people, and I suspect the human brain is just as lumpy and idiosyncratic as the human body. Some ideas are easy for people to grasp and some aren't. For example, we seem to have a very limited capacity for dealing with detail. It's this fact that makes programing languages a good idea in the first place; if we could handle the detail, we could just program in machine language. Remember, too, that languages are not primarily a form for finished programs, but something that programs have to be developed in. Anyone in the arts could tell you that you might want different mediums for the two situations. Marble, for example, is a nice, durable medium for finished ideas, but a hopelessly inflexible one for developing new ideas. A program, like a proof, is a pruned version of a tree that in the past has had false starts branching off all over it. So the test of a language is not simply how clean the finished program looks in it, but how clean the path to the finished program was. A design choice that gives you elegant finished programs may not give you an elegant design process. For example, I've written a few macro-defining macros full of nested backquotes that look now like little gems, but writing them took hours of the ugliest trial and error, and frankly, I'm still not entirely sure they're correct. We often act as if the test of a language were how good finished programs look in it. It seems so convincing when you see the same program written in two languages, and one version is much shorter. When you approach",5,4,5
Why do adults conceal death from kids?,Probably because small children are particularly horrified by it.,Probably because small children are particularly horrified by it.,"helpless creatures, considering human offspring are so helpless for so long. Without the helplessness that makes kids cute, they'd be very annoying. They'd merely seem like incompetent adults. But there's more to it than that. The reason our hypothetical jaded 10 year old bothers me so much is not just that he'd be annoying, but that he'd have cut off his prospects for growth so early. To be jaded you have to think you know how the world works, and any theory a 10 year old had about that would probably be a pretty narrow one. Innocence is also open-mindedness. We want kids to be innocent so they can continue to learn. Paradoxical as it sounds, there are some kinds of knowledge that get in the way of other kinds of knowledge. If you're going to learn that the world is a brutal place full of people trying to take advantage of one another, you're better off learning it last. Otherwise you won't bother learning much more. Very smart adults often seem unusually innocent, and I don't think this is a coincidence. I think they've deliberately avoided learning about certain things. Certainly I do. I used to think I wanted to know everything. Now I know I don't. Death After sex, death is the topic adults lie most conspicuously about to kids. Sex I believe they conceal because of deep taboos. But why do we conceal death from kids? Probably because small children are particularly horrified by it. They want to feel safe, and death is the ultimate threat. One of the most spectacular lies our parents told us was about the death of our first cat. Over the years, as we asked for more details, they were compelled to invent more, so the story grew quite elaborate. The cat had died at the vet's office. Of what? Of the anaesthesia itself. Why was the cat at the vet's office? To be fixed. And why had such a routine operation killed it? It wasn't the vet's fault; the cat had a congenitally weak heart; the anaesthesia was too much for it; but there was no way anyone could have known this in advance. It was not till we were in our twenties that the truth came out: my sister, then about three, had accidentally stepped on the cat and broken its back. They didn't feel the need to tell us the cat was now happily in cat heaven. My parents never claimed that people or animals who died had gone to a better place, or that we'd meet them again. It didn't seem to harm us. My grandmother told us an edited version of the death of my grandfather. She said they'd been sitting reading one day, and when she said something to him, he didn't answer. He seemed to be asleep, but when she tried to rouse him, she couldn't. He was gone. Having a heart attack sounded like falling asleep. Later I learned it hadn't been so neat,",5,4,4
What is one effective technique to magnify independent-mindedness?,Simply to be less aware what conventional beliefs are.,One of the most effective techniques is one practiced unintentionally by most nerds: simply to be less aware what conventional beliefs are.,"think so. This quality may be largely inborn, but there seem to be ways to magnify it, or at least not to suppress it. One of the most effective techniques is one practiced unintentionally by most nerds: simply to be less aware what conventional beliefs are. It's hard to be a conformist if you don't know what you're supposed to conform to. Though again, it may be that such people already are independent-minded. A conventional-minded person would probably feel anxious not knowing what other people thought, and make more effort to find out. It matters a lot who you surround yourself with. If you're surrounded by conventional-minded people, it will constrain which ideas you can express, and that in turn will constrain which ideas you have. But if you surround yourself with independent-minded people, you'll have the opposite experience: hearing other people say surprising things will encourage you to, and to think of more. Because the independent-minded find it uncomfortable to be surrounded by conventional-minded people, they tend to self-segregate once they have a chance to. The problem with high school is that they haven't yet had a chance to. Plus high school tends to be an inward-looking little world whose inhabitants lack confidence, both of which magnify the forces of conformism. So high school is often a bad time for the independent-minded. But there is some advantage even here: it teaches you what to avoid. If you later find yourself in a situation that makes you think """"this is like high school,"""" you know you should get out. Another place where the independent- and conventional-minded are thrown together is in successful startups. The founders and early employees are almost always independent-minded; otherwise the startup wouldn't be successful. But conventional-minded people greatly outnumber independent-minded ones, so as the company grows, the original spirit of independent-mindedness is inevitably diluted. This causes all kinds of problems besides the obvious one that the company starts to suck. One of the strangest is that the founders find themselves able to speak more freely with founders of other companies than with their own employees. Fortunately you don't have to spend all your time with independent-minded people. It's enough to have one or two you can talk to regularly. And once you find them, they're usually as eager to talk as you are; they need you too. Although universities no longer have the kind of monopoly they used to have on education, good universities are still an excellent way to meet independent-minded people. Most students will still be conventional-minded, but you'll at least find clumps of independent-minded ones, rather than the near zero you may have found in high school. It also works to go in the other direction: as well as cultivating a small collection of independent-minded friends, to try to meet as many different types of people as you can. It will decrease the influence of your immediate peers if you have several other groups of peers. Plus if you're part of several different",5,4,5
What is one reason startups in Europe face obstacles?,"The famously rigid labor laws hurt every company, but startups especially, because startups have the least time to spare for bureaucratic hassles.","The famously rigid labor laws hurt every company, but startups especially, because startups have the least time to spare for bureaucratic hassles.","that all universities are roughly equal in quality. The downside is that none are especially good. The best professors are spread out, instead of being concentrated as they are in the US. This probably makes them less productive, because they don't have good colleagues to inspire them. It also means no one university will be good enough to act as a mecca, attracting talent from abroad and causing startups to form around it. The case of Germany is a strange one. The Germans invented the modern university, and up till the 1930s theirs were the best in the world. Now they have none that stand out. As I was mulling this over, I found myself thinking: I can understand why German universities declined in the 1930s, after they excluded Jews. But surely they should have bounced back by now. Then I realized: maybe not. There are few Jews left in Germany and most Jews I know would not want to move there. And if you took any great American university and removed the Jews, you'd have some pretty big gaps. So maybe it would be a lost cause trying to create a silicon valley in Germany, because you couldn't establish the level of university you'd need as a seed. It's natural for US universities to compete with one another because so many are private. To reproduce the quality of American universities you probably also have to reproduce this. If universities are controlled by the central government, log-rolling will pull them all toward the mean: the new Institute of X will end up at the university in the district of a powerful politician, instead of where it should be. 5. You Can Fire People in America. I think one of the biggest obstacles to creating startups in Europe is the attitude toward employment. The famously rigid labor laws hurt every company, but startups especially, because startups have the least time to spare for bureaucratic hassles. The difficulty of firing people is a particular problem for startups because they have no redundancy. Every person has to do their job well. But the problem is more than just that some startup might have a problem firing someone they needed to. Across industries and countries, there's a strong inverse correlation between performance and job security. Actors and directors are fired at the end of each film, so they have to deliver every time. Junior professors are fired by default after a few years unless the university chooses to grant them tenure. Professional athletes know they'll be pulled if they play badly for just a couple games. At the other end of the scale (at least in the US) are auto workers, New York City schoolteachers, and civil servants, who are all nearly impossible to fire. The trend is so clear that you'd have to be willfully blind not to see it. Performance isn't everything, you say? Well, are auto workers, schoolteachers, and civil servants happier than actors, professors, and professional athletes? European public opinion",5,4,4
What is the typical range of an angel investment?,"$10,000 to hundreds of thousands or in rare cases even millions.","How much does an angel invest? That varies enormously, from $10,000 to hundreds of thousands or in rare cases even millions.","investor, they're not saying He got a 4x liquidation preference. They're saying He invested in Google. That's how you win: by investing in the right startups. That is so much more important than anything else that I worry I'm misleading you by even talking about other things. Mechanics Angel investors often syndicate deals, which means they join together to invest on the same terms. In a syndicate there is usually a lead investor who negotiates the terms with the startup. But not always: sometimes the startup cobbles together a syndicate of investors who approach them independently, and the startup's lawyer supplies the paperwork. The easiest way to get started in angel investing is to find a friend who already does it, and try to get included in his syndicates. Then all you have to do is write checks. Don't feel like you have to join a syndicate, though. It's not that hard to do it yourself. You can just use the standard series AA documents Wilson Sonsini and Y Combinator published online. You should of course have your lawyer review everything. Both you and the startup should have lawyers. But the lawyers don't have to create the agreement from scratch. When you negotiate terms with a startup, there are two numbers you care about: how much money you're putting in, and the valuation of the company. The valuation determines how much stock you get. If you put $50,000 into a company at a pre-money valuation of $1 million, then the post-money valuation is $1.05 million, and you get .05/1.05, or 4.76% of the company's stock. If the company raises more money later, the new investor will take a chunk of the company away from all the existing shareholders just as you did. If in the next round they sell 10% of the company to a new investor, your 4.76% will be reduced to 4.28%. That's ok. Dilution is normal. What saves you from being mistreated in future rounds, usually, is that you're in the same boat as the founders. They can't dilute you without diluting themselves just as much. And they won't dilute themselves unless they end up net ahead. So in theory, each further round of investment leaves you with a smaller share of an even more valuable company, till after several more rounds you end up with .5% of the company at the point where it IPOs, and you are very happy because your $50,000 has become $5 million. The agreement by which you invest should have provisions that let you contribute to future rounds to maintain your percentage. So it's your choice whether you get diluted. If the company does really well, you eventually will, because eventually the valuations will get so high it's not worth it for you. How much does an angel invest? That varies enormously, from $10,000 to hundreds of thousands or in rare cases even millions. The upper bound is obviously the total amount the founders want to raise. The lower bound is",5,4,4
Why do startups rarely get sued for patent infringement?,Startups are too poor to be worth suing for money and patent suits are an expensive distraction for other startups.,"We tell the startups we fund not to worry about infringing patents, because startups rarely get sued for patent infringement.","describing how companies may and may not compete with one another, and someone deciding that they're going to play by their own rules is missing the point. Saying I'm not going to apply for patents just because everyone else does is not like saying I'm not going to lie just because everyone else does. It's more like saying I'm not going to use TCP/IP just because everyone else does. Oh yes you are. A closer comparison might be someone seeing a hockey game for the first time, realizing with shock that the players were deliberately bumping into one another, and deciding that one would on no account be so rude when playing hockey oneself. Hockey allows checking. It's part of the game. If your team refuses to do it, you simply lose. So it is in business. Under the present rules, patents are part of the game. What does that mean in practice? We tell the startups we fund not to worry about infringing patents, because startups rarely get sued for patent infringement. There are only two reasons someone might sue you: for money, or to prevent you from competing with them. Startups are too poor to be worth suing for money. And in practice they don't seem to get sued much by competitors, either. They don't get sued by other startups because (a) patent suits are an expensive distraction, and (b) since the other startups are as young as they are, their patents probably haven't issued yet. Nor do startups, at least in the software business, seem to get sued much by established competitors. Despite all the patents Microsoft holds, I don't know of an instance where they sued a startup for patent infringement. Companies like Microsoft and Oracle don't win by winning lawsuits. That's too uncertain. They win by locking competitors out of their sales channels. If you do manage to threaten them, they're more likely to buy you than sue you. When you read of big companies filing patent suits against smaller ones, it's usually a big company on the way down, grasping at straws. For example, Unisys's attempts to enforce their patent on LZW compression. When you see a big company threatening patent suits, sell. When a company starts fighting over IP, it's a sign they've lost the real battle, for users. A company that sues competitors for patent infringement is like a defender who has been beaten so thoroughly that he turns to plead with the referee. You don't do that if you can still reach the ball, even if you genuinely believe you've been fouled. So a company threatening patent suits is a company in trouble. When we were working on Viaweb, a bigger company in the e-commerce business was granted a patent on online ordering, or something like that. I got a call from a VP there asking if we'd like to license it. I replied that I thought the patent was completely bogus, and would never hold up in court. Ok, he",5,4,4
What do successful startup founders tend to be?,Good people,"she has always been struck both by how consistently successful startup founders turn out to be good people, and how consistently bad people fail as startup founders.","that successful people in other fields are mean. Maybe successful hedge fund managers are mean; I don't know enough to say. It seems quite likely that most successful drug lords are mean. But there are at least big chunks of the world that mean people don't rule, and that territory seems to be growing. My wife and Y Combinator cofounder Jessica is one of those rare people who have x-ray vision for character. Being married to her is like standing next to an airport baggage scanner. She came to the startup world from investment banking, and she has always been struck both by how consistently successful startup founders turn out to be good people, and how consistently bad people fail as startup founders. Why? I think there are several reasons. One is that being mean makes you stupid. That's why I hate fights. You never do your best work in a fight, because fights are not sufficiently general. Winning is always a function of the situation and the people involved. You don't win fights by thinking of big ideas but by thinking of tricks that work in one particular case. And yet fighting is just as much work as thinking about real problems. Which is particularly painful to someone who cares how their brain is used: your brain goes fast but you get nowhere, like a car spinning its wheels. Startups don't win by attacking. They win by transcending. There are exceptions of course, but usually the way to win is to race ahead, not to stop and fight. Another reason mean founders lose is that they can't get the best people to work for them. They can hire people who will put up with them because they need a job. But the best people have other options. A mean person can't convince the best people to work for him unless he is super convincing. And while having the best people helps any organization, it's critical for startups. There is also a complementary force at work: if you want to build great things, it helps to be driven by a spirit of benevolence. The startup founders who end up richest are not the ones driven by money. The ones driven by money take the big acquisition offer that nearly every successful startup gets en route. The ones who keep going are driven by something else. They may not say so explicitly, but they're usually trying to improve the world. Which means people with a desire to improve the world have a natural advantage. The exciting thing is that startups are not just one random type of work in which meanness and success are inversely correlated. This kind of work is the future. For most of history success meant control of scarce resources. One got that by fighting, whether literally in the case of pastoral nomads driving hunter-gatherers into marginal lands, or metaphorically in the case of Gilded Age financiers contending with one another to assemble railroad monopolies. For most of",5,4,4
What is a common characteristic of classic startups?,"The classic startup is fast and informal, with few people and little money.","The classic startup is fast and informal, with few people and little money.","need to do is cannibalize their existing business, and I can't see them facing that. The same single-mindedness that has brought them this far will now be working against them. IBM was in exactly the same situation, and they could not master it. IBM made a late and half-hearted entry into the microcomputer business because they were ambivalent about threatening their cash cow, mainframe computing. Microsoft will likewise be hampered by wanting to save the desktop. A cash cow can be a damned heavy monkey on your back. I'm not saying that no one will dominate server-based applications. Someone probably will eventually. But I think that there will be a good long period of cheerful chaos, just as there was in the early days of microcomputers. That was a good time for startups. Lots of small companies flourished, and did it by making cool things. Startups but More So The classic startup is fast and informal, with few people and little money. Those few people work very hard, and technology magnifies the effect of the decisions they make. If they win, they win big. In a startup writing Web-based applications, everything you associate with startups is taken to an extreme. You can write and launch a product with even fewer people and even less money. You have to be even faster, and you can get away with being more informal. You can literally launch your product as three guys sitting in the living room of an apartment, and a server collocated at an ISP. We did. Over time the teams have gotten smaller, faster, and more informal. In 1960, software development meant a roomful of men with horn rimmed glasses and narrow black neckties, industriously writing ten lines of code a day on IBM coding forms. In 1980, it was a team of eight to ten people wearing jeans to the office and typing into vt100s. Now it's a couple of guys sitting in a living room with laptops. (And jeans turn out not to be the last word in informality.) Startups are stressful, and this, unfortunately, is also taken to an extreme with Web-based applications. Many software companies, especially at the beginning, have periods where the developers slept under their desks and so on. The alarming thing about Web-based software is that there is nothing to prevent this becoming the default. The stories about sleeping under desks usually end: then at last we shipped it and we all went home and slept for a week. Web-based software never ships. You can work 16-hour days for as long as you want to. And because you can, and your competitors can, you tend to be forced to. You can, so you must. It's Parkinson's Law running in reverse. The worst thing is not the hours but the responsibility. Programmers and system administrators traditionally each have their own separate worries. Programmers have to worry about bugs, and system administrators have to worry about infrastructure. Programmers may spend a long day up to",5,4,5
What do investors prefer when approached by startups?,Investors greatly prefer it if you don't need them.,"And in fact, investors greatly prefer it if you don't need them.","And in fact, investors greatly prefer it if you don't need them. What excites them, both consciously and unconsciously, is the sort of startup that approaches them saying the train's leaving the station; are you in or out? not the one saying please can we have some money to start a company? Most investors are bottoms in the sense that the startups they like most are those that are rough with them. When Google stuck Kleiner and Sequoia with a $75 million premoney valuation, their reaction was probably Ouch! That feels so good. And they were right, weren't they? That deal probably made them more than any other they've done. The thing is, VCs are pretty good at reading people. So don't try to act tough with them unless you really are the next Google, or they'll see through you in a second. Instead of acting tough, what most startups should do is simply always have a backup plan. Always have some alternative plan for getting started if any given investor says no. Having one is the best insurance against needing one. So you shouldn't start a startup that's expensive to start, because then you'll be at the mercy of investors. If you ultimately want to do something that will cost a lot, start by doing a cheaper subset of it, and expand your ambitions when and if you raise more money. Apparently the most likely animals to be left alive after a nuclear war are cockroaches, because they're so hard to kill. That's what you want to be as a startup, initially. Instead of a beautiful but fragile flower that needs to have its stem in a plastic tube to support itself, better to be small, ugly, and indestructible. I may be underestimating VCs. They may play some behind the scenes role in IPOs, which you ultimately need if you want to create a silicon valley. A few VCs have an email address you can send your business plan to, but the number of startups that get funded this way is basically zero. You should always get a personal introductionâ€”and to a partner, not an associate. Several people have told us that the most valuable thing about startup school was that they got to see famous startup founders and realized they were just ordinary guys. Though we're happy to provide this service, this is not generally the way we pitch startup school to potential speakers. Actually this sounds to me like a VC who got buyer's remorse, then used a technicality to get out of the deal. But it's telling that it even seemed a plausible excuse. There are two different ways people judge you. Sometimes judging you correctly is the end goal. But there's a second much more common type of judgement where it isn't. We tend to regard all judgements of us as the first type. We'd probably be happier if we realized which are and which aren't. The first type of judgement, the type where judging",5,4,4
What is one reason a startup might choose to stay in its original location instead of moving to a startup hub?,A good investor has committed to fund you if you stay where you are.,"And finally, if a good investor has committed to fund you if you stay where you are, you should probably stay.","be willing to claim that it doesn't matter at all where a startup is that a startup operating out of a small agricultural town wouldn't benefit from moving to a startup hub. Most people could see how it might be helpful to be in a place where there was infrastructure for startups, accumulated knowledge about how to make them work, and other people trying to do it. And yet whatever argument you use to prove that startups don't need to move from London to Silicon Valley could equally well be used to prove startups don't need to move from smaller towns to London. The difference between cities is a matter of degree. And if, as nearly everyone who knows agrees, startups are better off in Silicon Valley than Boston, then they're better off in Silicon Valley than everywhere else too. I realize I might seem to have a vested interest in this conclusion, because startups that move to the US might do it through Y Combinator. But the American startups we've funded will attest that I say the same thing to them. I'm not claiming of course that every startup has to go to Silicon Valley to succeed. Just that all other things being equal, the more of a startup hub a place is, the better startups will do there. But other considerations can outweigh the advantages of moving. I'm not saying founders with families should uproot them to move halfway around the world; that might be too much of a distraction. Immigration difficulties might be another reason to stay put. Dealing with immigration problems is like raising money: for some reason it seems to consume all your attention. A startup can't afford much of that. One Canadian startup we funded spent about 6 months working on moving to the US. Eventually they just gave up, because they couldn't afford to take so much time away from working on their software. (If another country wanted to establish a rival to Silicon Valley, the single best thing they could do might be to create a special visa for startup founders. US immigration policy is one of Silicon Valley's biggest weaknesses.) If your startup is connected to a specific industry, you may be better off in one of its centers. A startup doing something related to entertainment might want to be in New York or LA. And finally, if a good investor has committed to fund you if you stay where you are, you should probably stay. Finding investors is hard. You generally shouldn't pass up a definite funding offer to move. In fact, the quality of the investors may be the main advantage of startup hubs. Silicon Valley investors are noticeably more aggressive than Boston ones. Over and over, I've seen startups we've funded snatched by west coast investors out from under the noses of Boston investors who saw them first but acted too slowly. At this year's Boston Demo Day, I told the audience that this happened every year, so",5,4,5
What is the critical mass of users needed for a programming language to be considered real?,Twenty.,"Off the top of my head, I'd say twenty.","real live users always leads to improvements. Look at how much any popular language has changed during its life. Perl and Fortran are extreme cases, but even Lisp has changed a lot. Lisp 1.5 didn't have macros, for example; these evolved later, after hackers at MIT had spent a couple years using Lisp to write real programs. So whether or not a language has to be good to be popular, I think a language has to be popular to be good. And it has to stay popular to stay good. The state of the art in programming languages doesn't stand still. And yet the Lisps we have today are still pretty much what they had at MIT in the mid-1980s, because that's the last time Lisp had a sufficiently large and demanding user base. Of course, hackers have to know about a language before they can use it. How are they to hear? From other hackers. But there has to be some initial group of hackers using the language for others even to hear about it. I wonder how large this group has to be; how many users make a critical mass? Off the top of my head, I'd say twenty. If a language had twenty separate users, meaning twenty users who decided on their own to use it, I'd consider it to be real. Getting there can't be easy. I would not be surprised if it is harder to get from zero to twenty than from twenty to a thousand. The best way to get those initial twenty users is probably to use a trojan horse: to give people an application they want, which happens to be written in the new language. External Factors: Let's start by acknowledging one external factor that does affect the popularity of a programming language. To become popular, a programming language has to be the scripting language of a popular system. Fortran and Cobol were the scripting languages of early IBM mainframes. C was the scripting language of Unix, and so, later, was Perl. Tcl is the scripting language of Tk. Java and Javascript are intended to be the scripting languages of web browsers. Lisp is not a massively popular language because it is not the scripting language of a massively popular system. What popularity it retains dates back to the 1960s and 1970s, when it was the scripting language of MIT. A lot of the great programmers of the day were associated with MIT at some point. And in the early 1970s, before C, MIT's dialect of Lisp, called MacLisp, was one of the only programming languages a serious hacker would want to use. Today Lisp is the scripting language of two moderately popular systems, Emacs and Autocad, and for that reason I suspect that most of the Lisp programming done today is done in Emacs Lisp or AutoLisp. Programming languages don't exist in isolation. To hack is a transitive verb â€” hackers are usually hacking something â€” and in practice languages are",5,4,4
What is a typical VC fund size?,hundreds of millions of dollars,A typical VC fund is now hundreds of millions of dollars.,"they won't let you sell early. 7. VCs want to invest large amounts. The fact that they're running investment funds makes VCs want to invest large amounts. A typical VC fund is now hundreds of millions of dollars. If $400 million has to be invested by 10 partners, they have to invest $40 million each. VCs usually sit on the boards of companies they fund. If the average deal size was $1 million, each partner would have to sit on 40 boards, which would not be fun. So they prefer bigger deals, where they can put a lot of money to work at once. VCs don't regard you as a bargain if you don't need a lot of money. That may even make you less attractive, because it means their investment creates less of a barrier to entry for competitors. Angels are in a different position because they're investing their own money. They're happy to invest small amountsâ€”sometimes as little as $20,000 as long as the potential returns look good enough. So if you're doing something inexpensive, go to angels. 8. Valuations are fiction. VCs admit that valuations are an artifact. They decide how much money you need and how much of the company they want, and those two constraints yield a valuation. Valuations increase as the size of the investment does. A company that an angel is willing to put $50,000 into at a valuation of a million can't take $6 million from VCs at that valuation. That would leave the founders less than a seventh of the company between them (since the option pool would also come out of that seventh). Most VCs wouldn't want that, which is why you never hear of deals where a VC invests $6 million at a premoney valuation of $1 million. If valuations change depending on the amount invested, that shows how far they are from reflecting any kind of value of the company. Since valuations are made up, founders shouldn't care too much about them. That's not the part to focus on. In fact, a high valuation can be a bad thing. If you take funding at a premoney valuation of $10 million, you won't be selling the company for 20. You'll have to sell for over 50 for the VCs to get even a 5x return, which is low to them. More likely they'll want you to hold out for 100. But needing to get a high price decreases the chance of getting bought at all; many companies can buy you for $10 million, but only a handful for 100. And since a startup is like a pass/fail course for the founders, what you want to optimize is your chance of a good outcome, not the percentage of the company you keep. So why do founders chase high valuations? They're tricked by misplaced ambition. They feel they've achieved more if they get a higher valuation. They usually know other founders, and if they get a higher valuation they can say",5,4,4
What is the crucial feature of the initial market for a startup?,That it exists.,The crucial feature of the initial market is that it exist.,"the web. All these founders were building things they and their peers wanted, and the fact that they were at the leading edge of change meant that more people would want these things in the future. But although the ideal larval market is oneself and one's peers, that's not the only kind. A larval market might also be regional, for example. You build something to serve one location, and then expand to others. The crucial feature of the initial market is that it exist. That may seem like an obvious point, but the lack of it is the biggest flaw in most startup ideas. There have to be some people who want what you're building right now, and want it so urgently that they're willing to use it, bugs and all, even though you're a small company they've never heard of. There don't have to be many, but there have to be some. As long as you have some users, there are straightforward ways to get more: build new features they want, seek out more people like them, get them to refer you to their friends, and so on. But these techniques all require some initial seed group of users. So this is one thing the YC partners will almost certainly dig into during your interview. Who are your first users going to be, and how do you know they want this? If I had to decide whether to fund startups based on a single question, it would be How do you know people want this? The most convincing answer is """"Because we and our friends want it."""" It's even better when this is followed by the news that you've already built a prototype, and even though it's very crude, your friends are using it, and it's spreading by word of mouth. If you can say that and you're not lying, the partners will switch from default no to default yes. Meaning you're in unless there's some other disqualifying flaw. That is a hard standard to meet, though. Airbnb didn't meet it. They had the first part. They had made something they themselves wanted. But it wasn't spreading. So don't feel bad if you don't hit this gold standard of convincingness. If Airbnb didn't hit it, it must be too high. In practice, the YC partners will be satisfied if they feel that you have a deep understanding of your users' needs. And the Airbnbs did have that. They were able to tell us all about what motivated hosts and guests. They knew from first-hand experience, because they'd been the first hosts. We couldn't ask them a question they didn't know the answer to. We ourselves were not very excited about the idea as users, but we knew this didn't prove anything, because there were lots of successful startups we hadn't been excited about as users. We were able to say to ourselves """"They seem to know what they're talking about. Maybe they're onto something. It's not growing yet, but",5,4,4
What is a typical angel round amount raised?,"A typical angel round these days might be $150,000 raised from 5 people.","A typical angel round these days might be $150,000 raised from 5 people.","with a startup, there are two numbers you care about: how much money you're putting in, and the valuation of the company. The valuation determines how much stock you get. If you put $50,000 into a company at a pre-money valuation of $1 million, then the post-money valuation is $1.05 million, and you get .05/1.05, or 4.76% of the company's stock. If the company raises more money later, the new investor will take a chunk of the company away from all the existing shareholders just as you did. If in the next round they sell 10% of the company to a new investor, your 4.76% will be reduced to 4.28%. That's ok. Dilution is normal. What saves you from being mistreated in future rounds, usually, is that you're in the same boat as the founders. They can't dilute you without diluting themselves just as much. And they won't dilute themselves unless they end up net ahead. So in theory, each further round of investment leaves you with a smaller share of an even more valuable company, till after several more rounds you end up with .5% of the company at the point where it IPOs, and you are very happy because your $50,000 has become $5 million. The agreement by which you invest should have provisions that let you contribute to future rounds to maintain your percentage. So it's your choice whether you get diluted. If the company does really well, you eventually will, because eventually the valuations will get so high it's not worth it for you. How much does an angel invest? That varies enormously, from $10,000 to hundreds of thousands or in rare cases even millions. The upper bound is obviously the total amount the founders want to raise. The lower bound is 5-10% of the total or $10,000, whichever is greater. A typical angel round these days might be $150,000 raised from 5 people. Valuations don't vary as much. For angel rounds it's rare to see a valuation lower than half a million or higher than 4 or 5 million. 4 million is starting to be VC territory. How do you decide what valuation to offer? If you're part of a round led by someone else, that problem is solved for you. But what if you're investing by yourself? There's no real answer. There is no rational way to value an early stage startup. The valuation reflects nothing more than the strength of the company's bargaining position. If they really want you, either because they desperately need money, or you're someone who can help them a lot, they'll let you invest at a low valuation. If they don't need you, it will be higher. So guess. The startup may not have any more idea what the number should be than you do. Ultimately it doesn't matter much. When angels make a lot of money from a deal, it's not because they invested at a valuation of $1.5 million instead of $3 million. It's because the company",5,4,4
What is the biggest flaw in most startup ideas?,The lack of an initial market.,"The crucial feature of the initial market is that it exist. That may seem like an obvious point, but the lack of it is the biggest flaw in most startup ideas.","are building something they themselves want. Most super-successful startups are of this type. Steve Wozniak wanted a computer. Mark Zuckerberg wanted to engage online with his college friends. Larry and Sergey wanted to find things on the web. All these founders were building things they and their peers wanted, and the fact that they were at the leading edge of change meant that more people would want these things in the future. But although the ideal larval market is oneself and one's peers, that's not the only kind. A larval market might also be regional, for example. You build something to serve one location, and then expand to others. The crucial feature of the initial market is that it exist. That may seem like an obvious point, but the lack of it is the biggest flaw in most startup ideas. There have to be some people who want what you're building right now, and want it so urgently that they're willing to use it, bugs and all, even though you're a small company they've never heard of. There don't have to be many, but there have to be some. As long as you have some users, there are straightforward ways to get more: build new features they want, seek out more people like them, get them to refer you to their friends, and so on. But these techniques all require some initial seed group of users. So this is one thing the YC partners will almost certainly dig into during your interview. Who are your first users going to be, and how do you know they want this? If I had to decide whether to fund startups based on a single question, it would be How do you know people want this? The most convincing answer is """"Because we and our friends want it."""" It's even better when this is followed by the news that you've already built a prototype, and even though it's very crude, your friends are using it, and it's spreading by word of mouth. If you can say that and you're not lying, the partners will switch from default no to default yes. Meaning you're in unless there's some other disqualifying flaw. That is a hard standard to meet, though. Airbnb didn't meet it. They had the first part. They had made something they themselves wanted. But it wasn't spreading. So don't feel bad if you don't hit this gold standard of convincingness. If Airbnb didn't hit it, it must be too high. In practice, the YC partners will be satisfied if they feel that you have a deep understanding of your users' needs. And the Airbnbs did have that. They were able to tell us all about what motivated hosts and guests. They knew from first-hand experience, because they'd been the first hosts. We couldn't ask them a question they didn't know the answer to. We ourselves were not very excited about the idea as users, but we knew this didn't prove anything, because there",5,4,4
What is a down round in venture capital?,A down round is a funding round at a valuation lower than the previous round.,"One new thing the company might encounter is a down round, or a funding round at valuation lower than the previous round.","out to do due diligence for VCs. So the most difficult part for startup founders is often responding politely to the inane questions of the expert they send to look you over. VCs regularly wipe out angels by issuing arbitrary amounts of new stock. They seem to have a standard piece of casuistry for this situation: that the angels are no longer working to help the company, and so don't deserve to keep their stock. This of course reflects a willful misunderstanding of what investment means; like any investor, the angel is being compensated for risks he took earlier. By a similar logic, one could argue that the VCs should be deprived of their shares when the company goes public. One new thing the company might encounter is a down round, or a funding round at valuation lower than the previous round. Down rounds are bad news; it is generally the common stock holders who take the hit. Some of the most fearsome provisions in VC deal terms have to do with down rounds like full ratchet anti-dilution, which is as frightening as it sounds. Founders are tempted to ignore these clauses, because they think the company will either be a big success or a complete bust. VCs know otherwise: it's not uncommon for startups to have moments of adversity before they ultimately succeed. So it's worth negotiating anti-dilution provisions, even though you don't think you need to, and VCs will try to make you feel that you're being gratuitously troublesome. In the next few years, venture capital funds will find themselves squeezed from four directions. They're already stuck with a seller's market, because of the huge amounts they raised at the end of the Bubble and still haven't invested. This by itself is not the end of the world. In fact, it's just a more extreme version of the norm in the VC business: too much money chasing too few deals. Unfortunately, those few deals now want less and less money, because it's getting so cheap to start a startup. The four causes: open source, which makes software free; Moore's law, which makes hardware geometrically closer to free; the Web, which makes promotion free if you're good; and better languages, which make development a lot cheaper. When we started our startup in 1995, the first three were our biggest expenses. We had to pay $5000 for the Netscape Commerce Server, the only software that then supported secure http connections. We paid $3000 for a server with a 90 MHz processor and 32 meg of memory. And we paid a PR firm about $30,000 to promote our launch. Now you could get all three for nothing. You can get the software for free; people throw away computers more powerful than our first server; and if you make something good you can generate ten times as much traffic by word of mouth online than our first PR firm got through the print media. And of course another big change for the",5,4,4
What type of space is recommended for startups?,An apartment is recommended for startups.,I'd advise most startups to avoid corporate space at first and just rent an apartment.,"the type, all too common then, that was like a bunch of kids playing house with money supplied by VCs. We had office chairs so cheap that the arms all fell off. This was slightly embarrassing at the time, but in retrospect the grad-studenty atmosphere of our office was another of those things we did right without knowing it. Our offices were in a wooden triple-decker in Harvard Square. It had been an apartment until about the 1970s, and there was still a claw-footed bathtub in the bathroom. It must once have been inhabited by someone fairly eccentric, because a lot of the chinks in the walls were stuffed with aluminum foil, as if to protect against cosmic rays. When eminent visitors came to see us, we were a bit sheepish about the low production values. But in fact that place was the perfect space for a startup. We felt like our role was to be impudent underdogs instead of corporate stuffed shirts, and that is exactly the spirit you want. An apartment is also the right kind of place for developing software. Cube farms suck for that, as you've probably discovered if you've tried it. Ever notice how much easier it is to hack at home than at work? So why not make work more like home? When you're looking for space for a startup, don't feel that it has to look professional. Professional means doing good work, not elevators and glass walls. I'd advise most startups to avoid corporate space at first and just rent an apartment. You want to live at the office in a startup, so why not have a place designed to be lived in as your office? Besides being cheaper and better to work in, apartments tend to be in better locations than office buildings. And for a startup location is very important. The key to productivity is for people to come back to work after dinner. Those hours after the phone stops ringing are by far the best for getting work done. Great things happen when a group of employees go out to dinner together, talk over ideas, and then come back to their offices to implement them. So you want to be in a place where there are a lot of restaurants around, not some dreary office park that's a wasteland after 6:00 PM. Once a company shifts over into the model where everyone drives home to the suburbs for dinner, however late, you've lost something extraordinarily valuable. God help you if you actually start in that mode. If I were going to start a startup today, there are only three places I'd consider doing it: on the Red Line near Central, Harvard, or Davis Squares (Kendall is too sterile); in Palo Alto on University or California Aves; and in Berkeley immediately north or south of campus. These are the only places I know that have the right kind of vibe. The most important way to not spend money is by not",5,4,4
What are the four factors in doing great work?,"ability, interest, effort, and luck","factors in doing great work are factors in the literal, mathematical sense, and they are: ability, interest, effort, and luck.","factors in doing great work are factors in the literal, mathematical sense, and they are: ability, interest, effort, and luck. Luck by definition you can't do anything about, so we can ignore that. And we can assume effort, if you do in fact want to do great work. So the problem boils down to ability and interest. Can you find a kind of work where your ability and interest will combine to yield an explosion of new ideas? Here there are grounds for optimism. There are so many different ways to do great work, and even more that are still undiscovered. Out of all those different types of work, the one you're most suited for is probably a pretty close match. Probably a comically close match. It's just a question of finding it, and how far into it your ability and interest can take you. And you can only answer that by trying. Many more people could try to do great work than do. What holds them back is a combination of modesty and fear. It seems presumptuous to try to be Newton or Shakespeare. It also seems hard; surely if you tried something like that, you'd fail. Presumably the calculation is rarely explicit. Few people consciously decide not to try to do great work. But that's what's going on subconsciously; they shy away from the question. So I'm going to pull a sneaky trick on you. Do you want to do great work, or not? Now you have to decide consciously. Sorry about that. I wouldn't have done it to a general audience. But we already know you're interested. Don't worry about being presumptuous. You don't have to tell anyone. And if it's too hard and you fail, so what? Lots of people have worse problems than that. In fact you'll be lucky if it's the worst problem you have. Yes, you'll have to work hard. But again, lots of people have to work hard. And if you're working on something you find very interesting, which you necessarily will if you're on the right path, the work will probably feel less burdensome than a lot of your peers'. The discoveries are out there, waiting to be made. Why not by you? I don't think you could give a precise definition of what counts as great work. Doing great work means doing something important so well that you expand people's ideas of what's possible. But there's no threshold for importance. It's a matter of degree, and often hard to judge at the time anyway. So I'd rather people focused on developing their interests rather than worrying about whether they're important or not. Just try to do something amazing, and leave it to future generations to say if you succeeded. A lot of standup comedy is based on noticing anomalies in everyday life. Did you ever notice...? New ideas come from doing this about nontrivial things. Which may help explain why people's reaction to a new idea is often the first",5,4,4
Why do people find it difficult to work on big problems?,One reason is that you may not get any reward in the foreseeable future.,One reason is that you may not get any reward in the forseeable future.,"I see it there on the page and quickly move on to the next sentence. Hamming used to go around actually asking people this, and it didn't make him popular. But it's a question anyone ambitious should face. The trouble is, you may end up hooking a very big fish with this bait. To do good work, you need to do more than find good projects. Once you've found them, you have to get yourself to work on them, and that can be hard. The bigger the problem, the harder it is to get yourself to work on it. Of course, the main reason people find it difficult to work on a particular problem is that they don't enjoy it. When you're young, especially, you often find yourself working on stuff you don't really like-- because it seems impressive, for example, or because you've been assigned to work on it. Most grad students are stuck working on big problems they don't really like, and grad school is thus synonymous with procrastination. But even when you like what you're working on, it's easier to get yourself to work on small problems than big ones. Why? Why is it so hard to work on big problems? One reason is that you may not get any reward in the forseeable future. If you work on something you can finish in a day or two, you can expect to have a nice feeling of accomplishment fairly soon. If the reward is indefinitely far in the future, it seems less real. Another reason people don't work on big projects is, ironically, fear of wasting time. What if they fail? Then all the time they spent on it will be wasted. (In fact it probably won't be, because work on hard projects almost always leads somewhere.) But the trouble with big problems can't be just that they promise no immediate reward and might cause you to waste a lot of time. If that were all, they'd be no worse than going to visit your in-laws. There's more to it than that. Big problems are terrifying. There's an almost physical pain in facing them. It's like having a vacuum cleaner hooked up to your imagination. All your initial ideas get sucked out immediately, and you don't have any more, and yet the vacuum cleaner is still sucking. You can't look a big problem too directly in the eye. You have to approach it somewhat obliquely. But you have to adjust the angle just right: you have to be facing the big problem directly enough that you catch some of the excitement radiating from it, but not so much that it paralyzes you. You can tighten the angle once you get going, just as a sailboat can sail closer to the wind once it gets underway. If you want to work on big things, you seem to have to trick yourself into doing it. You have to work on small things that could grow into big things, or",5,4,5
What is the optimal approach to talking to investors?,"The optimal solution is to talk to all potential investors in parallel, but give higher priority to the more promising ones.","The optimal solution is to talk to all potential investors in parallel, but give higher priority to the more promising ones.","flush it out. And till they confirm, regard them as saying no. Do breadth-first search weighted by expected value. When you talk to investors your m.o. should be breadth-first search, weighted by expected value. You should always talk to investors in parallel rather than serially. You can't afford the time it takes to talk to investors serially, plus if you only talk to one investor at a time, they don't have the pressure of other investors to make them act. But you shouldn't pay the same attention to every investor, because some are more promising prospects than others. The optimal solution is to talk to all potential investors in parallel, but give higher priority to the more promising ones. Expected value = how likely an investor is to say yes, multiplied by how good it would be if they did. So for example, an eminent investor who would invest a lot, but will be hard to convince, might have the same expected value as an obscure angel who won't invest much, but will be easy to convince. Whereas an obscure angel who will only invest a small amount, and yet needs to meet multiple times before making up his mind, has very low expected value. Meet such investors last, if at all. Doing breadth-first search weighted by expected value will save you from investors who never explicitly say no but merely drift away, because you'll drift away from them at the same rate. It protects you from investors who flake in much the same way that a distributed algorithm protects you from processors that fail. If some investor isn't returning your emails, or wants to have lots of meetings but isn't progressing toward making you an offer, you automatically focus less on them. But you have to be disciplined about assigning probabilities. You can't let how much you want an investor influence your estimate of how much they want you. Know where you stand. How do you judge how well you're doing with an investor, when investors habitually seem more positive than they are? By looking at their actions rather than their words. Every investor has some track they need to move along from the first conversation to wiring the money, and you should always know what that track consists of, where you are on it, and how fast you're moving forward. Never leave a meeting with an investor without asking what happens next. What more do they need in order to decide? Do they need another meeting with you? To talk about what? And how soon? Do they need to do something internally, like talk to their partners, or investigate some issue? How long do they expect it to take? Don't be too pushy, but know where you stand. If investors are vague or resist answering such questions, assume the worst; investors who are seriously interested in you will usually be happy to talk about what has to happen between now and wiring the money, because they're already running",5,4,4
What is the term used to describe the time a startup has before its money runs out?,Runway,"This is sometimes referred to as runway, as in How much runway do you have left?","founders had. Perhaps there's a rule here: perhaps you create wealth in proportion to how well you understand the problem you're solving, and the problems you understand best are your own. That's just a theory. What's not a theory is the converse: if you're trying to solve problems you don't understand, you're hosed. And yet a surprising number of founders seem willing to assume that someone, they're not sure exactly who, will want what they're building. Do the founders want it? No, they're not the target market. Who is? Teenagers. People interested in local events (that one is a perennial tarpit). Or business users. What business users? Gas stations? Movie studios? Defense contractors? You can of course build something for users other than yourself. We did. But you should realize you're stepping into dangerous territory. You're flying on instruments, in effect, so you should (a) consciously shift gears, instead of assuming you can rely on your intuitions as you ordinarily would, and (b) look at the instruments. In this case the instruments are the users. When designing for other people you have to be empirical. You can no longer guess what will work; you have to find users and measure their responses. So if you're going to make something for teenagers or business users or some other group that doesn't include you, you have to be able to talk some specific ones into using what you're making. If you can't, you're on the wrong track. 11. Raising Too Little Money Most successful startups take funding at some point. Like having more than one founder, it seems a good bet statistically. How much should you take, though? Startup funding is measured in time. Every startup that isn't profitable (meaning nearly all of them, initially) has a certain amount of time left before the money runs out and they have to stop. This is sometimes referred to as runway, as in How much runway do you have left? It's a good metaphor because it reminds you that when the money runs out you're going to be airborne or dead. Too little money means not enough to get airborne. What airborne means depends on the situation. Usually you have to advance to a visibly higher level: if all you have is an idea, a working prototype; if you have a prototype, launching; if you're launched, significant growth. It depends on investors, because until you're profitable that's who you have to convince. So if you take money from investors, you have to take enough to get to the next step, whatever that is. Fortunately you have some control over both how much you spend and what the next step is. We advise startups to set both low, initially: spend practically nothing, and make your initial goal simply to build a solid prototype. This gives you maximum flexibility. 12. Spending Too Much It's hard to distinguish spending too much from raising too little. If you run out of money, you could say either was the",5,4,5
What do VCs prefer when investing in deals?,VCs prefer to invest in deals that come to them through people they know.,"Like angels, VCs prefer to invest in deals that come to them through people they know.","interfere much. The danger comes when there's a bump in the road, as happened to Steve Jobs at Apple. Like angels, VCs prefer to invest in deals that come to them through people they know. So while nearly all VC funds have some address you can send your business plan to, VCs privately admit the chance of getting funding by this route is near zero. One recently told me that he did not know a single startup that got funded this way. I suspect VCs accept business plans over the transom more as a way to keep tabs on industry trends than as a source of deals. In fact, I would strongly advise against mailing your business plan randomly to VCs, because they treat this as evidence of laziness. Do the extra work of getting personal introductions. As one VC put it: I'm not hard to find. I know a lot of people. If you can't find some way to reach me, how are you going to create a successful company? One of the most difficult problems for startup founders is deciding when to approach VCs. You really only get one chance, because they rely heavily on first impressions. And you can't approach some and save others for later, because (a) they ask who else you've talked to and when and (b) they talk among themselves. If you're talking to one VC and he finds out that you were rejected by another several months ago, you'll definitely seem shopworn. So when do you approach VCs? When you can convince them. If the founders have impressive resumes and the idea isn't hard to understand, you could approach VCs quite early. Whereas if the founders are unknown and the idea is very novel, you might have to launch the thing and show that users loved it before VCs would be convinced. If several VCs are interested in you, they will sometimes be willing to split the deal between them. They're more likely to do this if they're close in the VC pecking order. Such deals may be a net win for founders, because you get multiple VCs interested in your success, and you can ask each for advice about the other. One founder I know wrote: Two-firm deals are great. It costs you a little more equity, but being able to play the two firms off each other (as well as ask one if the other is being out of line) is invaluable. When you do negotiate with VCs, remember that they've done this a lot more than you have. They've invested in dozens of startups, whereas this is probably the first you've founded. But don't let them or the situation intimidate you. The average founder is smarter than the average VC. So just do what you'd do in any complex, unfamiliar situation: proceed deliberately, and question anything that seems odd. It is, unfortunately, common for VCs to put terms in an agreement whose consequences surprise founders later, and also common for",5,4,4
What is one of the biggest changes for startup founders as they grow?,You got to program even less.,The biggest change was that you got to program even less: Your job description as technical founder/CEO is completely rewritten every 6-12 months.,"the value of the startup community in the larger sense: How advantageous it is to live in Silicon Valley, where you can't help but hear all the cutting-edge tech and startup news, and run into useful people constantly. The specific thing that surprised them most was the general spirit of benevolence: One of the most surprising things I saw was the willingness of people to help us. Even people who had nothing to gain went out of their way to help our startup succeed. and particularly how it extended all the way to the top: The surprise for me was how accessible important and interesting people are. It's amazing how easily you can reach out to people and get immediate feedback. This is one of the reasons I like being part of this world. Creating wealth is not a zero-sum game, so you don't have to stab people in the back to win. 18. You Get No Respect There was one surprise founders mentioned that I'd forgotten about: that outside the startup world, startup founders get no respect. In social settings, I found that I got a lot more respect when I said, I worked on Microsoft Office instead ofI work at a small startup you've never heard of called x. Partly this is because the rest of the world just doesn't get startups, and partly it's yet another consequence of the fact that most good startup ideas seem bad: If you pitch your idea to a random person, 95% of the time you'll find the person instinctively thinks the idea will be a flop and you're wasting your time (although they probably won't say this directly). Unfortunately this extends even to dating: It surprised me that being a startup founder does not get you more admiration from women. I did know about that, but I'd forgotten. 19. Things Change as You Grow The last big surprise founders mentioned is how much things changed as they grew. The biggest change was that you got to program even less: Your job description as technical founder/CEO is completely rewritten every 6-12 months. Less coding, more managing/planning/company building, hiring, cleaning up messes, and generally getting things in place for what needs to happen a few months from now. In particular, you now have to deal with employees, who often have different motivations: I knew the founder equation and had been focused on it since I knew I wanted to start a startup as a 19 year old. The employee equation is quite different so it took me a while to get it down. Fortunately, it can become a lot less stressful once you reach cruising altitude: I'd say 75% of the stress is gone now from when we first started. Running a business is so much more enjoyable now. We're more confident. We're more patient. We fight less. We sleep more. I wish I could say it was this way for every startup that succeeded, but 75% is probably on the high side.",5,4,4
What did Aristotle call metaphysics?,First philosophy.,What we call metaphysics Aristotle called first philosophy.,"how much we really depend on Aristotle would be to diff European culture with Chinese: what ideas did European culture have in 1800 that Chinese culture didn't, in virtue of Aristotle's contribution? The meaning of the word philosophy has changed over time. In ancient times it covered a broad range of topics, comparable in scope to our scholarship (though without the methodological implications). Even as late as Newton's time it included what we now call science. But core of the subject today is still what seemed to Aristotle the core: the attempt to discover the most general truths. Aristotle didn't call this metaphysics. That name got assigned to it because the books we now call the Metaphysics came after (meta = after) the Physics in the standard edition of Aristotle's works compiled by Andronicus of Rhodes three centuries later. What we call metaphysics Aristotle called first philosophy. Some of Aristotle's immediate successors may have realized this, but it's hard to say because most of their works are lost. Sokal, Alan, Transgressing the Boundaries: Toward a Transformative Hermeneutics of Quantum Gravity, Social Text 46/47, pp. 217-252. Abstract-sounding nonsense seems to be most attractive when it's aligned with some axe the audience already has to grind. If this is so we should find it's most popular with groups that are (or feel) weak. The powerful don't need its reassurance. Letter to Ottoline Morrell, December 1912. Quoted in: Monk, Ray, Ludwig Wittgenstein: The Duty of Genius, Penguin, 1991, p. 75. A preliminary result, that all metaphysics between Aristotle and 1783 had been a waste of time, is due to I. Kant. Wittgenstein asserted a sort of mastery to which the inhabitants of early 20th century Cambridge seem to have been peculiarly vulnerable perhaps partly because so many had been raised religious and then stopped believing, so had a vacant space in their heads for someone to tell them what to do (others chose Marx or Cardinal Newman), and partly because a quiet, earnest place like Cambridge in that era had no natural immunity to messianic figures, just as European politics then had no natural immunity to dictators. This is actually from the Ordinatio of Duns Scotus (ca. 1300), with number replaced by gender. Plus ca change. Wolter, Allan (trans), Duns Scotus: Philosophical Writings, Nelson, 1963, p. 92. Frankfurt, Harry, On Bullshit, Princeton University Press, 2005. Some introductions to philosophy now take the line that philosophy is worth studying as a process rather than for any particular truths you'll learn. The philosophers whose works they cover would be rolling in their graves at that. They hoped they were doing more than serving as examples of how to argue: they hoped they were getting results. Most were wrong, but it doesn't seem an impossible hope. This argument seems to me like someone in 1500 looking at the lack of results achieved by alchemy and saying its value was as a process. No, they were going about it wrong. It turns out it is possible to",5,4,5
What can copying sometimes be a sign of?,superiority rather than subordination,"But at the other extreme, copying can be a sign of superiority rather than subordination.","train running on tracks laid down by someone else. But at the other extreme, copying can be a sign of superiority rather than subordination. In many fields it's almost inevitable that your early work will be in some sense based on other people's. Projects rarely arise in a vacuum. They're usually a reaction to previous work. When you're first starting out, you don't have any previous work; if you're going to react to something, it has to be someone else's. Once you're established, you can react to your own. But while the former gets called derivative and the latter doesn't, structurally the two cases are more similar than they seem. Oddly enough, the very novelty of the most novel ideas sometimes makes them seem at first to be more derivative than they are. New discoveries often have to be conceived initially as variations of existing things, even by their discoverers , because there isn't yet the conceptual vocabulary to express them. There are definitely some dangers to copying, though. One is that you'll tend to copy old things â€” things that were in their day at the frontier of knowledge, but no longer are. And when you do copy something, don't copy every feature of it. Some will make you ridiculous if you do. Don't copy the manner of an eminent 50 year old professor if you're 18, for example, or the idiom of a Renaissance poem hundreds of years later. Some of the features of things you admire are flaws they succeeded despite. Indeed, the features that are easiest to imitate are the most likely to be the flaws. This is particularly true for behavior. Some talented people are jerks, and this sometimes makes it seem to the inexperienced that being a jerk is part of being talented. It isn't; being talented is merely how they get away with it. One of the most powerful kinds of copying is to copy something from one field into another. History is so full of chance discoveries of this type that it's probably worth giving chance a hand by deliberately learning about other kinds of work. You can take ideas from quite distant fields if you let them be metaphors. Negative examples can be as inspiring as positive ones. In fact you can sometimes learn more from things done badly than from things done well; sometimes it only becomes clear what's needed when it's missing. If a lot of the best people in your field are collected in one place, it's usually a good idea to visit for a while. It will increase your ambition, and also, by showing you that these people are human, increase your self-confidence. If you're earnest you'll probably get a warmer welcome than you might expect. Most people who are very good at something are happy to talk about it with anyone who's genuinely interested. If they're really good at their work, then they probably have a hobbyist's interest in it, and hobbyists always want to talk",4,4,4
What is the most important difference between a good hacker and a great one?,Empathy is probably the single most important difference between a good hacker and a great one.,Empathy is probably the single most important difference between a good hacker and a great one.,"owns it, it will end up being like a common-room. It will tend to feel bleak and abandoned, and accumulate cruft. The right way to collaborate, I think, is to divide projects into sharply defined modules, each with a definite owner, and with interfaces between them that are as carefully designed and, if possible, as articulated as programming languages. Like painting, most software is intended for a human audience. And so hackers, like painters, must have empathy to do really great work. You have to be able to see things from the user's point of view. When I was a kid I was always being told to look at things from someone else's point of view. What this always meant in practice was to do what someone else wanted, instead of what I wanted. This of course gave empathy a bad name, and I made a point of not cultivating it. Boy, was I wrong. It turns out that looking at things from other people's point of view is practically the secret of success. It doesn't necessarily mean being self-sacrificing. Far from it. Understanding how someone else sees things doesn't imply that you'll act in his interest; in some situations-- in war, for example-- you want to do exactly the opposite. Most makers make things for a human audience. And to engage an audience you have to understand what they need. Nearly all the greatest paintings are paintings of people, for example, because people are what people are interested in. Empathy is probably the single most important difference between a good hacker and a great one. Some hackers are quite smart, but when it comes to empathy are practically solipsists. It's hard for such people to design great software, because they can't see things from the user's point of view. One way to tell how good people are at empathy is to watch them explain a technical question to someone without a technical background. We probably all know people who, though otherwise smart, are just comically bad at this. If someone asks them at a dinner party what a programming language is, they'll say something like ``Oh, a high-level language is what the compiler uses as input to generate object code. High-level language? Compiler? Object code? Someone who doesn't know what a programming language is obviously doesn't know what these things are, either. Part of what software has to do is explain itself. So to write good software you have to understand how little users understand. They're going to walk up to the software with no preparation, and it had better do what they guess it will, because they're not going to read the manual. The best system I've ever seen in this respect was the original Macintosh, in 1985. It did what software almost never does: it just worked. Source code, too, should explain itself. If I could get people to remember just one quote about programming, it would be the one at the beginning of Structure and Interpretation",5,4,4
What should a startup be able to explain in one or two sentences?,Exactly what it does.,A startup should be able to explain in one or two sentences exactly what it does.,"description, but no startup can. A startup should be able to explain in one or two sentences exactly what it does. And not just to users. You need this for everyone: investors, acquirers, partners, reporters, potential employees, and even current employees. You probably shouldn't even start a company to do something that can't be described compellingly in one or two sentences. The other thing I repeat is to give people everything you've got, right away. If you have something impressive, try to put it on the front page, because that's the only one most visitors will see. Though indeed there's a paradox here: the more you push the good stuff toward the front, the more likely visitors are to explore further. In the best case these two suggestions get combined: you tell visitors what your site is about by showing them. One of the standard pieces of advice in fiction writing is """"show, don't tell."""" Don't say that a character's angry; have him grind his teeth, or break his pencil in half. Nothing will explain what your site does so well as using it. The industry term here is conversion. The job of your site is to convert casual visitors into users-- whatever your definition of a user is. You can measure this in your growth rate. Either your site is catching on, or it isn't, and you must know which. If you have decent growth, you'll win in the end, no matter how obscure you are now. And if you don't, you need to fix something. 4. Fear the Right Things. Another thing I find myself saying a lot is don't worry. Actually, it's more often don't worry about this; worry about that instead. Startups are right to be paranoid, but they sometimes fear the wrong things. Most visible disasters are not so alarming as they seem. Disasters are normal in a startup: a founder quits, you discover a patent that covers what you're doing, your servers keep crashing, you run into an insoluble technical problem, you have to change your name, a deal falls through-- these are all par for the course. They won't kill you unless you let them. Nor will most competitors. A lot of startups worry what if Google builds something like us? Actually big companies are not the ones you have to worry about-- not even Google. The people at Google are smart, but no smarter than you; they're not as motivated, because Google is not going to go out of business if this one product fails; and even at Google they have a lot of bureaucracy to slow them down. What you should fear, as a startup, is not the established players, but other startups you don't know exist yet. They're way more dangerous than Google because, like you, they're cornered animals. Looking just at existing competitors can give you a false sense of security. You should compete against what someone else could be doing, not just what you can see people doing.",5,4,4
What should you avoid when talking to potential acquirers?,Avoid casual conversations with potential acquirers.,"For similar reasons, avoid casual conversations with potential acquirers.","venture partner. The meanings of these titles vary too much to generalize. For similar reasons, avoid casual conversations with potential acquirers. They can lead to distractions even more dangerous than fundraising. Don't even take a meeting with a potential acquirer unless you want to sell your company right now. Joshua Reeves specifically suggests asking each investor to intro you to two more investors. Don't ask investors who say no for introductions to other investors. That will in many cases be an anti-recommendation. This is not always as deliberate as its sounds. A lot of the delays and disconnects between founders and investors are induced by the customs of the venture business, which have evolved the way they have because they suit investors' interests. One YC founder who read a draft of this essay wrote: This is the most important section. I think it might bear stating even more clearly. Investors will deliberately affect more interest than they have to preserve optionality. If an investor seems very interested in you, they still probably won't invest. The solution for this is to assume the worst that an investor is just feigning interest â€” until you get a definite commitment. Though you should probably pack investor meetings as closely as you can, Jeff Byun mentions one reason not to: if you pack investor meetings too closely, you'll have less time for your pitch to evolve. Some founders deliberately schedule a handful of lame investors first, to get the bugs out of their pitch. There is not an efficient market in this respect. Some of the most useless investors are also the highest maintenance. Incidentally, this paragraph is sales 101. If you want to see I know one very smooth founder who used to end investor meetings with """"So, can I count you in? delivered as if it were """"Can you pass the salt? Unless you're very smooth (if you're not sure...), do not do this yourself. There is nothing more unconvincing, for an investor, than a nerdy founder trying to deliver the lines meant for a smooth one. Investors are fine with funding nerds. So if you're a nerd, just try to be a good nerd, rather than doing a bad imitation of a smooth salesman. Ian Hogarth suggests a good way to tell how serious potential investors are: the resources they expend on you after the first meeting. An investor who's seriously interested will already be working to help you even before they've committed. In principle you might have to think about so-called signalling risk. If a prestigious VC makes a small seed investment in you, what if they don't want to invest the next time you raise money? Other investors might assume that the VC knows you well, since they're an existing investor, and if they don't want to invest in your next round, that must mean you suck. The reason I say in principle is that in practice signalling hasn't been much of a problem so far. It rarely arises,",5,4,4
What must research be in order to be considered substantial?,"Research must be substantial-- and awkward systems yield meatier papers, because you can write about the obstacles you have to overcome in order to get things done.","Number two, research must be substantial-- and awkward systems yield meatier papers, because you can write about the obstacles you have to overcome in order to get things done.","to drift away from building beautiful things toward building ugly things that make more suitable subjects for research papers. Unfortunately, beautiful things don't always make the best subjects for papers. Number one, research must be original-- and as anyone who has written a PhD dissertation knows, the way to be sure that you're exploring virgin territory is to stake out a piece of ground that no one wants. Number two, research must be substantial-- and awkward systems yield meatier papers, because you can write about the obstacles you have to overcome in order to get things done. Nothing yields meaty problems like starting with the wrong assumptions. Most of AI is an example of this rule; if you assume that knowledge can be represented as a list of predicate logic expressions whose arguments represent abstract concepts, you'll have a lot of papers to write about how to make this work. As Ricky Ricardo used to say, Lucy, you got a lot of explaining to do. The way to create something beautiful is often to make subtle tweaks to something that already exists, or to combine existing ideas in a slightly new way. This kind of work is hard to convey in a research paper. So why do universities and research labs continue to judge hackers by publications? For the same reason that scholastic aptitude gets measured by simple-minded standardized tests, or the productivity of programmers gets measured in lines of code. These tests are easy to apply, and there is nothing so tempting as an easy test that kind of works. Measuring what hackers are actually trying to do, designing beautiful software, would be much more difficult. You need a good sense of design to judge good design. And there is no correlation, except possibly a negative one, between people's ability to recognize good design and their confidence that they can. The only external test is time. Over time, beautiful things tend to thrive, and ugly things tend to get discarded. Unfortunately, the amounts of time involved can be longer than human lifetimes. Samuel Johnson said it took a hundred years for a writer's reputation to converge. You have to wait for the writer's influential friends to die, and then for all their followers to die. I think hackers just have to resign themselves to having a large random component in their reputations. In this they are no different from other makers. In fact, they're lucky by comparison. The influence of fashion is not nearly so great in hacking as it is in painting. There are worse things than having people misunderstand your work.A worse danger is that you will yourself misunderstand your work. Related fields are where you go looking for ideas. If you find yourself in the computer science department, there is a natural temptation to believe, for example, that hacking is the applied version of what theoretical computer science is the theory of. All the time I was in graduate school I had an uncomfortable feeling in",4,4,4
What are the two types of judgments people make?,"The first type of judgement is where judging you is the end goal, and the second type is where judging you is only a means to something else.",There are two different ways people judge you.,"to see famous startup founders and realized they were just ordinary guys. Though we're happy to provide this service, this is not generally the way we pitch startup school to potential speakers. Actually this sounds to me like a VC who got buyer's remorse, then used a technicality to get out of the deal. But it's telling that it even seemed a plausible excuse. There are two different ways people judge you. Sometimes judging you correctly is the end goal. But there's a second much more common type of judgement where it isn't. We tend to regard all judgements of us as the first type. We'd probably be happier if we realized which are and which aren't. The first type of judgement, the type where judging you is the end goal, include court cases, grades in classes, and most competitions. Such judgements can of course be mistaken, but because the goal is to judge you correctly, there's usually some kind of appeals process. If you feel you've been misjudged, you can protest that you've been treated unfairly. Nearly all the judgements made on children are of this type, so we get into the habit early in life of thinking that all judgements are. But in fact there is a second much larger class of judgements where judging you is only a means to something else. These include college admissions, hiring and investment decisions, and of course the judgements made in dating. This kind of judgement is not really about you. Put yourself in the position of someone selecting players for a national team. Suppose for the sake of simplicity that this is a game with no positions, and that you have to select 20 players. There will be a few stars who clearly should make the team, and many players who clearly shouldn't. The only place your judgement makes a difference is in the borderline cases. Suppose you screw up and underestimate the 20th best player, causing him not to make the team, and his place to be taken by the 21st best. You've still picked a good team. If the players have the usual distribution of ability, the 21st best player will be only slightly worse than the 20th best. Probably the difference between them will be less than the measurement error. The 20th best player may feel he has been misjudged. But your goal here wasn't to provide a service estimating people's ability. It was to pick a team, and if the difference between the 20th and 21st best players is less than the measurement error, you've still done that optimally. It's a false analogy even to use the word unfair to describe this kind of misjudgement. It's not aimed at producing a correct estimate of any given individual, but at selecting a reasonably optimal set. One thing that leads us astray here is that the selector seems to be in a position of power. That makes him seem like a judge. If you regard someone judging you",5,4,4
Who is known for investing in top startups in Silicon Valley?,Ron Conway,"No one, VC or angel, has invested in more of the top startups than Ron Conway.","a giant company? People sleeping on airbeds in strangers' apartments? A web site for college students to stalk one another? A wimpy little single-board computer for hobbyists that used a TV as a monitor? A new search engine, when there were already about 10, and they were all trying to de-emphasize search? These ideas didn't just seem small. They seemed wrong. They were the kind of ideas you could not merely ignore, but ridicule. Often the founders themselves didn't know why their ideas were promising. They were attracted to these ideas by instinct, because they were living in the future and they sensed that something was missing. But they could not have put into words exactly how their ugly ducklings were going to grow into big, beautiful swans. Most people's first impulse when they hear about a lame-sounding new startup idea is to make fun of it. Even a lot of people who should know better. When I encounter a startup with a lame-sounding idea, I ask What Microsoft is this the Altair Basic of? Now it's a puzzle, and the burden is on me to solve it. Sometimes I can't think of an answer, especially when the idea is a made-up one. But it's remarkable how often there does turn out to be an answer. Often it's one the founders themselves hadn't seen yet. Intriguingly, there are sometimes multiple answers. I talked to a startup a few days ago that could grow into 3 distinct Microsofts. They'd probably vary in size by orders of magnitude. But you can never predict how big a Microsoft is going to be, so in cases like that I encourage founders to follow whichever path is most immediately exciting to them. Their instincts got them this far. Why stop now?,What Microsoft Is this the Altair Basic of? January 2015 No one, VC or angel, has invested in more of the top startups than Ron Conway. He knows what happened in every deal in the Valley, half the time because he arranged it. And yet he's a super nice guy. In fact, nice is not the word. Ronco is good. I know of zero instances in which he has behaved badly. It's hard even to imagine. When I first came to Silicon Valley I thought """"How lucky that someone so powerful is so benevolent. But gradually I realized it wasn't luck. It was by being benevolent that Ronco became so powerful. All the deals he gets to invest in come to him through referrals. Google did. Facebook did. Twitter was a referral from Evan Williams himself. And the reason so many people refer deals to him is that he's proven himself to be a good guy. Good does not mean being a pushover. I would not want to face an angry Ronco. But if Ron's angry at you, it's because you did something wrong. Ron is so old school he's Old Testament. He will smite you in his just wrath, but there's no malice in",5,4,5
What act outlawed price discrimination in the U.S.?,Robinson-Patman Act of 1936,I was surprised to find it was outlawed in the U.S. by the Robinson-Patman Act of 1936.,"Price discrimination is so pervasive (how often have you heard a retailer claim that their buying power meant lower prices for you?) that I was surprised to find it was outlawed in the U.S. by the Robinson-Patman Act of 1936. This law does not appear to be vigorously enforced. In No Logo, Naomi Klein says that clothing brands favored by urban youth do not try too hard to prevent shoplifting because in their target market the shoplifters are also the fashion leaders. Companies often wonder what to outsource and what not to. One possible answer: outsource any job that's not directly exposed to competitive pressure, because outsourcing it will thereby expose it to competitive pressure. The two guys were Dan Bricklin and Bob Frankston. Dan wrote a prototype in Basic in a couple days, then over the course of the next year they worked together (mostly at night) to make a more powerful version written in 6502 machine language. Dan was at Harvard Business School at the time and Bob nominally had a day job writing software. There was no great risk in doing a business, Bob wrote, If it failed it failed. No big deal. It's not quite as easy as I make it sound. It took a painfully long time for word of mouth to get going, and we did not start to get a lot of press coverage until we hired a PR firm(admittedly the best in the business) for $16,000 per month. However, it was true that the only significant channel was our own Web site. If the Mac was so great, why did it lose? Cost, again. Microsoft concentrated on the software business, and unleashed a swarm of cheap component suppliers on Apple hardware. It did not help, either, that suits took over during a critical period. One thing that would help Web-based applications, and help keep the next generation of software from being overshadowed by Microsoft, would be a good open-source browser. Mozilla is open-source but seems to have suffered from having been corporate software for so long. A small, fast browser that was actively maintained would be a great thing in itself, and would probably also encourage companies to build little Web appliances. Among other things, a proper open-source browser would cause HTTP and HTML to continue to evolve (as e.g. Perl has). It would help Web-based applications greatly to be able to distinguish between selecting a link and following it; all you'd need to do this would be a trivial enhancement of HTTP, to allow multiple urls in a request. Cascading menus would also be good. If you want to change the world, write a new Mosaic. Think it's too late? In 1998 a lot of people thought it was too late to launch a new search engine, but Google proved them wrong. There is always room for something new if the current options suck enough. Make sure it works on all the free OSes first-- new things start with their users.",5,4,4
What is the patent pledge proposed for technology companies?,No first use of software patents against companies with less than 25 people.,Here's the pledge: No first use of software patents against companies with less than 25 people.,"able to pinch it off at the point where they're used. One way of using patents that clearly does not encourage innovation is when established companies with bad products use patents to suppress small competitors with good products. This is the type of abuse we may be able to decrease without having to go through the government. The way to do it is to get the companies that are above pulling this sort of trick to pledge publicly not to. Then the ones that won't make such a pledge will be very conspicuous. Potential employees won't want to work for them. And investors, too, will be able to see that they're the sort of company that competes by litigation rather than by making good products. Here's the pledge: No first use of software patents against companies with less than 25 people. I've deliberately traded precision for brevity. The patent pledge is not legally binding. It's like Google's Don't be evil. They don't define what evil is, but by publicly saying that, they're saying they're willing to be held to a standard that, say, Altria is not. And though constraining, Don't be evil has been good for Google. Technology companies win by attracting the most productive people, and the most productive people are attracted to employers who hold themselves to a higher standard than the law requires. The patent pledge is in effect a narrower but open source Don't be evil. I encourage every technology company to adopt it. If you want to help fix patents, encourage your employer to. Already most technology companies wouldn't sink to using patents on startups. You don't see Google or Facebook suing startups for patent infringement. They don't need to. So for the better technology companies, the patent pledge requires no change in behavior. They're just promising to do what they'd do anyway. And when all the companies that won't use patents on startups have said so, the holdouts will be very conspicuous. The patent pledge doesn't fix every problem with patents. It won't stop patent trolls, for example; they're already pariahs. But the problem the patent pledge does fix may be more serious than the problem of patent trolls. Patent trolls are just parasites. A clumsy parasite may occasionally kill the host, but that's not its goal. Whereas companies that sue startups for patent infringement generally do it with explicit goal of keeping their product off the market. Companies that use patents on startups are attacking innovation at the root. Now there's something any individual can do about this problem, without waiting for the government: ask companies where they stand. Patent Pledge Site Because the pledge is deliberately vague, we're going to need common sense when intepreting it. And even more vice versa: the pledge is vague in order to make people use common sense when interpreting it. So for example I've deliberately avoided saying whether the 25 people have to be employees, or whether contractors count too. If a company has to split",5,4,4
Why are publishers unhappy with consumers?,"Publishers of all types, from news to music, are unhappy that consumers won't pay for content anymore.","Publishers of all types, from news to music, are unhappy that consumers won't pay for content anymore.","expected to, but also seem to be writing with conviction. The solution was a kind of method acting. It was revoltingly familiar to slip back into it. Exercise for the reader: rephrase that thought to please the same people the first version would offend. Come to think of it, there is one way in which I deliberately pander to readers, because it doesn't change the number of words: I switch person. This flattering distinction seems so natural to the average reader that they probably don't notice even when I switch in mid-sentence, though you tend to notice when it's done as conspicuously as this. An earlier version of this essay began by talking about why people dislike Michael Arrington. I now believe that was mistaken, and that most people don't dislike him for the same reason I did when I first met him, but simply because he writes about controversial things."",Persuade xor Discover ""September 2009 Publishers of all types, from news to music, are unhappy that consumers won't pay for content anymore. At least, that's how they see it. In fact consumers never really were paying for content, and publishers weren't really selling it either. If the content was what they were selling, why has the price of books or music or movies always depended mostly on the format? Why didn't better content cost more? A copy of Time costs $5 for 58 pages, or 8.6 cents a page. The Economist costs $7 for 86 pages, or 8.1 cents a page. Better journalism is actually slightly cheaper. Almost every form of publishing has been organized as if the medium was what they were selling, and the content was irrelevant. Book publishers, for example, set prices based on the cost of producing and distributing books. They treat the words printed in the book the same way a textile manufacturer treats the patterns printed on its fabrics. Economically, the print media are in the business of marking up paper. We can all imagine an old-style editor getting a scoop and saying this will sell a lot of papers! Cross out that final S and you're describing their business model. The reason they make less money now is that people don't need as much paper. A few months ago I ran into a friend in a cafe. I had a copy of the New York Times, which I still occasionally buy on weekends. As I was leaving I offered it to him, as I've done countless times before in the same situation. But this time something new happened. I felt that sheepish feeling you get when you offer someone something worthless. Do you, er, want a printout of yesterday's news? I asked. (He didn't.) Now that the medium is evaporating, publishers have nothing left to sell. Some seem to think they're going to sell content that they were always in the content business, really. But they weren't, and it's unclear whether anyone could be. Selling: There have always been people in the business",5,4,4
What is schlep blindness?,Schlep blindness is the phenomenon where the unconscious mind prevents people from even considering ideas that involve painful work.,The most dangerous thing about our dislike of schleps is that much of it is unconscious.,"swimming pool: just jump in. Which is not to say you should seek out unpleasant work per se, but that you should never shrink from it if it's on the path to something great. The most dangerous thing about our dislike of schleps is that much of it is unconscious. Your unconscious won't even let you see ideas that involve painful schleps. That's schlep blindness. The phenomenon isn't limited to startups. Most people don't consciously decide not to be in as good physical shape as Olympic athletes, for example. Their unconscious mind decides for them, shrinking from the work involved. The most striking example I know of schlep blindness is Stripe, or rather Stripe's idea. For over a decade, every hacker who'd ever had to process payments online knew how painful the experience was. Thousands of people must have known about this problem. And yet when they started startups, they decided to build recipe sites, or aggregators for local events. Why? Why work on problems few care much about and no one will pay for, when you could fix one of the most important components of the world's infrastructure? Because schlep blindness prevented people from even considering the idea of fixing payments. Probably no one who applied to Y Combinator to work on a recipe site began by asking should we fix payments, or build a recipe site and chose the recipe site. Though the idea of fixing payments was right there in plain sight, they never saw it, because their unconscious mind shrank from the complications involved. You'd have to make deals with banks. How do you do that? Plus you're moving money, so you're going to have to deal with fraud, and people trying to break into your servers. Plus there are probably all sorts of regulations to comply with. It's a lot more intimidating to start a startup like this than a recipe site. That scariness makes ambitious ideas doubly valuable. In addition to their intrinsic value, they're like undervalued stocks in the sense that there's less demand for them among founders. If you pick an ambitious idea, you'll have less competition, because everyone else will have been frightened off by the challenges involved. (This is also true of starting a startup generally.) How do you overcome schlep blindness? Frankly, the most valuable antidote to schlep blindness is probably ignorance. Most successful founders would probably say that if they'd known when they were starting their company about the obstacles they'd have to overcome, they might never have started it. Maybe that's one reason the most successful startups of all so often have young founders. In practice the founders grow with the problems. But no one seems able to foresee that, not even older, more experienced founders. So the reason younger founders have an advantage is that they make two mistakes that cancel each other out. They don't know how much they can grow, but they also don't know how much they'll need to. Older founders only make",5,4,5
What is considered the intellectual capital of the world?,Cambridge seems to be the intellectual capital of the world.,"As of this writing, Cambridge seems to be the intellectual capital of the world.","you should live better. Life in Berkeley is very civilized. It's probably the place in America where someone from Northern Europe would feel most at home. But it's not humming with ambition. In retrospect it shouldn't have been surprising that a place so pleasant would attract people interested above all in quality of life. Cambridge with good weather, it turns out, is not Cambridge. The people you find in Cambridge are not there by accident. You have to make sacrifices to live there. It's expensive and somewhat grubby, and the weather's often bad. So the kind of people you find in Cambridge are the kind of people who want to live where the smartest people are, even if that means living in an expensive, grubby place with bad weather. As of this writing, Cambridge seems to be the intellectual capital of the world. I realize that seems a preposterous claim. What makes it true is that it's more preposterous to claim about anywhere else. American universities currently seem to be the best, judging from the flow of ambitious students. And what US city has a stronger claim? New York? A fair number of smart people, but diluted by a much larger number of neanderthals in suits. The Bay Area has a lot of smart people too, but again, diluted; there are two great universities, but they're far apart. Harvard and MIT are practically adjacent by West Coast standards, and they're surrounded by about 20 other colleges and universities. Cambridge as a result feels like a town whose main industry is ideas, while New York's is finance and Silicon Valley's is startups. When you talk about cities in the sense we are, what you're really talking about is collections of people. For a long time cities were the only large collections of people, so you could use the two ideas interchangeably. But we can see how much things are changing from the examples I've mentioned. New York is a classic great city. But Cambridge is just part of a city, and Silicon Valley is not even that. (San Jose is not, as it sometimes claims, the capital of Silicon Valley. It's just 178 square miles at one end of it.) Maybe the Internet will change things further. Maybe one day the most important community you belong to will be a virtual one, and it won't matter where you live physically. But I wouldn't bet on it. The physical world is very high bandwidth, and some of the ways cities send you messages are quite subtle. One of the exhilarating things about coming back to Cambridge every spring is walking through the streets at dusk, when you can see into the houses. When you walk through Palo Alto in the evening, you see nothing but the blue glow of TVs. In Cambridge you see shelves full of promising-looking books. Palo Alto was probably much like Cambridge in 1960, but you'd never guess now that there was a university nearby. Now it's just",5,4,5
What is the purpose of the term 'industry best practice'?,Its purpose is to shield the pointy-haired boss from responsibility.,"Its purpose is to shield the pointy-haired boss from responsibility: if he chooses something that is industry best practice, and the company loses, he can't be blamed.","fault. The safest plan for him personally is to stick close to the center of the herd. Within large organizations, the phrase used to describe this approach is industry best practice. Its purpose is to shield the pointy-haired boss from responsibility: if he chooses something that is industry best practice, and the company loses, he can't be blamed. He didn't choose, the industry did. I believe this term was originally used to describe accounting methods and so on. What it means, roughly, is don't do anything weird. And in accounting that's probably a good idea. The terms cutting-edge and accounting do not sound good together. But when you import this criterion into decisions about technology, you start to get the wrong answers. Technology often should be cutting-edge. In programming languages, as Erann Gat has pointed out, what industry best practice actually gets you is not the best, but merely the average. When a decision causes you to develop software at a fraction of the rate of more aggressive competitors, best practice is a misnomer. So here we have two pieces of information that I think are very valuable. In fact, I know it from my own experience. Number 1, languages vary in power. Number 2, most managers deliberately ignore this. Between them, these two facts are literally a recipe for making money. ITA is an example of this recipe in action. If you want to win in a software business, just take on the hardest problem you can find, use the most powerful language you can get, and wait for your competitors'pointy-haired bosses to revert to the mean. As an illustration of what I mean about the relative power of programming languages, consider the following problem. We want to write a function that generates accumulators-- a function that takes a number n, and returns a function that takes another number i and returns n incremented by i. (That's incremented by, not plus. An accumulator has to accumulate.) In Common Lisp this would be (defun foo (n) (lambda (i) (incf n i))) and in Perl 5, sub foo { my ($n) = @_; sub {$n += shift} } which has more elements than the Lisp version because you have to extract parameters manually in Perl. In Smalltalk the code is slightly longer than in Lisp foo: n |s| s := n. ^[:i| s := s+i. ] because although in general lexical variables work, you can't do an assignment to a parameter, so you have to create a new variable s. In Javascript the example is, again, slightly longer, because Javascript retains the distinction between statements and expressions, so you need explicit return statements to return values: function foo(n) { return function (i) { return n += i } } (To be fair, Perl also retains this distinction, but deals with it in typical Perl fashion by letting you omit return s.) If you try to translate the Lisp/Perl/Smalltalk/Javascript code into Python you run into some limitations. Because Python doesn't fully support",5,4,5
Why do founders often not listen to advice from YC partners?,They don't believe us. At least not till experience teaches them otherwise.,So the reason founders don't listen to us is that they don't believe us. At least not till experience teaches them otherwise.,"to us. A couple weeks ago I talked to a partner who had been working for YC for a couple batches and was starting to see the pattern. """"They come back a year later,"""" she said, """"and say 'We wish we'd listened to you.'"""" It took me a long time to figure out why founders don't listen. At first I thought it was mere stubbornness. That's part of the reason, but another and probably more important reason is that so much about startups is counterintuitive. And when you tell someone something counterintuitive, what it sounds to them is wrong. So the reason founders don't listen to us is that they don't believe us. At least not till experience teaches them otherwise. The reason startups are so counterintuitive is that they're so different from most people's other experiences. No one knows what it's like except those who've done it. Which is why YC partners should usually have been founders themselves. But strangely enough, the counterintuitiveness of startups turns out to be another of the things that make YC work. If it weren't counterintuitive, founders wouldn't need our advice about how to do it. Focus is doubly important for early stage startups, because not only do they have a hundred different problems, they don't have anyone to work on them except the founders. If the founders focus on things that don't matter, there's no one focusing on the things that do. So the essence of what happens at YC is to figure out which problems matter most, then cook up ideas for solving them â€” ideally at a resolution of a week or less â€” and then try those ideas and measure how well they worked. The focus is on action, with measurable, near-term results. This doesn't imply that founders should rush forward regardless of the consequences. If you correct course at a high enough frequency, you can be simultaneously decisive at a micro scale and tentative at a macro scale. The result is a somewhat winding path, but executed very rapidly, like the path a running back takes downfield. And in practice there's less backtracking than you might expect. Founders usually guess right about which direction to run in, especially if they have someone experienced like a YC partner to bounce their hypotheses off. And when they guess wrong, they notice fast, because they'll talk about the results at office hours the next week. A small improvement in navigational ability can make you a lot faster, because it has a double effect: the path is shorter, and you can travel faster along it when you're more certain it's the right one. That's where a lot of YC's value lies, in helping founders get an extra increment of focus that lets them move faster. And since moving fast is the essence of a startup, YC in effect makes startups more startup-like. Speed defines startups. Focus enables speed. YC improves focus. Why are founders uncertain about what to do? Partly because startups almost",5,4,4
What is the opinion of expert hackers on programming languages?,"Expert hackers can tell a good language when they see one, and they'll use it.","Expert hackers: can tell a good language when they see one, and they'll use it.","and learning what they want. Programming languages are for hackers, and a programming language is good as a programming language (rather than, say, an exercise in denotational semantics or compiler design) if and only if hackers like it. The Mechanics of Popularity: It's true, certainly, that most people don't choose programming languages simply based on their merits. Most programmers are told what language to use by someone else. And yet I think the effect of such external factors on the popularity of programming languages is not as great as it's sometimes thought to be. I think a bigger problem is that a hacker's idea of a good programming language is not the same as most language designers'. Between the two, the hacker's opinion is the one that matters. Programming languages are not theorems. They're tools, designed for people, and they have to be designed to suit human strengths and weaknesses as much as shoes have to be designed for human feet. If a shoe pinches when you put it on, it's a bad shoe, however elegant it may be as a piece of sculpture. It may be that the majority of programmers can't tell a good language from a bad one. But that's no different with any other tool. It doesn't mean that it's a waste of time to try designing a good language. Expert hackers: can tell a good language when they see one, and they'll use it. Expert hackers are a tiny minority, admittedly, but that tiny minority write all the good software, and their influence is such that the rest of the programmers will tend to use whatever language they use. Often, indeed, it is not merely influence but command: often the expert hackers are the very people who, as their bosses or faculty advisors, tell the other programmers what language to use. The opinion of expert hackers is not the only force that determines the relative popularity of programming languages â€” legacy software (Cobol) and hype (Ada, Java) also play a role â€” but I think it is the most powerful force over the long term. Given an initial critical mass and enough time, a programming language probably becomes about as popular as it deserves to be. And popularity further separates good languages from bad ones, because feedback from real live users always leads to improvements. Look at how much any popular language has changed during its life. Perl and Fortran are extreme cases, but even Lisp has changed a lot. Lisp 1.5 didn't have macros, for example; these evolved later, after hackers at MIT had spent a couple years using Lisp to write real programs. So whether or not a language has to be good to be popular, I think a language has to be popular to be good. And it has to stay popular to stay good. The state of the art in programming languages doesn't stand still. And yet the Lisps we have today are still pretty much what they had at MIT",5,4,4
What was the original meaning of Web 2.0?,Using the web as a platform.,"At the time it was supposed to mean using the web as a platform, which I took to refer to web-based applications.","to-do list push you. Work on an ambitious project you really enjoy, and sail as close to the wind as you can, and you'll leave the right things undone. Does Web 2.0 mean anything? Till recently I thought it didn't, but the truth turns out to be more complicated. Originally, yes, it was meaningless. Now it seems to have acquired a meaning. And yet those who dislike the term are probably right, because if it means what I think it does, we don't need it. I first heard the phrase Web 2.0 in the name of the Web 2.0 conference in 2004. At the time it was supposed to mean using the web as a platform, which I took to refer to web-based applications. So I was surprised at a conference this summer when Tim O'Reilly led a session intended to figure out a definition of Web 2.0. Didn't it already mean using the web as a platform? And if it didn't already mean something, why did we need the phrase at all? Origins Tim says the phrase Web 2.0 first arose in a brainstorming session between O'Reilly and Medialive International. What is Medialive International? Producers of technology tradeshows and conferences, according to their site. So presumably that's what this brainstorming session was about. O'Reilly wanted to organize a conference about the web, and they were wondering what to call it. I don't think there was any deliberate plan to suggest there was a new version of the web. They just wanted to make the point that the web mattered again. It was a kind of semantic deficit spending: they knew new things were coming, and the 2.0 referred to whatever those might turn out to be. And they were right. New things were coming. But the new version number led to some awkwardness in the short term. In the process of developing the pitch for the first conference, someone must have decided they'd better take a stab at explaining what that 2.0 referred to. Whatever it meant, the web as a platform"""" was at least not too constricting. The story about Web 2.0 meaning the web as a platform didn't live much past the first conference. By the second conference, what Web 2.0 seemed to mean was something about democracy. At least, it did when people wrote about it online. The conference itself didn't seem very grassroots. It cost $2800, so the only people who could afford to go were VCs and people from big companies. And yet, oddly enough, Ryan Singel's article about the conference in Wired News spoke of throngs of geeks. When a friend of mine asked Ryan about this, it was news to him. He said he'd originally written something like throngs of VCs and biz dev guys but had later shortened it just to throngs, and that this must have in turn been expanded by the editors into throngs of geeks. After all, a Web 2.0 conference would presumably be full of geeks, right?",5,4,4
What should startups avoid doing when they raise a huge amount of money?,Don't spend it.,"So if you do raise a huge amount of money, don't spend it.","loosely coupled. But the money itself may be more dangerous than the valuation. The more you raise, the more you spend, and spending a lot of money can be disastrous for an early stage startup. Spending a lot makes it harder to become profitable, and perhaps even worse, it makes you more rigid, because the main way to spend money is people, and the more people you have, the harder it is to change directions. So if you do raise a huge amount of money, don't spend it. (You will find that advice almost impossible to follow, so hot will be the money burning a hole in your pocket, but I feel obliged at least to try.) Be nice. Startups raising money occasionally alienate investors by seeming arrogant. Sometimes because they are arrogant, and sometimes because they're noobs clumsily attempting to mimic the toughness they've observed in experienced founders. It's a mistake to behave arrogantly to investors. While there are certain situations in which certain investors like certain kinds of arrogance, investors vary greatly in this respect, and a flick of the whip that will bring one to heel will make another roar with indignation. The only safe strategy is never to seem arrogant at all. That will require some diplomacy if you follow the advice I've given here, because the advice I've given is essentially how to play hardball back. When you refuse to meet an investor because you're not in fundraising mode, or slow down your interactions with an investor who moves too slow, or treat a contingent offer as the no it actually is and then, by accepting offers greedily, end up leaving that investor out, you're going to be doing things investors don't like. So you must cushion the blow with soft words. At YC we tell startups they can blame us. And now that I've written this, everyone else can blame me if they want. That plus the inexperience card should work in most situations: sorry, we think you're great, but PG said startups shouldn't ___, and since we're new to fundraising, we feel like we have to play it safe. The danger of behaving arrogantly is greatest when you're doing well. When everyone wants you, it's hard not to let it go to your head. Especially if till recently no one wanted you. But restrain yourself. The startup world is a small place, and startups have lots of ups and downs. This is a domain where it's more true than usual that pride goeth before a fall. Be nice when investors reject you as well. The best investors are not wedded to their initial opinion of you. If they reject you in phase 2 and you end up doing well, they'll often invest in phase 3. In fact investors who reject you are some of your warmest leads for future fundraising. Any investor who spent significant time deciding probably came close to saying yes. Often you have some internal champion who only needs a",5,5,4
What do big employers think of young hackers who start companies?,Big employers think highly of young hackers who start companies.,"If even big employers think highly of young hackers who start companies, why don't more do","greater returns. So why does anyone invest in bonds? The catch is that phrase over time. Stocks will generate greater returns over thirty years, but they might lose value from year to year. So what you should invest in depends on how soon you need the money. If you're young, you should take the riskiest investments you can find. All this talk about investing may seem very theoretical. Most undergrads probably have more debts than assets. They may feel they have nothing to invest. But that's not true: they have their time to invest, and the same rule about risk applies there. Your early twenties are exactly the time to take insane career risks. The reason risk is always proportionate to reward is that market forces make it so. People will pay extra for stability. So if you choose stability-- by buying bonds, or by going to work for a big company-- it's going to cost you. Riskier career moves pay better on average, because there is less demand for them. Extreme choices like starting a startup are so frightening that most people won't even try. So you don't end up having as much competition as you might expect, considering the prizes at stake. The math is brutal. While perhaps 9 out of 10 startups fail, the one that succeeds will pay the founders more than 10 times what they would have made in an ordinary job. That's the sense in which startups pay better on average. Remember that. If you start a startup, you'll probably fail. Most startups fail. It's the nature of the business. But it's not necessarily a mistake to try something that has a 90% chance of failing, if you can afford the risk. Failing at 40, when you have a family to support, could be serious. But if you fail at 22, so what? If you try to start a startup right out of college and it tanks, you'll end up at 23 broke and a lot smarter. Which, if you think about it, is roughly what you hope to get from a graduate program. Even if your startup does tank, you won't harm your prospects with employers. To make sure I asked some friends who work for big companies. I asked managers at Yahoo, Google, Amazon, Cisco and Microsoft how they'd feel about two candidates, both 24, with equal ability, one who'd tried to start a startup that tanked, and another who'd spent the two years since college working as a developer at a big company. Every one responded that they'd prefer the guy who'd tried to start his own company. Zod Nazem, who's in charge of engineering at Yahoo, said: I actually put more value on the guy with the failed startup. And you can quote me! So there you have it. Want to get hired by Yahoo? Start your own company. The Man is the Customer If even big employers think highly of young hackers who start companies, why don't more do",5,4,4
What is seed capital?,Seed capital is the initial funding needed to pay expenses while developing a prototype.,The first thing you'll need is a few tens of thousands of dollars to pay your expenses while you develop a prototype. This is called seed capital.,"are doing it to the expensive models made for professionals. Avid did it to the manufacturers of specialized video editing systems, and now Apple is doing it to Avid. Henry Ford did it to the car makers that preceded him. If you build the simple, inexpensive option, you'll not only find it easier to sell at first, but you'll also be in the best position to conquer the rest of the market. It's very dangerous to let anyone fly under you. If you have the cheapest, easiest product, you'll own the low end. And if you don't, you're in the crosshairs of whoever does. Raising Money: To make all this happen, you're going to need money. Some startups have been self-funding-- Microsoft for example-- but most aren't. I think it's wise to take money from investors. To be self-funding, you have to start as a consulting company, and it's hard to switch from that to a product company. Financially, a startup is like a pass/fail course. The way to get rich from a startup is to maximize the company's chances of succeeding, not to maximize the amount of stock you retain. So if you can trade stock for something that improves your odds, it's probably a smart move. To most hackers, getting investors seems like a terrifying and mysterious process. Actually it's merely tedious. I'll try to give an outline of how it works. The first thing you'll need is a few tens of thousands of dollars to pay your expenses while you develop a prototype. This is called seed capital. Because so little money is involved, raising seed capital is comparatively easy-- at least in the sense of getting a quick yes or no. Usually you get seed money from individual rich people called angels. Often they're people who themselves got rich from technology. At the seed stage, investors don't expect you to have an elaborate business plan. Most know that they're supposed to decide quickly. It's not unusual to get a check within a week based on a half-page agreement. We started Viaweb with $10,000 of seed money from our friend Julian. But he gave us a lot more than money. He's a former CEO and also a corporate lawyer, so he gave us a lot of valuable advice about business, and also did all the legal work of getting us set up as a company. Plus he introduced us to one of the two angel investors who supplied our next round of funding. Some angels, especially those with technology backgrounds, may be satisfied with a demo and a verbal description of what you plan to do. But many will want a copy of your business plan, if only to remind themselves what they invested in. Our angels asked for one, and looking back, I'm amazed how much worry it caused me. Business plan has that word business in it, so I figured it had to be something I'd have to read a book about business plans to",5,4,5
What is the main point of high-level programming languages?,The main point of high-level languages is to make source code smaller.,"In other words, the main point of high-level languages is to make source code smaller.","about a programming language. As far as I can tell, succinctness = power.If so, then substituting, we get Python's goal is regularity and readability, not power. and this doesn't seem a tradeoff (if it is a tradeoff)that you'd want to make. It's not far from saying that Python's goal is not to be effective as a programming language. Does succinctness = power? This seems to me an important question, maybe the most important question for anyone interested in language design, and one that it would be useful to confront directly. I don't feel sure yet that the answer is a simple yes, but it seems a good hypothesis to begin with. My hypothesis is that succinctness is power, or is close enough that except in pathological examples you can treat them as identical. It seems to me that succinctness is what programming languages are for, Computers would be just as happy to be told what to do directly in machine language. I think that the main reason we take the trouble to develop high-level languages is to get leverage, so that we can say (and more importantly, think) in 10 lines of a high-level language what would require 1000 lines of machine language. In other words, the main point of high-level languages is to make source code smaller. If smaller source code is the purpose of high-level languages, and the power of something is how well it achieves its purpose, then the measure of the power of a programming language is how small it makes your programs. Conversely, a language that doesn't make your programs small is doing a bad job of what programming languages are supposed to do, like a knife that doesn't cut well, or printing that's illegible. Metrics Small in what sense though? The most common measure of code size is lines of code. But I think that this metric is the most common because it is the easiest to measure. I don't think anyone really believes it is the true test of the length of a program. Different languages have different conventions for how much you should put on a line; in C a lot of lines have nothing on them but a delimiter or two. Another easy test is the number of characters in a program, but this is not very good either; some languages (Perl, for example) just use shorter identifiers than others. I think a better measure of the size of a program would be the number of elements, where an element is anything that would be a distinct node if you drew a tree representing the source code. The name of a variable or function is an element; an integer or a floating-point number is an element; a segment of literal text is an element; an element of a pattern, or a format directive, is an element; a new block is an element. There are borderline cases (is -5 two elements or one?) but I think most of them are the same",5,5,5
What is a significant advantage of starting a startup in America?,Funding is easier to get in America.,Startups are easier to start in America because funding is easier to get.,"reason I'm not typing this on an Apfel laptop. Jobs and Wozniak couldn't have come up with that kind of money in a company financed by selling a VW bus and an HP calculator. We couldn't have started Viaweb either. Here's a tip for governments that want to encourage startups: read the stories of existing startups, and then try to simulate what would have happened in your country. When you hit something that would have killed Apple, prune it off. Startups are marginal. They're started by the poor and the timid; they begin in marginal space and spare time; they're started by people who are supposed to be doing something else; and though businesses, their founders often know nothing about business. Young startups are fragile. A society that trims its margins sharply will kill them all. 8. America Has a Large Domestic Market. What sustains a startup in the beginning is the prospect of getting their initial product out. The successful ones therefore make the first version as simple as possible. In the US they usually begin by making something just for the local market. This works in America, because the local market is 300 million people. It wouldn't work so well in Sweden. In a small country, a startup has a harder task: they have to sell internationally from the start. The EU was designed partly to simulate a single, large domestic market. The problem is that the inhabitants still speak many different languages. So a software startup in Sweden is still at a disadvantage relative to one in the US, because they have to deal with internationalization from the beginning. It's significant that the most famous recent startup in Europe, Skype, worked on a problem that was intrinsically international. However, for better or worse it looks as if Europe will in a few decades speak a single language. When I was a student in Italy in 1990, few Italians spoke English. Now all educated people seem to be expected to-- and Europeans do not like to seem uneducated. This is presumably a taboo subject, but if present trends continue, French and German will eventually go the way of Irish and Luxembourgish: they'll be spoken in homes and by eccentric nationalists. 9. America Has Venture Funding. Startups are easier to start in America because funding is easier to get. There are now a few VC firms outside the US, but startup funding doesn't only come from VC firms. A more important source, because it's more personal and comes earlier in the process, is money from individual angel investors. Google might never have got to the point where they could raise millions from VC funds if they hadn't first raised a hundred thousand from Andy Bechtolsheim. And he could help them because he was one of the founders of Sun. This pattern is repeated constantly in startup hubs. It's this pattern that makes them startup hubs. The good news is, all you have to do to get the process rolling",5,4,5
Who were the founders of Y Combinator?,"Jessica Livingston, Robert Morris, Trevor Blackwell, and the narrator.","YC had 4 founders. Jessica and I decided one night to start it, and the next day we recruited my friends Robert Morris and Trevor Blackwell.","and it will become as big a cause as it needs to, in the sense that if you ban other ways to get rich, people who want to get rich will use this route instead. Goldin, Claudia and Robert A. Margo. The Great Compression: The Wage Structure in the United States at Mid-Century. NBER Working Paper 3817, 1991. A few months ago an article about Y Combinator said that early on it had been a one-man show. It's sadly common to read that sort of thing. But the problem with that description is not just that it's unfair. It's also misleading. Much of what's most novel about YC is due to Jessica Livingston. If you don't understand her, you don't understand YC So let me tell you a little about Jessica. YC had 4 founders. Jessica and I decided one night to start it, and the next day we recruited my friends Robert Morris and Trevor Blackwell. Jessica and I ran YC day to day, and Robert and Trevor read applications and did interviews with us. Jessica and I were already dating when we started YC. At first we tried to act professional about this, meaning we tried to conceal it. In retrospect that seems ridiculous, and we soon dropped the pretense. And the fact that Jessica and I were a couple is a big part of what made YC what it was. YC felt like a family.The founders early on were mostly young. We all had dinner together once a week, cooked for the first couple years by me. Our first building had been a private home. The overall atmosphere was shockingly different from a VC's office on Sand Hill Road, in a way that was entirely for the better. There was an authenticity that everyone who walked in could sense. And that didn't just mean that people trusted us. It was the perfect quality to instill in startups. Authenticity is one of the most important things YC looks for in founders, not just because fakers and opportunists are annoying, but because authenticity is one of the main things that separates the most successful startups from the rest. Early YC was a family, and Jessica was its mom. And the culture she defined was one of YC's most important innovations. Culture is important in any organization, but at YC culture wasn't just how we behaved when we built the product. At YC, the culture was the product. Jessica was also the mom in another sense: she had the last word. Everything we did as an organization went through her first who to fund, what to say to the public, how to deal with other companies, who to hire, everything. Before we had kids, YC was more or less our life. There was no real distinction between working hours and not. We talked about YC all the time. And while there might be some businesses that it would be tedious to let infect your private life, we liked it. We'd",5,4,5
What is a way to make something that will appeal to future generations?,Try to appeal to past generations.,"Strangely enough, if you want to make something that will appeal to future generations, one way to do it is to try to appeal to past generations.","discover it. Aiming at timelessness is a way to make yourself find the best answer: if you can imagine someone surpassing you, you should do it yourself. Some of the greatest masters did this so well that they left little room for those who came after. Every engraver since Durer has had to live in his shadow. Aiming at timelessness is also a way to evade the grip of fashion. Fashions almost by definition change with time, so if you can make something that will still look good far into the future, then its appeal must derive more from merit and less from fashion. Strangely enough, if you want to make something that will appeal to future generations, one way to do it is to try to appeal to past generations. It's hard to guess what the future will be like, but we can be sure it will be like the past in caring nothing for present fashions. So if you can make something that appeals to people today and would also have appealed to people in 1500, there is a good chance it will appeal to people in 2500. Good design solves the right problem. The typical stove has four burners arranged in a square, and a dial to control each. How do you arrange the dials? The simplest answer is to put them in a row. But this is a simple answer to the wrong question. The dials are for humans to use, and if you put them in a row, the unlucky human will have to stop and think each time about which dial matches which burner. Better to arrange the dials in a square like the burners. A lot of bad design is industrious, but misguided. In the mid twentieth century there was a vogue for setting text in sans-serif fonts. These fonts are closer to the pure, underlying letterforms. But in text that's not the problem you're trying to solve. For legibility it's more important that letters be easy to tell apart. It may look Victorian, but a Times Roman lowercase g is easy to tell from a lowercase y. Problems can be improved as well as solutions. In software, an intractable problem can usually be replaced by an equivalent one that's easy to solve. Physics progressed faster as the problem became predicting observable behavior, instead of reconciling it with scripture. Good design is suggestive. Jane Austen's novels contain almost no description; instead of telling you how everything looks, she tells her story so well that you envision the scene for yourself. Likewise, a painting that suggests is usually more engaging than one that tells. Everyone makes up their own story about the Mona Lisa. In architecture and design, this principle means that a building or object should let you use it how you want: a good building, for example, will serve as a backdrop for whatever life people want to lead in it, instead of making them live as if they were executing a",5,4,5
Who is known for investing in top startups in Silicon Valley?,Ron Conway,"No one, VC or angel, has invested in more of the top startups than Ron Conway.","ago that could grow into 3 distinct Microsofts. They'd probably vary in size by orders of magnitude. But you can never predict how big a Microsoft is going to be, so in cases like that I encourage founders to follow whichever path is most immediately exciting to them. Their instincts got them this far. Why stop now?,What Microsoft Is this the Altair Basic of? January 2015 No one, VC or angel, has invested in more of the top startups than Ron Conway. He knows what happened in every deal in the Valley, half the time because he arranged it. And yet he's a super nice guy. In fact, nice is not the word. Ronco is good. I know of zero instances in which he has behaved badly. It's hard even to imagine. When I first came to Silicon Valley I thought """"How lucky that someone so powerful is so benevolent. But gradually I realized it wasn't luck. It was by being benevolent that Ronco became so powerful. All the deals he gets to invest in come to him through referrals. Google did. Facebook did. Twitter was a referral from Evan Williams himself. And the reason so many people refer deals to him is that he's proven himself to be a good guy. Good does not mean being a pushover. I would not want to face an angry Ronco. But if Ron's angry at you, it's because you did something wrong. Ron is so old school he's Old Testament. He will smite you in his just wrath, but there's no malice in it. In almost every domain there are advantages to seeming good. It makes people trust you. But actually being good is an expensive way to seem good. To an amoral person it might seem to be overkill. In some fields it might be, but apparently not in the startup world. Though plenty of investors are jerks, there is a clear trend among them: the most successful investors are also the most upstanding. It was not always this way. I would not feel confident saying that about investors twenty years ago. What changed? The startup world became more transparent and more unpredictable. Both make it harder to seem good without actually being good. It's obvious why transparency has that effect. When an investor maltreats a founder now, it gets out. Maybe not all the way to the press, but other founders hear about it, and that investor starts to lose deals. The effect of unpredictability is more subtle. It increases the work of being inconsistent. If you're going to be two-faced, you have to know who you should be nice to and who you can get away with being nasty to. In the startup world, things change so rapidly that you can't tell. The random college kid you talk to today might in a couple years be the CEO of the hottest startup in the Valley. If you can't tell who to be nice to, you have to be nice",5,4,4
What is the default outcome for most startups?,Death is the default for startups.,"The problem is not that most towns kill startups. It's that death is the default for startups, and most towns don't save them.","happened inside the motelâ€”exactly what was killing all the potential startups. A couple weeks ago I finally figured it out. I was framing the question wrong. The problem is not that most towns kill startups. It's that death is the default for startups, and most towns don't save them. Instead of thinking of most places as being sprayed with startupicide, it's more accurate to think of startups as all being poisoned, and a few places being sprayed with the antidote. Startups in other places are just doing what startups naturally do: fail. The real question is, what's saving startups in places like Silicon Valley? Environment: I think there are two components to the antidote: being in a place where startups are the cool thing to do, and chance meetings with people who can help you.And what drives them both is the number of startup people around you. The first component is particularly helpful in the first stage of a startup's life, when you go from merely having an interest in starting a company to actually doing it. It's quite a leap to start a startup. It's an unusual thing to do. But in Silicon Valley it seems normal. In most places, if you start a startup, people treat you as if you're unemployed. People in the Valley aren't automatically impressed with you just because you're starting a company, but they pay attention. Anyone who's been here any amount of time knows not to default to skepticism, no matter how inexperienced you seem or how unpromising your idea sounds at first, because they've all seen inexperienced founders with unpromising sounding ideas who a few years later were billionaires. Having people around you care about what you're doing is an extraordinarily powerful force. Even the most willful people are susceptible to it. About a year after we started Y Combinator I said something to a partner at a well known VC firm that gave him the (mistaken) impression I was considering starting another startup. He responded so eagerly that for about half a second I found myself considering doing it. In most other cities, the prospect of starting a startup just doesn't seem real. In the Valley it's not only real but fashionable. That no doubt causes a lot of people to start startups who shouldn't. But I think that's ok. Few people are suited to running a startup, and it's very hard to predict beforehand which are (as I know all too well from being in the business of trying to predict beforehand), so lots of people starting startups who shouldn't is probably the optimal state of affairs. As long as you're at a point in your life when you can bear the risk of failure, the best way to find out if you're suited to running a startup is to try it. Chance The second component of the antidote is chance meetings with people who can help you. This force works in both phases: both in the transition from the",5,4,4
Why do startups benefit from moving to Silicon Valley?,"Startups benefit from moving to Silicon Valley because there is infrastructure for startups, accumulated knowledge about how to make them work, and other people trying to do it.","Most people could see how it might be helpful to be in a place where there was infrastructure for startups, accumulated knowledge about how to make them work, and other people trying to do it.","founders were lucky. Like all such things, it was harder than it looked. The Reddits pushed so hard against the current that they reversed it; now it looks like they're merely floating downstream. So when you look at something like Reddit and think I wish I could think of an idea like that, remember: ideas like that are all around you. But you ignore them because they look wrong. Six Principles for Making New Things After the last talk I gave, one of the organizers got up on the stage to deliver an impromptu rebuttal. That never happened before. I only heard the first few sentences, but that was enough to tell what I said that upset him: that startups would do better if they moved to Silicon Valley. This conference was in London, and most of the audience seemed to be from the UK. So saying startups should move to Silicon Valley seemed like a nationalistic remark: an obnoxious American telling them that if they wanted to do things right they should all just move to America. Actually I'm less American than I seem. I didn't say so, but I'm British by birth. And just as Jews are ex officio allowed to tell Jewish jokes, I don't feel like I have to bother being diplomatic with a British audience. The idea that startups would do better to move to Silicon Valley is not even a nationalistic one. It's the same thing I say to startups in the US. Y Combinator alternates between coasts every 6 months. Every other funding cycle is in Boston. And even though Boston is the second biggest startup hub in the US (and the world), we tell the startups from those cycles that their best bet is to move to Silicon Valley. If that's true of Boston, it's even more true of every other city. This is about cities, not countries. And I think I can prove I'm right. You can easily reduce the opposing argument ad what most people would agree was absurdum. Few would be willing to claim that it doesn't matter at all where a startup is that a startup operating out of a small agricultural town wouldn't benefit from moving to a startup hub. Most people could see how it might be helpful to be in a place where there was infrastructure for startups, accumulated knowledge about how to make them work, and other people trying to do it. And yet whatever argument you use to prove that startups don't need to move from London to Silicon Valley could equally well be used to prove startups don't need to move from smaller towns to London. The difference between cities is a matter of degree. And if, as nearly everyone who knows agrees, startups are better off in Silicon Valley than Boston, then they're better off in Silicon Valley than everywhere else too. I realize I might seem to have a vested interest in this conclusion, because startups that move to the",5,5,5
What is the purpose of a rolling close in fundraising?,"To make fundraising take less time, not more.","The point of a rolling close is to make fundraising take less time, not more.","as I explain later. Doing a rolling close doesn't mean the company is always raising money. That would be a distraction. The point of a rolling close is to make fundraising take less time, not more. With a classic fixed sized round, you don't get any money till all the investors agree, and that often creates a situation where they all sit waiting for the others to act. A rolling close usually prevents this. There are two (non-exclusive) causes of hot deals: the quality of the company, and domino effects among investors. The former is obviously a better predictor of success. Some of the randomness is concealed by the fact that investment is a self fulfilling prophecy. The shift in power to founders is exaggerated now because it's a seller's market. On the next downtick it will seem like I overstated the case. But on the next uptick after that, founders will seem more powerful than ever. More generally, it will become less common for the same investor to invest in successive rounds, except when exercising an option to maintain their percentage. When the same investor invests in successive rounds, it often means the startup isn't getting market price. They may not care; they may prefer to work with an investor they already know; but as the investment market becomes more efficient, it will become increasingly easy to get market price if they want it. Which in turn means the investment community will tend to become more stratified. The two 10 minuteses have 3 weeks between them so founders can get cheap plane tickets, but except for that they could be adjacent. I'm not saying option pools themselves will go away. They're an administrative convenience. What will go away is investors requiring them. What hard liquor, cigarettes, heroin, and crack have in common is that they're all more concentrated forms of less addictive predecessors. Most if not all the things we describe as addictive are. And the scary thing is, the process that created them is accelerating. We wouldn't want to stop it. It's the same process that cures diseases: technological progress. Technological progress means making things do more of what we want. When the thing we want is something we want to want, we consider technological progress good. If some new technique makes solar cells x% more efficient, that seems strictly better. When progress concentrates something we don't want to want when it transforms opium into heroin â€” it seems bad. But it's the same process at work. No one doubts this process is accelerating, which means increasing numbers of things we like will be transformed into things we like too much. As far as I know there's no word for something we like too much. The closest is the colloquial sense of addictive. That usage has become increasingly common during my lifetime. And it's clear why: there are an increasing number of things we need it for. At the extreme end of the spectrum are crack and meth.",5,4,4
How do most hackers learn to hack?,Most hackers learn to hack by writing programs of their own at age thirteen.,Most hackers don't learn to hack by taking college courses in programming. They learn to hack by writing programs of their own at age thirteen.,"musicians, who perform at night. More generally, it means that you have one kind of work you do for money, and another for love. Nearly all makers have day jobs early in their careers. Painters and writers notoriously do. If you're lucky you can get a day job that's closely related to your real work. Musicians often seem to work in record stores. A hacker working on some programming language or operating system might likewise be able to get a day job using it. When I say that the answer is for hackers to have day jobs, and work on beautiful software on the side, I'm not proposing this as a new idea. This is what open-source hacking is all about. What I'm saying is that open-source is probably the right model, because it has been independently confirmed by all the other makers. It seems surprising to me that any employer would be reluctant to let hackers work on open-source projects. At Viaweb, we would have been reluctant to hire anyone who didn't. When we interviewed programmers, the main thing we cared about was what kind of software they wrote in their spare time. You can't do anything really well unless you love it, and if you love to hack you'll inevitably be working on projects of your own. Because hackers are makers rather than scientists, the right place to look for metaphors is not in the sciences, but among other kinds of makers. What else can painting teach us about hacking? One thing we can learn, or at least confirm, from the example of painting is how to learn to hack. You learn to paint mostly by doing it. Ditto for hacking. Most hackers don't learn to hack by taking college courses in programming. They learn to hack by writing programs of their own at age thirteen. Even in college classes, you learn to hack mostly by hacking. Because painters leave a trail of work behind them, you can watch them learn by doing. If you look at the work of a painter in chronological order, you'll find that each painting builds on things that have been learned in previous ones. When there's something in a painting that works very well, you can usually find version 1 of it in a smaller form in some earlier painting. I think most makers work this way. Writers and architects seem to as well. Maybe it would be good for hackers to act more like painters, and regularly start over from scratch, instead of continuing to work for years on one project, and trying to incorporate all their later ideas as revisions. The fact that hackers learn to hack by doing it is another sign of how different hacking is from the sciences. Scientists don't learn science by doing it, but by doing labs and problem sets. Scientists start out doing work that's perfect, in the sense that they're just trying to reproduce work someone else has already done for them. Eventually,",5,4,4
What should a startup do when not in fundraising mode?,"Take money from investors only if they require no convincing, and are willing to invest on terms you'll take without negotiation.",You can take money from investors when you're not in fundraising mode. You just can't expend any attention on it.,"you'll not only waste your time, but also burn your reputation with those investors. Be in fundraising mode or not. One of the things that surprises founders most about fundraising is how distracting it is. When you start fundraising, everything else grinds to a halt. The problem is not the time fundraising consumes but that it becomes the `top idea in your mind. A startup can't endure that level of distraction for long. An early stage startup grows mostly because the founders make it grow, and if the founders look away, growth usually drops sharply. Because fundraising is so distracting, a startup should either be in fundraising mode or not. And when you do decide to raise money, you should focus your whole attention on it so you can get it done quickly and get back to work. You can take money from investors when you're not in fundraising mode. You just can't expend any attention on it. There are two things that take attention: convincing investors, and negotiating with them. So when you're not in fundraising mode, you should take money from investors only if they require no convincing, and are willing to invest on terms you'll take without negotiation. For example, if a reputable investor is willing to invest on a convertible note, using standard paperwork, that is either uncapped or capped at a good valuation, you can take that without having to think. The terms will be whatever they turn out to be in your next equity round. And no convincing means just that: zero time spent meeting with investors or preparing materials for them. If an investor says they're ready to invest, but they need you to come in for one meeting to meet some of the partners, tell them no, if you're not in fundraising mode, because that's fundraising. Tell them politely; tell them you're focusing on the company right now, and that you'll get back to them when you're fundraising; but do not get sucked down the slippery slope. Investors will try to lure you into fundraising when you're not. It's great for them if they can, because they can thereby get a shot at you before everyone else. They'll send you emails saying they want to meet to learn more about you. If you get cold-emailed by an associate at a VC firm, you shouldn't meet even if you are in fundraising mode. Deals don't happen that way. But even if you get an email from a partner you should try to delay meeting till you're in fundraising mode. They may say they just want to meet and chat, but investors never just want to meet and chat. What if they like you? What if they start to talk about giving you money? Will you be able to resist having that conversation? Unless you're experienced enough at fundraising to have a casual conversation with investors that stays casual, it's safer to tell them that you'd be happy to later, when you're fundraising, but",5,4,4
What is the main reason startups need to raise money?,Because you need money to live on.,One answer to that is obvious: because you need money to live on.,"on. Some of the more unscrupulous do it deliberately. But even the most well-intentioned investors can behave in a way that would seem crazy in everyday life. One day they're full of enthusiasm and seem ready to write you a check on the spot; the next they won't return your phone calls. They're not playing games with you. They just can't make up their minds. If that weren't bad enough, these wildly fluctuating nodes are all linked together. Startup investors all know one another, and (though they hate to admit it) the biggest factor in their opinion of you is the opinion of other investors. Talk about a recipe for an unstable system. You get the opposite of the damping that the fear/greed balance usually produces in markets. No one is interested in a startup that's a bargain because everyone else hates it. So the inefficient market you get because there are so few players is exacerbated by the fact that they act less than independently. The result is a system like some kind of primitive, multi-celled sea creature, where you irritate one extremity and the whole thing contracts violently. Y Combinator is working to fix this. We're trying to increase the number of investors just as we're increasing the number of startups. We hope that as the number of both increases we'll get something more like an efficient market. As t approaches infinity, Demo Day approaches an auction. Unfortunately, t is still very far from infinity. What does a startup do now, in the imperfect world we currently inhabit? The most important thing is not to let fundraising get you down. Startups live or die on morale. If you let the difficulty of raising money destroy your morale, it will become a self-fulfilling prophecy. Bootstrapping (= Consulting): Some would-be founders may by now be thinking, why deal with investors at all? If raising money is so painful, why do it? One answer to that is obvious: because you need money to live on. It's a fine idea in principle to finance your startup with its own revenues, but you can't create instant customers. Whatever you make, you have to sell a certain amount to break even. It will take time to grow your sales to that point, and it's hard to predict, till you try, how long it will take. We could not have bootstrapped Viaweb, for example. We charged quite a lot for our softwareâ€”about $140 per user per month but it was at least a year before our revenues would have covered even our paltry costs. We didn't have enough saved to live on for a year. If you factor out the bootstrapped companies that were actually funded by their founders through savings or a day job, the remainder either (a) got really lucky, which is hard to do on demand, or (b) began life as consulting companies and gradually transformed themselves into product companies. Consulting is the only option you can count on. But consulting is",5,5,5
What do large-scale investors categorize startups into?,"successes, failures, and the living dead companies","Large-scale investors tend to put startups in three categories: successes, failures, and the living dead companies that are plugging along but don't seem likely in the immediate future to get bought or go public.","given startup to succeed, like founders do, just their portfolio as a whole to. So in borderline cases the rational thing for them to do is to sacrifice unpromising startups. Large-scale investors tend to put startups in three categories: successes, failures, and the living dead companies that are plugging along but don't seem likely in the immediate future to get bought or go public. To the founders, living dead sounds harsh. These companies may be far from failures by ordinary standards. But they might as well be from a venture investor's point of view, and they suck up just as much time and attention as the successes. So if such a company has two possible strategies, a conservative one that's slightly more likely to work in the end, or a risky one that within a short time will either yield a giant success or kill the company, VCs will push for the kill-or-cure option. To them the company is already a write-off. Better to have resolution, one way or the other, as soon as possible. If a startup gets into real trouble, instead of trying to save it VCs may just sell it at a low price to another of their portfolio companies. Philip Greenspun said in Founders at Work that Ars Digita's VCs did this to them. 18. Investors have different risk profiles from founders. Most people would rather a 100% chance of $1 million than a 20% chance of $10 million. Investors are rich enough to be rational and prefer the latter. So they'll always tend to encourage founders to keep rolling the dice. If a company is doing well, investors will want founders to turn down most acquisition offers. And indeed, most startups that turn down acquisition offers ultimately do better. But it's still hair-raising for the founders, because they might end up with nothing. When someone's offering to buy you for a price at which your stock is worth $5 million, saying no is equivalent to having $5 million and betting it all on one spin of the roulette wheel. Investors will tell you the company is worth more. And they may be right. But that doesn't mean it's wrong to sell. Any financial advisor who put all his client's assets in the stock of a single, private company would probably lose his license for it. More and more, investors are letting founders cash out partially. That should correct the problem. Most founders have such low standards that they'll feel rich with a sum that doesn't seem huge to investors. But this custom is spreading too slowly, because VCs are afraid of seeming irresponsible. No one wants to be the first VC to give someone fuck-you money and then actually get told fuck you. But until this does start to happen, we know VCs are being too conservative. 19. Investors vary greatly. Back when I was a founder I used to think all VCs were the same. And in fact they do all look the same.",5,4,4
What are the two measures of economic inequality?,Variation in income and variation in wealth.,"economic inequality is a single measure or more precisely, two: variation in income, and variation in wealth,","on is that while economic inequality is a single measure or more precisely, two: variation in income, and variation in wealth, it has multiple causes. Many of these causes are bad, like tax loopholes and drug addiction. But some are good, like Larry Page and Sergey Brin starting the company you use to find things online. If you want to understand economic inequality and more importantly, if you actually want to fix the bad aspects of it you have to tease apart the components. And yet the trend in nearly everything written about the subject is to do the opposite: to squash together all the aspects of economic inequality as if it were a single phenomenon. Sometimes this is done for ideological reasons. Sometimes it's because the writer only has very high-level data and so draws conclusions from that, like the proverbial drunk who looks for his keys under the lamppost, instead of where he dropped them, because the light is better there. Sometimes it's because the writer doesn't understand critical aspects of inequality, like the role of technology in wealth creation. Much of the time, perhaps most of the time, writing about economic inequality combines all three. The most common mistake people make about economic inequality is to treat it as a single phenomenon. The most naive version of which is the one based on the pie fallacy: that the rich get rich by taking money from the poor. Usually this is an assumption people start from rather than a conclusion they arrive at by examining the evidence. Sometimes the pie fallacy is stated explicitly: those at the top are grabbing an increasing fraction of the nation's income â€” so much of a larger share that what's left over for the rest is diminished Other times it's more unconscious. But the unconscious form is very widespread. I think because we grow up in a world where the pie fallacy is actually true. To kids, wealth is a fixed pie that's shared out, and if one person gets more, it's at the expense of another. It takes a conscious effort to remind oneself that the real world doesn't work that way. In the real world you can create wealth as well as taking it from others. A woodworker creates wealth. He makes a chair, and you willingly give him money in return for it. A high-frequency trader does not. He makes a dollar only when someone on the other end of a trade loses a dollar. If the rich people in a society got that way by taking wealth from the poor, then you have the degenerate case of economic inequality, where the cause of poverty is the same as the cause of wealth. But instances of inequality don't have to be instances of the degenerate case. If one woodworker makes 5 chairs and another makes none, the second woodworker will have less money, but not because anyone took anything from him. Even people sophisticated enough to know about the",5,4,5
What do most humans find engaging in images?,Most humans will also find images of 3D objects engaging.,"Most humans will also find images of 3D objects engaging, because that also seems to be built into our visual perception.","the edges, there are a lot of things practically all humans have in common. In addition to our interest in faces, there's something special about primary colors for nearly all of us, because it's an artifact of the way our eyes work. Most humans will also find images of 3D objects engaging, because that also seems to be built into our visual perception. And beneath that there's edge-finding, which makes images with definite shapes more engaging than mere blur. Humans have a lot more in common than this, of course. My goal is not to compile a complete list, just to show that there's some solid ground here. People's preferences aren't random. So an artist working on a painting and trying to decide whether to change some part of it doesn't have to think Why bother? I might as well flip a coin. Instead he can ask What would make the painting more interesting to people? And the reason you can't equal Michelangelo by going out and buying a blank canvas is that the ceiling of the Sistine Chapel is more interesting to people. A lot of philosophers have had a hard time believing it was possible for there to be objective standards for art. It seemed obvious that beauty, for example, was something that happened in the head of the observer, not something that was a property of objects. It was thus subjective rather than objective. But in fact if you narrow the definition of beauty to something that works a certain way on humans, and you observe how much humans have in common, it turns out to be a property of objects after all. You don't have to choose between something being a property of the subject or the object if subjects all react similarly. Being good art is thus a property of objects as much as, say, being toxic to humans is: it's good art if it consistently affects humans in a certain way. Error: So could we figure out what the best art is by taking a vote? After all, if appealing to humans is the test, we should be able to just ask them, right? Well, not quite. For products of nature that might work. I'd be willing to eat the apple the world's population had voted most delicious, and I'd probably be willing to visit the beach they voted most beautiful, but having to look at the painting they voted the best would be a crapshoot. Man-made stuff is different. For one thing, artists, unlike apple trees, often deliberately try to trick us. Some tricks are quite subtle. For example, any work of art sets expectations by its level of finish. You don't expect photographic accuracy in something that looks like a quick sketch. So one widely used trick, especially among illustrators, is to intentionally make a painting or drawing look like it was done faster than it was. The average person looks at it and thinks: how amazingly skillful. It's like saying something",5,4,5
What is the medium of exchange that has been recently used and is guaranteed by the U.S. Government?,the dollar,"but recently we've been using a medium of exchange, called the dollar, that doesn't physically exist.","societies find, as they get more specialized, is to make the trade into a two-step process. Instead of trading violins directly for potatoes, you trade violins for, say, silver, which you can then trade again for anything else you need. The intermediate stuff-- the medium of exchange-- can be anything that's rare and portable. Historically metals have been the most common, but recently we've been using a medium of exchange, called the dollar, that doesn't physically exist. It works as a medium of exchange, however, because its rarity is guaranteed by the U.S. Government. The advantage of a medium of exchange is that it makes trade work. The disadvantage is that it tends to obscure what trade really means. People think that what a business does is make money. But money is just the intermediate stage-- just a shorthand-- for whatever people want. What most businesses really do is make wealth. They do something people want. A surprising number of people retain from childhood the idea that there is a fixed amount of wealth in the world. There is, in any normal family, a fixed amount of money at any moment. But that's not the same thing. When wealth is talked about in this context, it is often described as a pie. You can't make the pie larger, say politicians. When you're talking about the amount of money in one family's bank account, or the amount available to a government from one year's tax revenue, this is true. If one person gets more, someone else has to get less. I can remember believing, as a child, that if a few rich people had all the money, it left less for everyone else. Many people seem to continue to believe something like this well into adulthood. This fallacy is usually there in the background when you hear someone talking about how x percent of the population have y percent of the wealth. If you plan to start a startup, then whether you realize it or not, you're planning to disprove the Pie Fallacy. What leads people astray here is the abstraction of money. Money is not wealth. It's just something we use to move wealth around. So although there may be, in certain specific moments (like your family, this month) a fixed amount of money available to trade with other people for things you want, there is not a fixed amount of wealth in the world. You can make more wealth. Wealth has been getting created and destroyed (but on balance, created) for all of human history. Suppose you own a beat-up old car. Instead of sitting on your butt next summer, you could spend the time restoring your car to pristine condition. In doing so you create wealth. The world is-- and you specifically are-- one pristine old car the richer. And not just in some metaphorical way. If you sell your car, you'll get more for it. In restoring your old car you have made yourself richer. You haven't",5,4,5
What is the main focus of a startup's presentation on Demo Day?,Explain what you're doing and explain why users will want it.,"On Demo Day each startup will only get ten minutes, so we encourage them to focus on just two goals: (a) explain what you're doing, and (b) explain why users will want it.","rule that haste makes waste. (Too much money seems to be as bad for startups as too much time, so we don't give them much money either.) A week before Demo Day, we have a dress rehearsal called Rehearsal Day. At other Y Combinator events we allow outside guests, but not at Rehearsal Day. No one except the other founders gets to see the rehearsals. The presentations on Rehearsal Day are often pretty rough. But this is to be expected. We try to pick founders who are good at building things, not ones who are slick presenters. Some of the founders are just out of college, or even still in it, and have never spoken to a group of people they didn't already know. So we concentrate on the basics. On Demo Day each startup will only get ten minutes, so we encourage them to focus on just two goals: (a) explain what you're doing, and (b) explain why users will want it. That might sound easy, but it's not when the speakers have no experience presenting, and they're explaining technical matters to an audience that's mostly non-technical. This situation is constantly repeated when startups present to investors: people who are bad at explaining, talking to people who are bad at understanding. Practically every successful startup, including stars like Google, presented at some point to investors who didn't get it and turned them down. Was it because the founders were bad at presenting, or because the investors were obtuse? It's probably always some of both. At the most recent Rehearsal Day, we four Y Combinator partners found ourselves saying a lot of the same things we said at the last two. So at dinner afterward we collected all our tips about presenting to investors. Most startups face similar challenges, so we hope these will be useful to a wider audience. 1. Explain what you're doing. Investors' main question when judging a very early startup is whether you've made a compelling product. Before they can judge whether you've built a good x, they have to understand what kind of x you've built. They will get very frustrated if instead of telling them what you do, you make them sit through some kind of preamble. Say what you're doing as soon as possible, preferably in the first sentence. We're Jeff and Bob and we've built an easy to use web-based database. Now we'll show it to you and explain why people need this. If you're a great public speaker you may be able to violate this rule. Last year one founder spent the whole first half of his talk on a fascinating analysis of the limits of the conventional desktop metaphor. He got away with it, but unless you're a captivating speaker, which most hackers aren't, it's better to play it safe. 2. Get rapidly to demo. This section is now obsolete for YC founders presenting at Demo Day, because Demo Day presentations are now so short that they rarely include much",5,4,5
What are the two methods of introducing new technology?,The organic growth method and the big bang method.,"There are two ways new technology gets introduced: the organic growth method, and the big bang method.","being used only by a small number of early adopters. Early adopters are sophisticated and demanding, and quickly flush out whatever flaws remain in your technology. When you only have a few users you can be in close contact with all of them. And early adopters are forgiving when you improve your system, even if this causes some breakage. There are two ways new technology gets introduced: the organic growth method, and the big bang method. The organic growth method is exemplified by the classic seat-of-the-pants underfunded garage startup. A couple guys, working in obscurity, develop some new technology. They launch it with no marketing and initially have only a few (fanatically devoted) users. They continue to improve the technology, and meanwhile their user base grows by word of mouth. Before they know it, they're big. The other approach, the big bang method, is exemplified by the VC-backed, heavily marketed startup. They rush to develop a product, launch it with great publicity, and immediately (they hope) have a large user base. Generally, the garage guys envy the big bang guys. The big bang guys are smooth and confident and respected by the VCs. They can afford the best of everything, and the PR campaign surrounding the launch has the side effect of making them celebrities. The organic growth guys, sitting in their garage, feel poor and unloved. And yet I think they are often mistaken to feel sorry for themselves. Organic growth seems to yield better technology and richer founders than the big bang method. If you look at the dominant technologies today, you'll find that most of them grew organically. This pattern doesn't only apply to companies. You see it in sponsored research too. Multics and Common Lisp were big-bang projects, and Unix and MacLisp were organic growth projects. Redesign: The best writing is rewriting, wrote E. B. White. Every good writer knows this, and it's true for software too. The most important part of design is redesign. Programming languages, especially, don't get redesigned enough. To write good software you must simultaneously keep two opposing ideas in your head. You need the young hacker's naive faith in his abilities, and at the same time the veteran's skepticism. You have to be able to think how hard can it be? : with one half of your brain while thinking it will never work with the other. The trick is to realize that there's no real contradiction here. You want to be optimistic and skeptical about two different things. You have to be optimistic about the possibility of solving the problem, but skeptical about the value of whatever solution you've got so far. People who do good work often think that whatever they're working on is no good. Others see what they've done and are full of wonder, but the creator is full of worry. This pattern is no coincidence: it is the worry that made the work good. If you can keep hope and worry balanced, they will drive a",5,4,5
What holds people back from trying to do great work?,A combination of modesty and fear.,What holds them back is a combination of modesty and fear.,"of work where your ability and interest will combine to yield an explosion of new ideas? Here there are grounds for optimism. There are so many different ways to do great work, and even more that are still undiscovered. Out of all those different types of work, the one you're most suited for is probably a pretty close match. Probably a comically close match. It's just a question of finding it, and how far into it your ability and interest can take you. And you can only answer that by trying. Many more people could try to do great work than do. What holds them back is a combination of modesty and fear. It seems presumptuous to try to be Newton or Shakespeare. It also seems hard; surely if you tried something like that, you'd fail. Presumably the calculation is rarely explicit. Few people consciously decide not to try to do great work. But that's what's going on subconsciously; they shy away from the question. So I'm going to pull a sneaky trick on you. Do you want to do great work, or not? Now you have to decide consciously. Sorry about that. I wouldn't have done it to a general audience. But we already know you're interested. Don't worry about being presumptuous. You don't have to tell anyone. And if it's too hard and you fail, so what? Lots of people have worse problems than that. In fact you'll be lucky if it's the worst problem you have. Yes, you'll have to work hard. But again, lots of people have to work hard. And if you're working on something you find very interesting, which you necessarily will if you're on the right path, the work will probably feel less burdensome than a lot of your peers'. The discoveries are out there, waiting to be made. Why not by you? I don't think you could give a precise definition of what counts as great work. Doing great work means doing something important so well that you expand people's ideas of what's possible. But there's no threshold for importance. It's a matter of degree, and often hard to judge at the time anyway. So I'd rather people focused on developing their interests rather than worrying about whether they're important or not. Just try to do something amazing, and leave it to future generations to say if you succeeded. A lot of standup comedy is based on noticing anomalies in everyday life. Did you ever notice...? New ideas come from doing this about nontrivial things. Which may help explain why people's reaction to a new idea is often the first half of laughing: Ha! That second qualifier is critical. If you're excited about something most authorities discount, but you can't give a more precise explanation than """"they don't get it,"""" then you're starting to drift into the territory of cranks. Finding something to work on is not simply a matter of finding a match between the current version of you and a",5,4,5
What is the central issue in angel investing?,The central issue is picking the right startups.,The central issue is picking the right startups.,"want you, either because they desperately need money, or you're someone who can help them a lot, they'll let you invest at a low valuation. If they don't need you, it will be higher. So guess. The startup may not have any more idea what the number should be than you do. Ultimately it doesn't matter much. When angels make a lot of money from a deal, it's not because they invested at a valuation of $1.5 million instead of $3 million. It's because the company was really successful. I can't emphasize that too much. Don't get hung up on mechanics or deal terms. What you should spend your time thinking about is whether the company is good. (Similarly, founders also should not get hung up on deal terms, but should spend their time thinking about how to make the company good.) There's a second less obvious component of an angel investment: how much you're expected to help the startup. Like the amount you invest, this can vary a lot. You don't have to do anything if you don't want to; you could simply be a source of money. Or you can become a de facto employee of the company. Just make sure that you and the startup agree in advance about roughly how much you'll do for them. Really hot companies sometimes have high standards for angels. The ones everyone wants to invest in practically audition investors, and only take money from people who are famous and/or will work hard for them. But don't feel like you have to put in a lot of time or you won't get to invest in any good startups. There is a surprising lack of correlation between how hot a deal a startup is and how well it ends up doing. Lots of hot startups will end up failing, and lots of startups no one likes will end up succeeding. And the latter are so desperate for money that they'll take it from anyone at a low valuation. Picking Winners It would be nice to be able to pick those out, wouldn't it? The part of angel investing that has most effect on your returns, picking the right companies, is also the hardest. So you should practically ignore (or more precisely, archive, in the Gmail sense) everything I've told you so far. You may need to refer to it at some point, but it is not the central issue. The central issue is picking the right startups. What Make something people want is for startups, Pick the right startups is for investors. Combined they yield Pick the startups that will make something people want. How do you do that? It's not as simple as picking startups that are already making something wildly popular. By then it's too late for angels. VCs will already be onto them. As an angel, you have to pick startups before they've got a hit either because they've made something great but users don't realize it yet, like Google",5,5,4
Why do most successful startups take outside investment?,"Practically every successful startup takes outside investment at some point because they will have competitors, and outside investment can provide an advantage.",Practically every successful startup takes outside investment at some point.,"looks like you're taking off. Sometimes they're more candid and say explicitly that they need to see some traction. They'll invest in you if you start to get lots of users. But so would any VC. So all they're saying is that you're still at square 1. Here's a test for deciding whether a VC's response was yes or no. Look down at your hands. Are you holding a termsheet? 22. You need investors. Some founders say Who needs investors? Empirically the answer seems to be: everyone who wants to succeed. Practically every successful startup takes outside investment at some point. Why? What the people who think they don't need investors forget is that they will have competitors. The question is not whether you need outside investment, but whether it could help you at all. If the answer is yes, and you don't take investment, then competitors who do will have an advantage over you. And in the startup world a little advantage can expand into a lot. Mike Moritz famously said that he invested in Yahoo because he thought they had a few weeks' lead over their competitors. That may not have mattered quite so much as he thought, because Google came along three years later and kicked Yahoo's ass. But there is something in what he said. Sometimes a small lead can grow into the yes half of a binary choice. Maybe as it gets cheaper to start a startup, it will start to be possible to succeed in a competitive market without outside funding. There are certainly costs to raising money. But as of this writing the empirical evidence says it's a net win. 23. Investors like it when you don't need them. A lot of founders approach investors as if they needed their permission to start a companyâ€”as if it were like getting into college. But you don't need investors to start most companies; they just make it easier. And in fact, investors greatly prefer it if you don't need them. What excites them, both consciously and unconsciously, is the sort of startup that approaches them saying the train's leaving the station; are you in or out? not the one saying please can we have some money to start a company? Most investors are bottoms in the sense that the startups they like most are those that are rough with them. When Google stuck Kleiner and Sequoia with a $75 million premoney valuation, their reaction was probably Ouch! That feels so good. And they were right, weren't they? That deal probably made them more than any other they've done. The thing is, VCs are pretty good at reading people. So don't try to act tough with them unless you really are the next Google, or they'll see through you in a second. Instead of acting tough, what most startups should do is simply always have a backup plan. Always have some alternative plan for getting started if any given investor says no. Having one is the",5,4,5
Why is having the right domain name important for a startup?,It signals strength even if it has no relation to what you do.,Whereas (as Stripe shows) having x.com signals strength even if it has no relation to what you do.,"you're a founder, here's a deal you can make with yourself that will both make you happy and make your company successful. Tell yourself you can be as nice as you want, so long as you work hard on your growth rate to compensate. Most successful startups make that tradeoff unconsciously. Maybe if you do it consciously you'll do it even better. Many think successful startup founders are driven by money. In fact the secret weapon of the most successful founders is that they aren't. If they were, they'd have taken one of the acquisition offers that every fast-growing startup gets on the way up. What drives the most successful founders is the same thing that drives most people who make things: the company is their project. In fact since 2 â‰ˆ 1.05 ^ 15, the un-rapacious founder is always 15 weeks behind the rapacious one. The other reason it might help to be good at squeezing money out of customers is that startups usually lose money at first, and making more per customer makes it easier to get to profitability before your initial funding runs out. But while it is very common for startups to die from running through their initial funding and then being unable to raise more, the underlying cause is usually slow growth or excessive spending rather than insufficient effort to extract money from existing customers. If you have a US startup called X and you don't have x.com, you should probably change your name. The reason is not just that people can't find you. For companies with mobile apps, especially, having the right domain name is not as critical as it used to be for getting users. The problem with not having the .com of your name is that it signals weakness. Unless you're so big that your reputation precedes you, a marginal domain suggests you're a marginal company. Whereas (as Stripe shows) having x.com signals strength even if it has no relation to what you do. Even good founders can be in denial about this. Their denial derives from two very powerful forces: identity, and lack of imagination.X is what we are , founders think. There's no other name as good. Both of which are false. You can fix the first by stepping back from the problem. Imagine you'd called your company something else. If you had, surely you'd be just as attached to that name as you are to your current one. The idea of switching to your current name would seem repellent. There's nothing intrinsically great about your current name. Nearly all your attachment to it comes from it being attached to you. The way to neutralize the second source of denial, your inability to think of other potential names, is to acknowledge that you're bad at naming. Naming is a completely separate skill from those you need to be a good founder. You can be a great startup founder but hopeless at thinking of names for your company. Once you acknowledge",4,5,5
What is the most important feature of a good programming language?,Very powerful abstractions.,the most important feature of a good programming language: very powerful abstractions.,"a lot of what looks like work. Something that might naturally be represented as, say, a list of integers, can now be represented as a class with all kinds of scaffolding and hustle and bustle. Another attraction of object-oriented programming is that methods give you some of the effect of first class functions. But this is old news to Lisp programmers. When you have actual first class functions, you can just use them in whatever way is appropriate to the task at hand, instead of forcing everything into a mold of classes and methods. What this means for language design, I think, is that you shouldn't build object-oriented programming in too deeply. Maybe the answer is to offer more general, underlying stuff, and let people design whatever object systems they want as libraries. Design by Committee: Having your language designed by a committee is a big pitfall, and not just for the reasons everyone knows about. Everyone knows that committees tend to yield lumpy, inconsistent designs. But I think a greater danger is that they won't take risks. When one person is in charge he can take risks that a committee would never agree on. Is it necessary to take risks to design a good language though? Many people might suspect that language design is something where you should stick fairly close to the conventional wisdom. I bet this isn't true. In everything else people do, reward is proportionate to risk. Why should language design be any different?"",Five Questions about Language Design the most important feature of a good programming language: very powerful abstractions. A friend of mine once told an eminent operating systems expert that he wanted to design a really good programming language. The expert told him that it would be a waste of time, that programming languages don't become popular or unpopular based on their merits, and so no matter how good his language was, no one would use it. At least, that was what had happened to the language he had designed. What does make a language popular? Do popular languages deserve their popularity? Is it worth trying to define a good programming language? How would you do it? I think the answers to these questions can be found by looking at hackers, and learning what they want. Programming languages are for hackers, and a programming language is good as a programming language (rather than, say, an exercise in denotational semantics or compiler design) if and only if hackers like it. The Mechanics of Popularity: It's true, certainly, that most people don't choose programming languages simply based on their merits. Most programmers are told what language to use by someone else. And yet I think the effect of such external factors on the popularity of programming languages is not as great as it's sometimes thought to be. I think a bigger problem is that a hacker's idea of a good programming language is not the same as most language designers'. Between the two, the hacker's opinion",5,4,5
What is a significant advantage of poverty for startups?,"Poverty implies you can live cheaply, and this is critically important for startups.","Poverty implies you can live cheaply, and this is critically important for startups.","as they'll be later. Your second advantage, poverty, might not sound like an advantage, but it is a huge one. Poverty implies you can live cheaply, and this is critically important for startups. Nearly every startup that fails, fails by running out of money. It's a little misleading to put it this way, because there's usually some other underlying cause. But regardless of the source of your problems, a low burn rate gives you more opportunity to recover from them. And since most startups make all kinds of mistakes at first, room to recover from mistakes is a valuable thing to have. Most startups end up doing something different than they planned. The way the successful ones find something that works is by trying things that don't. So the worst thing you can do in a startup is to have a rigid, pre-ordained plan and then start spending a lot of money to implement it. Better to operate cheaply and give your ideas time to evolve. Recent grads can live on practically nothing, and this gives you an edge over older founders, because the main cost in software startups is people. The guys with kids and mortgages are at a real disadvantage. This is one reason I'd bet on the 25 year old over the 32 year old. The 32 year old probably is a better programmer, but probably also has a much more expensive life. Whereas a 25 year old has some work experience (more on that later) but can live as cheaply as an undergrad. Robert Morris and I were 29 and 30 respectively when we started Viaweb, but fortunately we still lived like 23 year olds. We both had roughly zero assets. I would have loved to have a mortgage, since that would have meant I had a house. But in retrospect having nothing turned out to be convenient. I wasn't tied down and I was used to living cheaply. Even more important than living cheaply, though, is thinking cheaply. One reason the Apple II was so popular was that it was cheap. The computer itself was cheap, and it used cheap, off-the-shelf peripherals like a cassette tape recorder for data storage and a TV as a monitor. And you know why? Because Woz designed this computer for himself, and he couldn't afford anything more. We benefitted from the same phenomenon. Our prices were daringly low for the time. The top level of service was $300 a month, which was an order of magnitude below the norm. In retrospect this was a smart move, but we didn't do it because we were smart. $300 a month seemed like a lot of money to us. Like Apple, we created something inexpensive, and therefore popular, simply because we were poor. A lot of startups have that form: someone comes along and makes something for a tenth or a hundredth of what it used to cost, and the existing players can't follow because they don't even want to think about",5,4,4
What is the main purpose of rereading what you've written in essay writing?,To ask if it is correct and complete.,At least half of essay writing is rereading what you've written and asking is this correct and complete?,"converts your ideas from vague to bad. But that's a step forward, because once you can see the brokenness, you can fix it. Perhaps beginning writers are alarmed at the thought of starting with something mistaken or incomplete, but you shouldn't be, because this is why essay writing works. Forcing yourself to commit to some specific string of words gives you a starting point, and if it's wrong, you'll see that when you reread it. At least half of essay writing is rereading what you've written and asking is this correct and complete? You have to be very strict when rereading, not just because you want to keep yourself honest, but because a gap between your response and the truth is often a sign of new ideas to be discovered. The prize for being strict with what you've written is not just refinement. When you take a roughly correct answer and try to make it exactly right, sometimes you find that you can't, and that the reason is that you were depending on a false assumption. And when you discard it, the answer turns out to be completely different. Ideally the response to a question is two things: the first step in a process that converges on the truth, and a source of additional questions (in my very general sense of the word). So the process continues recursively, as response spurs response. Usually there are several possible responses to a question, which means you're traversing a tree. But essays are linear, not tree-shaped, which means you have to choose one branch to follow at each point. How do you choose? Usually you should follow whichever offers the greatest combination of generality and novelty. I don't consciously rank branches this way; I just follow whichever seems most exciting; but generality and novelty are what make a branch exciting. If you're willing to do a lot of rewriting, you don't have to guess right. You can follow a branch and see how it turns out, and if it isn't good enough, cut it and backtrack. I do this all the time. In this essay I've already cut a 17-paragraph subtree, in addition to countless shorter ones. Maybe I'll reattach it at the end, or boil it down to a footnote, or spin it off as its own essay; we'll see. In general you want to be quick to cut. One of the most dangerous temptations in writing (and in software and painting) is to keep something that isn't right, just because it contains a few good bits or cost you a lot of effort. The most surprising new question being thrown off at this point is does it really matter what the initial question is? If the space of ideas is highly connected, it shouldn't, because you should be able to get from any question to the most valuable ones in a few hops. And we see evidence that it's highly connected in the way, for example, that people who are obsessed",5,5,5
What are the three things any programming language needs?,"A free implementation, a book, and something to hack.","Given that you can supply the three things any language needs a free implementation, a book, and something to hack how do you make a language that hackers will like?","language really isn't a programming language unless it's also the scripting language of something. This only seems unfair if it comes as a surprise. I think it's no more unfair than expecting a programming language to have, say, an implementation. It's just part of what a programming language is. A programming language does need a good implementation, of course, and this must be free. Companies will pay for software, but individual hackers won't, and it's the hackers you need to attract. A language also needs to have a book about it. The book should be thin, well-written, and full of good examples. K&R is the ideal here. At the moment I'd almost say that a language has to have a book published by O'Reilly. That's becoming the test of mattering to hackers. There should be online documentation as well. In fact, the book can start as online documentation. But I don't think that physical books are outmoded yet. Their format is convenient, and the de facto censorship imposed by publishers is a useful if imperfect filter. Bookstores are one of the most important places for learning about new languages. Brevity: Given that you can supply the three things any language needs a free implementation, a book, and something to hack how do you make a language that hackers will like? One thing hackers like is brevity. Hackers are lazy, in the same way that mathematicians and modernist architects are lazy: they hate anything extraneous. It would not be far from the truth to say that a hacker about to write a program decides what language to use, at least subconsciously, based on the total number of characters he'll have to type. If this isn't precisely how hackers think, a language designer would do well to act as if it were. It is a mistake to try to baby the user with long-winded expressions that are meant to resemble English. Cobol is notorious for this flaw. A hacker would consider being asked to write add x to y giving z instead of z = x+y as something between an insult to his intelligence and a sin against God. It has sometimes been said that Lisp should use first and rest instead of car and cdr, because it would make programs easier to read. Maybe for the first couple hours. But a hacker can learn quickly enough that car means the first element of a list and cdr means the rest. Using first and rest means 50% more typing. And they are also different lengths, meaning that the arguments won't line up when they're called, as car and cdr often are, in successive lines. I've found that it matters a lot how code lines up on the page. I can barely read Lisp code when it is set in a variable-width font, and friends say this is true for other languages too. Brevity is one place where strongly typed languages lose. All other things being equal, no one wants to begin a",5,4,5
What shape will the startup business of the future resemble?,It will become a pyramid.,"the startup business of the future won't simply be the same shape, scaled up. What used to be an obelisk will become a pyramid.","of failure to increase the number of failures and yet leave you net ahead. The other reason the number of big hits won't grow proportionately to the number of startups is that there will start to be an increasing number of idea clashes. Although the finiteness of the number of good ideas is not the reason there are only 15 big hits a year, the number has to be finite, and the more startups there are, the more we'll see multiple companies doing the same thing at the same time. It will be interesting, in a bad way, if idea clashes become a lot more common. Mostly because of the increasing number of early failures, the startup business of the future won't simply be the same shape, scaled up. What used to be an obelisk will become a pyramid. It will be a little wider at the top, but a lot wider at the bottom. What does that mean for investors? One thing it means is that there will be more opportunities for investors at the earliest stage, because that's where the volume of our imaginary solid is growing fastest. Imagine the obelisk of investors that corresponds to the obelisk of startups. As it widens out into a pyramid to match the startup pyramid, all the contents are adhering to the top, leaving a vacuum at the bottom. That opportunity for investors mostly means an opportunity for new investors, because the degree of risk an existing investor or firm is comfortable taking is one of the hardest things for them to change. Different types of investors are adapted to different degrees of risk, but each has its specific degree of risk deeply imprinted on it, not just in the procedures they follow but in the personalities of the people who work there. I think the biggest danger for VCs, and also the biggest opportunity, is at the series A stage. Or rather, what used to be the series A stage before series As turned into de facto series B rounds. Right now, VCs often knowingly invest too much money at the series A stage. They do it because they feel they need to get a big chunk of each series A company to compensate for the opportunity cost of the board seat it consumes. Which means when there is a lot of competition for a deal, the number that moves is the valuation (and thus amount invested) rather than the percentage of the company being sold. Which means, especially in the case of more promising startups, that series A investors often make companies take more money than they want. Some VCs lie and claim the company really needs that much. Others are more candid, and admit their financial models require them to own a certain percentage of each company. But we all know the amounts being raised in series A rounds are not determined by asking what would be best for the companies. They're determined by VCs starting from the",5,4,4
How can you cultivate curiosity?,Seek out the topics that engage it and indulge it by investigating things you're interested in.,The most important active step you can take to cultivate your curiosity is probably to seek out the topics that engage it.,"get the same result. So there is not just a single model of independent-mindedness. Some independent-minded people are openly subversive, and others are quietly curious. They all know the secret handshake though. Is there a way to cultivate curiosity? To start with, you want to avoid situations that suppress it. How much does the work you're currently doing engage your curiosity? If the answer is """"not much,"""" maybe you should change something. The most important active step you can take to cultivate your curiosity is probably to seek out the topics that engage it. Few adults are equally curious about everything, and it doesn't seem as if you can choose which topics interest you. So it's up to you to find them. Or invent them, if necessary. Another way to increase your curiosity is to indulge it, by investigating things you're interested in. Curiosity is unlike most other appetites in this respect: indulging it tends to increase rather than to sate it. Questions lead to more questions. Curiosity seems to be more individual than fastidiousness about truth or resistance to being told what to think. To the degree people have the latter two, they're usually pretty general, whereas different people can be curious about very different things. So perhaps curiosity is the compass here. Perhaps, if your goal is to discover novel ideas, your motto should not be """"do what you love"""" so much as """"do what you're curious about."""" One convenient consequence of the fact that no one identifies as conventional-minded is that you can say what you like about conventional-minded people without getting in too much trouble. When I wrote The Four Quadrants of Conformism I expected a firestorm of rage from the aggressively conventional-minded, but in fact it was quite muted. They sensed that there was something about the essay that they disliked intensely, but they had a hard time finding a specific passage to pin it on. When I ask myself what in my life is like high school, the answer is Twitter. It's not just full of conventional-minded people, as anything its size will inevitably be, but subject to violent storms of conventional-mindedness that remind me of descriptions of Jupiter. But while it probably is a net loss to spend time there, it has at least made me think more about the distinction between independent- and conventional-mindedness, which I probably wouldn't have done otherwise. The decrease in independent-mindedness in growing startups is still an open problem, but there may be solutions. Founders can delay the problem by making a conscious effort only to hire independent-minded people. Which of course also has the ancillary benefit that they have better ideas. Another possible solution is to create policies that somehow disrupt the force of conformism, much as control rods slow chain reactions, so that the conventional-minded aren't as dangerous. The physical separation of Lockheed's Skunk Works may have had this as a side benefit. Recent examples suggest employee forums like Slack may not be an unmitigated good.",5,4,5
What is the purpose of corporate development (corp dev) within companies?,The group within companies that buys other companies.,"Corporate Development, aka corp dev, is the group within companies that buys other companies.","watershed at about age 12, when he got interested in maths. He grew up in the small Welsh seacoast town of Pwllheli. As we retraced his walk to school on Google Street View, he said that it had been nice growing up in the country. Didn't it get boring when you got to be about 15? I asked. No, he said, by then I was interested in maths. In another conversation he told me that what he really liked was solving problems. To me the exercises at the end of each chapter in a math textbook represent work, or at best a way to reinforce what you learned in that chapter. To him the problems were the reward. The text of each chapter was just some advice about solving them. He said that as soon as he got a new textbook he'd immediately work out all the problems to the slight annoyance of his teacher, since the class was supposed to work through the book gradually. Few people know so early or so certainly what they want to work on. But talking to my father reminded me of a heuristic the rest of us can use. If something that seems like work to other people doesn't seem like work to you, that's something you're well suited for. For example, a lot of programmers I know, including me, actually like debugging. It's not something people tend to volunteer; one likes it the way one likes popping zits. But you may have to like debugging to like programming, considering the degree to which programming consists of it. The stranger your tastes seem to other people, the stronger evidence they probably are of what you should do. When I was in college I used to write papers for my friends. It was quite interesting to write a paper for a class I wasn't taking. Plus they were always so relieved. It seemed curious that the same task could be painful to one person and pleasant to another, but I didn't realize at the time what this imbalance implied, because I wasn't looking for it. I didn't realize how hard it can be to decide what you should work on, and that you sometimes have to figure it out from subtle clues, like a detective solving a case in a mystery novel. So I bet it would help a lot of people to ask themselves about this explicitly. What seems like work to other people that doesn't seem like work to you? Corporate Development, aka corp dev, is the group within companies that buys other companies. If you're talking to someone from corp dev, that's why, whether you realize it yet or not. It's usually a mistake to talk to corp dev unless (a) you want to sell your company right now and (b) you're sufficiently likely to get an offer at an acceptable price. In practice that means startups should only talk to corp dev when they're either doing really well or really",5,5,4
Who wrote about the decline of print media?,A friend who works for a big newspaper.,I was talking recently to a friend who works for a big newspaper.,"Talk about a successful press hit-- a wire service article whose first sentence is your own ad copy. The secret to finding other press hits from a given pitch is to realize that they all started from the same document back at the PR firm. Search for a few key phrases and the names of the clients and the experts, and you'll turn up other variants of this story. Casual fridays are out and dress codes are in writes Diane E. Lewis in The Boston Globe. In a remarkable coincidence, Ms. Lewis's industry contacts also include the creative director of GQ. Ripped jeans and T-shirts are out, writes Mary Kathleen Flynn in US News & World Report. And she too knows the creative director of GQ. Men's suits are back writes Nicole Ford in Sexbuzz.Com (the ultimate men's entertainment magazine). Dressing down loses appeal as men suit up at the office writes Tenisha Mercer of The Detroit News. Now that so many news articles are online, I suspect you could find a similar pattern for most trend stories placed by PR firms. I propose we call this new sport PR diving, and I'm sure there are far more striking examples out there than this clump of five stories. Online: After spending years chasing them, it's now second nature to me to recognize press hits for what they are. But before we hired a PR firm I had no idea where articles in the mainstream media came from. I could tell a lot of them were crap, but I didn't realize why. Remember the exercises in critical reading you did in school, where you had to look at a piece of writing and step back and ask whether the author was telling the whole truth? If you really want to be a critical reader, it turns out you have to step back one step further, and ask not just whether the author is telling the truth, but why he's writing about this subject at all. Online, the answer tends to be a lot simpler. Most people who publish online write what they write for the simple reason that they want to. You can't see the fingerprints of PR firms all over the articles, as you can in so many print publications-- which is one of the reasons, though they may not consciously realize it, that readers trust bloggers more than Business Week. I was talking recently to a friend who works for a big newspaper. He thought the print media were in serious trouble, and that they were still mostly in denial about it. They think the decline is cyclic, he said. Actually it's structural. In other words, the readers are leaving, and they're not coming back. Why? I think the main reason is that the writing online is more honest. Imagine how incongruous the New York Times article about suits would sound if you read it in a blog: The urge to look corporate-- sleek, commanding, prudent, yet with just",5,4,4
What are the two main things to focus on for success in technology?,Build stuff and do well in school.,"That's it, just two things, build stuff and do well in school.","short. You need to get good at technology, and the way to do that is to work on your own projects. And you need to do as well in school as you can, so you can get into a good university, because that's where the cofounders and the ideas are. That's it, just two things, build stuff and do well in school. The rhetorical trick in this sentence is that the Google's refer to different things. What I mean is: a company that has as much chance of growing as big as Google ultimately did as Larry and Sergey could have reasonably expected Google itself would at the time they started it. But I think the original version is zippier. Making something for your friends isn't the only source of startup ideas. It's just the best source for young founders, who have the least knowledge of what other people want, and whose own wants are most predictive of future demand. Strangely enough this is particularly true in countries like the US where undergraduate admissions are done badly. US admissions departments make applicants jump through a lot of arbitrary hoops that have little to do with their intellectual ability. But the more arbitrary a test, the more it becomes a test of mere determination and resourcefulness. And those are the two most important qualities in startup founders. So US admissions departments are better at selecting founders than they would be if they were better at selecting students. Despite its title this isn't meant to be the best essay. My goal here is to figure out what the best essay would be like. It would be well-written, but you can write well about any topic. What made it special would be what it was about. Obviously some topics would be better than others. It probably wouldn't be about this year's lipstick colors. But it wouldn't be vaporous talk about elevated themes either. A good essay has to be surprising. It has to tell people something they don't already know. The best essay would be on the most important topic you could tell people something surprising about. That may sound obvious, but it has some unexpected consequences. One is that science enters the picture like an elephant stepping into a rowboat. For example, Darwin first described the idea of natural selection in an essay written in 1844. Talk about an important topic you could tell people something surprising about. If that's the test of a great essay, this was surely the best one written in 1844. And indeed, the best possible essay at any given time would usually be one describing the most important scientific or technological discovery it was possible to make. Another unexpected consequence: I imagined when I started writing this that the best essay would be fairly timeless â€” that the best essay you could write in 1844 would be much the same as the best one you could write now. But in fact the opposite seems to be true.",5,4,4
What is the main mistake that kills startups?,Not making something users want.,In a sense there's just one mistake that kills startups: not making something users want.,"dealers use neutral-sounding language. What happens in practice is that everyone gets really good at talking about art. As the art itself gets more random, the effort that would have gone into the work goes instead into the intellectual sounding theory behind it. My work represents an exploration of gender and sexuality in an urban context, etc. Different people win at that game. There were several other reasons, including that Florence was then the richest and most sophisticated city in the world, and that they lived in a time before photography had (a) killed portraiture as a source of income and (b) made brand the dominant factor in the sale of art. Incidentally, I'm not saying that good art = fifteenth century European art. I'm not saying we should make what they made, but that we should work like they worked. There are fields now in which many people work with the same energy and honesty that fifteenth century artists did, but art is not one of them. In the Q & A period after a recent talk, someone asked what made startups fail. After standing there gaping for a few seconds I realized this was kind of a trick question. It's equivalent to asking how to make a startup succeed â€” if you avoid every cause of failure, you succeed â€” and that's too big a question to answer on the fly. Afterwards I realized it could be helpful to look at the problem from this direction. If you have a list of all the things you shouldn't do, you can turn that into a recipe for succeeding just by negating. And this form of list may be more useful in practice. It's easier to catch yourself doing something you shouldn't than always to remember to do something you should. In a sense there's just one mistake that kills startups: not making something users want. If you make something users want, you'll probably be fine, whatever else you do or don't do. And if you don't make something users want, then you're dead, whatever else you do or don't do. So really this is a list of 18 things that cause startups not to make something users want. Nearly all failure funnels through that. 1. Single Founder Have you ever noticed how few successful startups were founded by just one person? Even companies you think of as having one founder, like Oracle, usually turn out to have more. It seems unlikely this is a coincidence. What's wrong with having one founder? To start with, it's a vote of no confidence. It probably means the founder couldn't talk any of his friends into starting the company with him. That's pretty alarming, because his friends are the ones who know him best. But even if the founder's friends were all wrong and the company is a good bet, he's still at a disadvantage. Starting a startup is too hard for one person. Even if you could do all the work yourself,",5,5,4
What is a potential downside of using complex macros in programming?,Macro definitions are harder to read than ordinary code.,"But that could still be a bad move, because macro definitions are harder to read than ordinary code.","I wrote about this in On Lisp. A complex macro may have to save many times its own length to be justified. If writing some hairy macro could save you ten lines of code every time you use it, and the macro is itself ten lines of code, then you get a net saving in lines if you use it more than once. But that could still be a bad move, because macro definitions are harder to read than ordinary code. You might have to use the macro ten or twenty times before it yielded a net improvement in readability. I'm sure every language has such tradeoffs (though I suspect the stakes get higher as the language gets more powerful). Every programmer must have seen code that some clever person has made marginally shorter by using dubious programming tricks. So there is no argument about that-- at least, not from me. Individual programs can certainly be too succinct for their own good. The question is, can a language be? Can a language compel programmers to write code that's short (in elements) at the expense of overall readability? One reason it's hard to imagine a language being too succinct is that if there were some excessively compact way to phrase something, there would probably also be a longer way. For example, if you felt Lisp programs using a lot of macros or higher-order functions were too dense, you could, if you preferred, write code that was isomorphic to Pascal. If you don't want to express factorial in Arc as a call to a higher-order function (rec zero 1 * 1-) you can also write out a recursive definition:(rfn fact (x) (if (zero x) 1 (* x (fact (1- x))))), Though I can't off the top of my head think of any examples, I am interested in the question of whether a language could be too succinct. Are there languages that force you to write code in a way that is crabbed and incomprehensible? If anyone has examples, I would be very interested to see them. (Reminder: What I'm looking for are programs that are very dense according to the metric of elements sketched above, not merely programs that are short because delimiters can be omitted and everything has a one-character name.) Succinctness is PowerKevin Kelleher suggested an interesting way to compare programming languages: to describe each in terms of the problem it fixes. The surprising thing is how many, and how well, languages can be described this way. Assembly language is too low-level. Algol doesn't have enough data types. Pascal is too wimpy for systems programming. Algol isn't good enough at simulations. Not everything in Simula is an object. Assembly language is too low-level. Fortran is scary. Fortran doesn't have enough data types. ``Every existing language is missing something. Fortran is scary. Fortran isn't good enough at manipulating arrays. APL requires its own character set. Assembly language is too low-level. C is too low-level. C++ is a kludge. And Microsoft is",5,4,4
What is a key reason why fame grows exponentially?,Existing fans bring you new ones.,Fame grows exponentially because existing fans bring you new ones.,"growth or ask what they can learn from other instances of it. The other source of superlinear returns is embodied in the expression winner take all. In a sports match the relationship between performance and return is a step function: the winning team gets one win whether they do much better or just slightly better. The source of the step function is not competition per se, however. It's that there are thresholds in the outcome. You don't need competition to get those. There can be thresholds in situations where you're the only participant, like proving a theorem or hitting a target. It's remarkable how often a situation with one source of superlinear returns also has the other. Crossing thresholds leads to exponential growth: the winning side in a battle usually suffers less damage, which makes them more likely to win in the future. And exponential growth helps you cross thresholds: in a market with network effects, a company that grows fast enough can shut out potential competitors. Fame is an interesting example of a phenomenon that combines both sources of superlinear returns. Fame grows exponentially because existing fans bring you new ones. But the fundamental reason it's so concentrated is thresholds: there's only so much room on the A-list in the average person's head. The most important case combining both sources of superlinear returns may be learning. Knowledge grows exponentially, but there are also thresholds in it. Learning to ride a bicycle, for example. Some of these thresholds are akin to machine tools: once you learn to read, you're able to learn anything else much faster. But the most important thresholds of all are those representing new discoveries. Knowledge seems to be fractal in the sense that if you push hard at the boundary of one area of knowledge, you sometimes discover a whole new field. And if you do, you get first crack at all the new discoveries to be made in it. Newton did this, and so did Durer and Darwin. Are there general rules for finding situations with superlinear returns? The most obvious one is to seek work that compounds. There are two ways work can compound. It can compound directly, in the sense that doing well in one cycle causes you to do better in the next. That happens for example when you're building infrastructure, or growing an audience or brand. Or work can compound by teaching you, since learning compounds. This second case is an interesting one because you may feel you're doing badly as it's happening. You may be failing to achieve your immediate goal. But if you're learning a lot, then you're getting exponential growth nonetheless. This is one reason Silicon Valley is so tolerant of failure. People in Silicon Valley aren't blindly tolerant of failure. They'll only continue to bet on you if you're learning from your failures. But if you are, you are in fact a good bet: maybe your company didn't grow the way you wanted, but you yourself have,",5,4,4
What do hackers prefer in programming languages?,Brevity.,One thing hackers like is brevity.,"and the de facto censorship imposed by publishers is a useful if imperfect filter. Bookstores are one of the most important places for learning about new languages. Brevity: Given that you can supply the three things any language needs a free implementation, a book, and something to hack how do you make a language that hackers will like? One thing hackers like is brevity. Hackers are lazy, in the same way that mathematicians and modernist architects are lazy: they hate anything extraneous. It would not be far from the truth to say that a hacker about to write a program decides what language to use, at least subconsciously, based on the total number of characters he'll have to type. If this isn't precisely how hackers think, a language designer would do well to act as if it were. It is a mistake to try to baby the user with long-winded expressions that are meant to resemble English. Cobol is notorious for this flaw. A hacker would consider being asked to write add x to y giving z instead of z = x+y as something between an insult to his intelligence and a sin against God. It has sometimes been said that Lisp should use first and rest instead of car and cdr, because it would make programs easier to read. Maybe for the first couple hours. But a hacker can learn quickly enough that car means the first element of a list and cdr means the rest. Using first and rest means 50% more typing. And they are also different lengths, meaning that the arguments won't line up when they're called, as car and cdr often are, in successive lines. I've found that it matters a lot how code lines up on the page. I can barely read Lisp code when it is set in a variable-width font, and friends say this is true for other languages too. Brevity is one place where strongly typed languages lose. All other things being equal, no one wants to begin a program with a bunch of declarations. Anything that can be implicit, should be. The individual tokens should be short as well. Perl and Common Lisp occupy opposite poles on this question. Perl programs can be almost cryptically dense, while the names of built-in Common Lisp operators are comically long. The designers of Common Lisp probably expected users to have text editors that would type these long names for them. But the cost of a long name is not just the cost of typing it. There is also the cost of reading it, and the cost of the space it takes up on your screen. Hackability: There is one thing more important than brevity to a hacker: being able to do what you want. In the history of programming languages a surprising amount of effort has gone into preventing programmers from doing things considered to be improper. This is a dangerously presumptuous plan. How can the language designer know what the programmer is",5,4,4
What are the four factors in doing great work?,"ability, interest, effort, and luck","The factors in doing great work are factors in the literal, mathematical sense, and they are: ability, interest, effort, and luck.","make you do anything much more specific than work harder. Curiosity is the best guide. Your curiosity never lies, and it knows more than you do about what's worth paying attention to. Notice how often that word has come up. If you asked an oracle the secret to doing great work and the oracle replied with a single word, my bet would be on curiosity. That doesn't translate directly to advice. It's not enough just to be curious, and you can't command curiosity anyway. But you can nurture it and let it drive you. Curiosity is the key to all four steps in doing great work: it will choose the field for you, get you to the frontier, cause you to notice the gaps in it, and drive you to explore them. The whole process is a kind of dance with curiosity. Believe it or not, I tried to make this essay as short as I could. But its length at least means it acts as a filter. If you made it this far, you must be interested in doing great work. And if so you're already further along than you might realize, because the set of people willing to want to is small. The factors in doing great work are factors in the literal, mathematical sense, and they are: ability, interest, effort, and luck. Luck by definition you can't do anything about, so we can ignore that. And we can assume effort, if you do in fact want to do great work. So the problem boils down to ability and interest. Can you find a kind of work where your ability and interest will combine to yield an explosion of new ideas? Here there are grounds for optimism. There are so many different ways to do great work, and even more that are still undiscovered. Out of all those different types of work, the one you're most suited for is probably a pretty close match. Probably a comically close match. It's just a question of finding it, and how far into it your ability and interest can take you. And you can only answer that by trying. Many more people could try to do great work than do. What holds them back is a combination of modesty and fear. It seems presumptuous to try to be Newton or Shakespeare. It also seems hard; surely if you tried something like that, you'd fail. Presumably the calculation is rarely explicit. Few people consciously decide not to try to do great work. But that's what's going on subconsciously; they shy away from the question. So I'm going to pull a sneaky trick on you. Do you want to do great work, or not? Now you have to decide consciously. Sorry about that. I wouldn't have done it to a general audience. But we already know you're interested. Don't worry about being presumptuous. You don't have to tell anyone. And if it's too hard and you fail, so what? Lots of people have",5,4,4
Why are universities good for generating startup ideas?,"Universities are filled with new technologies, because they're trying to produce research, and only things that are new count as research. And they're full of exactly the right kind of people to have ideas with: the other students, who will be not only smart but elastic-minded to a fault.","Universities have both, and that's why so many startups grow out of them. They're filled with new technologies, because they're trying to produce research, and only things that are new count as research. And they're full of exactly the right kind of people to have ideas with: the other students, who will be not only smart but elastic-minded to a fault.","be closer to the truth to say the main value of your initial idea is that, in the process of discovering it's broken, you'll come up with your real idea. The initial idea is just a starting point-- not a blueprint, but a question. It might help if they were expressed that way. Instead of saying that your idea is to make a collaborative, web-based spreadsheet, say: could one make a collaborative, web-based spreadsheet? A few grammatical tweaks, and a woefully incomplete idea becomes a promising question to explore. There's a real difference, because an assertion provokes objections in a way a question doesn't. If you say: I'm going to build a web-based spreadsheet, then critics-- the most dangerous of which are in your own head-- will immediately reply that you'd be competing with Microsoft, that you couldn't give people the kind of UI they expect, that users wouldn't want to have their data on your servers, and so on. A question doesn't seem so challenging. It becomes: let's try making a web-based spreadsheet and see how far we get. And everyone knows that if you tried this you'd be able to make something useful. Maybe what you'd end up with wouldn't even be a spreadsheet. Maybe it would be some kind of new spreasheet-like collaboration tool that doesn't even have a name yet. You wouldn't have thought of something like that except by implementing your way toward it. Treating a startup idea as a question changes what you're looking for. If an idea is a blueprint, it has to be right. But if it's a question, it can be wrong, so long as it's wrong in a way that leads to more ideas. One valuable way for an idea to be wrong is to be only a partial solution. When someone's working on a problem that seems too big, I always ask: is there some way to bite off some subset of the problem, then gradually expand from there? That will generally work unless you get trapped on a local maximum, like 1980s-style AI, or C. Upwind So far, we've reduced the problem from thinking of a million dollar idea to thinking of a mistaken question. That doesn't seem so hard, does it? To generate such questions you need two things: to be familiar with promising new technologies, and to have the right kind of friends. New technologies are the ingredients startup ideas are made of, and conversations with friends are the kitchen they're cooked in. Universities have both, and that's why so many startups grow out of them. They're filled with new technologies, because they're trying to produce research, and only things that are new count as research. And they're full of exactly the right kind of people to have ideas with: the other students, who will be not only smart but elastic-minded to a fault. The opposite extreme would be a well-paying but boring job at a big company. Big companies are biased against new technologies, and",5,5,5
What did Microsoft start selling that positioned them to expand in microcomputer software?,Basic interpreters.,Microsoft for example was not going to grow huge selling Basic interpreters.,"changed, and no one else has noticed yet. Microsoft for example was not going to grow huge selling Basic interpreters. But by starting there they were perfectly poised to expand up the stack of microcomputer software as microcomputers grew powerful enough to support one. And microcomputers turned out to be a really huge wave, bigger than even the most optimistic observers would have predicted in 1975. But while Microsoft did really well and there is thus a temptation to think they would have seemed a great bet a few months in, they probably didn't. Good, but not great. No company, however successful, ever looks more than a pretty good bet a few months in. Microcomputers turned out to be a big deal, and Microsoft both executed well and got lucky. But it was by no means obvious that this was how things would play out. Plenty of companies seem as good a bet a few months in. I don't know about startups in general, but at least half the startups we fund could make as good a case as Microsoft could have for being on a path to dominating a large market. And who can reasonably expect more of a startup than that? Rejection If you can make as good a case as Microsoft could have, will you convince investors? Not always. A lot of VCs would have rejected Microsoft. Certainly some rejected Google. And getting rejected will put you in a slightly awkward position, because as you'll see when you start fundraising, the most common question you'll get from investors will be """"who else is investing?"""" What do you say if you've been fundraising for a while and no one has committed yet? The people who are really good at acting formidable often solve this problem by giving investors the impression that while no investors have committed yet, several are about to. This is arguably a permissible tactic. It's slightly dickish of investors to care more about who else is investing than any other aspect of your startup, and misleading them about how far along you are with other investors seems the complementary countermove. It's arguably an instance of scamming a scammer. But I don't recommend this approach to most founders, because most founders wouldn't be able to carry it off. This is the single most common lie told to investors, and you have to be really good at lying to tell members of some profession the most common lie they're told. If you're not a master of negotiation (and perhaps even if you are) the best solution is to tackle the problem head-on, and to explain why investors have turned you down and why they're mistaken. If you know you're on the right track, then you also know why investors were wrong to reject you. Experienced investors are well aware that the best ideas are also the scariest. They all know about the VCs who rejected Google. If instead of seeming evasive and ashamed about having been turned",4,4,5
Why do people at startups work harder than those at big companies?,"People at a startup expect to get rich if the product succeeds, and get nothing if it fails.","People at a startup expect to get rich if the product succeeds, and get nothing if it fails.","build one of each thing. When you only have one Web browser, you can't do anything really risky with it. If ten different startups design ten different Web browsers and you take the best, you'll probably get something better. The more general version of this problem is that there are too many new ideas for companies to explore them all. There might be 500 startups right now who think they're making something Microsoft might buy. Even Microsoft probably couldn't manage 500 development projects in-house. Big companies also don't pay people the right way. People developing a new product at a big company get paid roughly the same whether it succeeds or fails. People at a startup expect to get rich if the product succeeds, and get nothing if it fails. So naturally the people at the startup work a lot harder. The mere bigness of big companies is an obstacle. In startups, developers are often forced to talk directly to users, whether they want to or not, because there is no one else to do sales and support. It's painful doing sales, but you learn much more from trying to sell people something than reading what they said in focus groups. And then of course, big companies are bad at product development because they're bad at everything. Everything happens slower in big companies than small ones, and product development is something that has to happen fast, because you have to go through a lot of iterations to get something good. Trend I think the trend of big companies buying startups will only accelerate. One of the biggest remaining obstacles is pride. Most companies, at least unconsciously, feel they ought to be able to develop stuff in house, and that buying startups is to some degree an admission of failure. And so, as people generally do with admissions of failure, they put it off for as long as possible. That makes the acquisition very expensive when it finally happens. What companies should do is go out and discover startups when they're young, before VCs have puffed them up into something that costs hundreds of millions to acquire. Much of what VCs add, the acquirer doesn't need anyway. Why don't acquirers try to predict the companies they're going to have to buy for hundreds of millions, and grab them early for a tenth or a twentieth of that? Because they can't predict the winners in advance? If they're only paying a twentieth as much, they only have to predict a twentieth as well. Surely they can manage that. I think companies that acquire technology will gradually learn to go after earlier stage startups. They won't necessarily buy them outright. The solution may be some hybrid of investment and acquisition: for example, to buy a chunk of the company and get an option to buy the rest later. When companies buy startups, they're effectively fusing recruiting and product development. And I think that's more efficient than doing the two separately, because you always",5,4,4
What are the two routes to doing work you love?,The organic route and the two-job route.,"There are two routes to that destination: The organic route: as you become more eminent, gradually to increase the parts of your job that you like at the expense of those you don't. The two-job route: to work at things you don't like to get money to work on things you do.","and prestige. If there's something people still won't do, it seems as if society just has to make do without. That's what happened with domestic servants. For millennia that was the canonical example of a job someone had to do. And yet in the mid twentieth century servants practically disappeared in rich countries, and the rich have just had to do without. So while there may be some things someone has to do, there's a good chance anyone saying that about any particular job is mistaken. Most unpleasant jobs would either get automated or go undone if no one were willing to do them. Two Routes: There's another sense of not everyone can do work they love that's all too true, however. One has to make a living, and it's hard to get paid for doing work you love. There are two routes to that destination: The organic route: as you become more eminent, gradually to increase the parts of your job that you like at the expense of those you don't. The two-job route: to work at things you don't like to get money to work on things you do. The organic route is more common. It happens naturally to anyone who does good work. A young architect has to take whatever work he can get, but if he does well he'll gradually be in a position to pick and choose among projects. The disadvantage of this route is that it's slow and uncertain. Even tenure is not real freedom. The two-job route has several variants depending on how long you work for money at a time. At one extreme is the """"day job,"""" where you work regular hours at one job to make money, and work on what you love in your spare time. At the other extreme you work at something till you make enough not to have to work for money again. The two-job route is less common than the organic route, because it requires a deliberate choice. It's also more dangerous. Life tends to get more expensive as you get older, so it's easy to get sucked into working longer than you expected at the money job. Worse still, anything you work on changes you. If you work too long on tedious stuff, it will rot your brain. And the best paying jobs are most dangerous, because they require your full attention. The advantage of the two-job route is that it lets you jump over obstacles. The landscape of possible jobs isn't flat; there are walls of varying heights between different kinds of work. The trick of maximizing the parts of your job that you like can get you from architecture to product design, but not, probably, to music. If you make money doing one thing and then work on another, you have more freedom of choice. Which route should you take? That depends on how sure you are of what you want to do, how good you are at taking orders, how much risk",5,4,4
What happens to companies as they grow larger?,"Companies will inevitably slow down as they grow larger, no matter how hard they try to keep their startup mojo.","One is that companies will inevitably slow down as they grow larger, no matter how hard they try to keep their startup mojo.","let him. Between the drag of legacy code, the overhead of doing development in such a large organization, and the restrictions imposed by interfaces owned by other groups, he could only try a fraction of the things he would have liked to. He said he has learned much more in his own startup, despite the fact that he has to do all the company's errands as well as programming, because at least when he's programming he can do whatever he wants. An obstacle downstream propagates upstream. If you're not allowed to implement new ideas, you stop having them. And vice versa: when you can do whatever you want, you have more ideas about what to do. So working for yourself makes your brain more powerful in the same way a low-restriction exhaust system makes an engine more powerful. Working for yourself doesn't have to mean starting a startup, of course. But a programmer deciding between a regular job at a big company and their own startup is probably going to learn more doing the startup. You can adjust the amount of freedom you get by scaling the size of company you work for. If you start the company, you'll have the most freedom. If you become one of the first 10 employees you'll have almost as much freedom as the founders. Even a company with 100 people will feel different from one with 1000. Working for a small company doesn't ensure freedom. The tree structure of large organizations sets an upper bound on freedom, not a lower bound. The head of a small company may still choose to be a tyrant. The point is that a large organization is compelled by its structure to be one. Consequences: That has real consequences for both organizations and individuals. One is that companies will inevitably slow down as they grow larger, no matter how hard they try to keep their startup mojo. It's a consequence of the tree structure that every large organization is forced to adopt. Or rather, a large organization could only avoid slowing down if they avoided tree structure. And since human nature limits the size of group that can work together, the only way I can imagine for larger groups to avoid tree structure would be to have no structure: to have each group actually be independent, and to work together the way components of a market economy do. That might be worth exploring. I suspect there are already some highly partitionable businesses that lean this way. But I don't know any technology companies that have done it. There is one thing companies can do short of structuring themselves as sponges: they can stay small. If I'm right, then it really pays to keep a company as small as it can be at every stage. Particularly a technology company. Which means it's doubly important to hire the best people. Mediocre hires hurt you twice: they get less done, but they also make you big, because you need more of",5,4,5
Why is it not advisable to start a startup in college?,"Starting a startup takes over your life, and if you start a startup for real you're not a student anymore.",Do not start a startup in college.,"until you actually start the company. So starting a startup is intrinsically something you can only really learn by doing it. And it's impossible to do that in college, for the reason I just explained: startups take over your life. You can't start a startup for real as a student, because if you start a startup for real you're not a student anymore. You may be nominally a student for a bit, but you won't even be that for long. Given this dichotomy, which of the two paths should you take? Be a real student and not start a startup, or start a real startup and not be a student? I can answer that one for you. Do not start a startup in college. How to start a startup is just a subset of a bigger problem you're trying to solve: how to have a good life. And though starting a startup can be part of a good life for a lot of ambitious people, age 20 is not the optimal time to do it. Starting a startup is like a brutally fast depth-first search. Most people should still be searching breadth-first at 20. You can do things in your early 20s that you can't do as well before or after, like plunge deeply into projects on a whim and travel super cheaply with no sense of a deadline. For unambitious people, this sort of thing is the dreaded failure to launch, but for the ambitious ones it can be an incomparably valuable sort of exploration. If you start a startup at 20 and you're sufficiently successful, you'll never get to do it. Mark Zuckerberg will never get to bum around a foreign country. He can do other things most people can't, like charter jets to fly him to foreign countries. But success has taken a lot of the serendipity out of his life. Facebook is running him as much as he's running Facebook. And while it can be very cool to be in the grip of a project you consider your life's work, there are advantages to serendipity too, especially early in life. Among other things it gives you more options to choose your life's work from. There's not even a tradeoff here. You're not sacrificing anything if you forgo starting a startup at 20, because you're more likely to succeed if you wait. In the unlikely case that you're 20 and one of your side projects takes off like Facebook did, you'll face a choice of running with it or not, and it may be reasonable to run with it. But the usual way startups take off is for the founders to make them take off, and it's gratuitously stupid to do that at 20. Try Should you do it at any age? I realize I've made startups sound pretty hard. If I haven't, let me try again: starting a startup is really hard. What if it's too hard? How can you tell if you're up to this",5,4,4
What is one thing Sequoia looks for in startups?,The proxy for demand.,Greg Mcadoo said one thing Sequoia looks for is the proxy for demand.,"users have and how you solve them. Greg Mcadoo said one thing Sequoia looks for is the proxy for demand. What are people doing now, using inadequate tools, that shows they need what you're making? Another sign of user need is when people pay a lot for something. It's easy to convince investors there will be demand for a cheaper alternative to something popular, if you preserve the qualities that made it popular. The best stories about user needs are about your own. A remarkable number of famous startups grew out of some need the founders had: Apple, Microsoft, Yahoo, Google. Experienced investors know that, so stories of this type will get their attention. The next best thing is to talk about the needs of people you know personally, like your friends or siblings. 14. Make a soundbite stick in their heads. Professional investors hear a lot of pitches. After a while they all blur together. The first cut is simply to be one of those they remember. And the way to ensure that is to create a descriptive phrase about yourself that sticks in their heads. In Hollywood, these phrases seem to be of the form x meets y. In the startup world, they're usually the x of y or the x y. Viaweb's was the Microsoft Word of ecommerce. Find one and launch it clearly (but apparently casually) in your talk, preferably near the beginning. It's a good exercise for you, too, to sit down and try to figure out how to describe your startup in one compelling phrase. If you can't, your plans may not be sufficiently focused."",How to Present to Investors When I was in high school I spent a lot of time imitating bad writers. What we studied in English classes was mostly fiction, so I assumed that was the highest form of writing. Mistake number one. The stories that seemed to be most admired were ones in which people suffered in complicated ways. Anything funny or gripping was ipso facto suspect, unless it was old enough to be hard to understand, like Shakespeare or Chaucer. Mistake number two. The ideal medium seemed the short story, which I've since learned had quite a brief life, roughly coincident with the peak of magazine publishing. But since their size made them perfect for use in high school classes, we read a lot of them, which gave us the impression the short story was flourishing. Mistake number three. And because they were so short, nothing really had to happen; you could just show a randomly truncated slice of life, and that was considered advanced. Mistake number four. The result was that I wrote a lot of stories in which nothing happened except that someone was unhappy in a way that seemed deep. For most of college I was a philosophy major. I was very impressed by the papers published in philosophy journals. They were so beautifully typeset, and their tone was just captivatingâ€”alternately casual and buffer-overflowingly technical. A",5,4,4
What is Perl originally designed for?,Perl was originally designed for writing throwaway programs.,"Perl is a striking example of this idea. It was not only designed for writing throwaway programs, but was pretty much a throwaway program itself.","The surprising thing about throwaway programs is that, like the """"temporary"""" buildings built at so many American universities during World War II, they often don't get thrown away. Many evolve into real programs, with real features and real users. I have a hunch that the best big programs begin life this way, rather than being designed big from the start, like the Hoover Dam. It's terrifying to build something big from scratch. When people take on a project that's too big, they become overwhelmed. The project either gets bogged down, or the result is sterile and wooden: a shopping mall rather than a real downtown, Brasilia rather than Rome, Ada rather than C. Another way to get a big program is to start with a throwaway program and keep improving it. This approach is less daunting, and the design of the program benefits from evolution. I think, if one looked, that this would turn out to be the way most big programs were developed. And those that did evolve this way are probably still written in whatever language they were first written in, because it's rare for a program to be ported, except for political reasons. And so, paradoxically, if you want to make a language that is used for big systems, you have to make it good for writing throwaway programs, because that's where big systems come from. Perl is a striking example of this idea. It was not only designed for writing throwaway programs, but was pretty much a throwaway program itself. Perl began life as a collection of utilities for generating reports, and only evolved into a programming language as the throwaway programs people wrote in it grew larger. It was not until Perl 5 (if then) that the language was suitable for writing serious programs, and yet it was already massively popular. What makes a language good for throwaway programs? To start with, it must be readily available. A throwaway program is something that you expect to write in an hour. So the language probably must already be installed on the computer you're using. It can't be something you have to install before you use it. It has to be there. C was there because it came with the operating system. Perl was there because it was originally a tool for system administrators, and yours had already installed it. Being available means more than being installed, though. An interactive language, with a command-line interface, is more available than one that you have to compile and run separately. A popular programming language should be interactive, and start up fast. Another thing you want in a throwaway program is brevity. Brevity is always attractive to hackers, and never more so than in a program they expect to turn out in an hour. Libraries: of course the ultimate in brevity is to have the program already written for you, and merely to call it. And this brings us to what I think will be an increasingly important feature of",5,4,5
What is a key characteristic of successful startup founders?,They are a little too obsessed with making the product good.,"One thing I've noticed is, all, all, like seriously there are no exceptions to this, all the most successful startups that we've funded, and also that I've seen that we haven't funded, all of the founders are a little too obsessed with making the product good.","do you do that? Like how does Apple for example get so much demand for its products? They build really good products! So really honestly, it's better not to think too much about growth per se.One thing I\'ve noticed is, all, all, like seriously there are no exceptions to this, all the most successful startups that we've funded, and also that I've seen that we haven't funded, all of the founders are a little too obsessed with making the product good. And Apple is an example. Apple, they do stuff that you don't even care about, that you don't even know about, just because they're fanatics and Airbnb I'm sure too has a ton of stuff behind the scenes. Like I noticed, have you guys noticed they have two different shape lights in here? Look at this, there's some that come down like tulips and some that spread out. Why? Well it's not by accident right? Someone cares a little too much, right? You look at this whole building, this is what happens when you have a startup where two out of three of the founders are designers. I mean this whole place radiates 'cares too much, you know? But that's good', Usually startups care too much about their product, like you know Dropbox cares too much and you can tell that because have you ever noticed like you never hear anybody losing data anymore, right? Because Dropbox is so damn reliable. You never hear 'Oh my computer crashed'. You used to hear this like 5 years ago. You would hear Oh my computer crashed. No I wasn't backing it up. Oh I lost everything.Right? Nobody ever loses anything anymore because everybody uses Dropbox and Dropbox is just so reliable.This is like a startup turned inside out, that's what this building is. Most of you guys are not from Airbnb, right? Look at it on your way out, and just look at the details because any detail your look for, there will be something to see I guarantee you. And so this is like a startup turned inside out and made visible. But every really successful startup, the product is like this. You know? Your building is just like part of the product somehow.if you ever find yourself in the very early stage funding business. The problem is, the very best ideas always seem crazy. And so if you judge people by their ideas, you will snip off the outliers which is where all the big successes are. And so there's a trick you can use which is, judge by the people instead. And the earlier your are in investing, the more it is the founders"""", """"So if you think to yourself, if you're thinking one day of starting a startup, the way to start a startup is by not trying to start a startup. It's just, you build stuff, you just build stuff, just do stuff, make stuff. And the very best ideas will be things that are so",5,4,5
What are the three things needed to start a successful startup?,"You need to be good at some kind of technology, you need an idea for what you're going to build, and you need cofounders to start the company with.","You need three things. You need to be good at some kind of technology, you need an idea for what you're going to build, and you need cofounders to start the company with.","will turn into a company worth billions or one that goes out of business. So when I say I'm going to tell you how to start Google, I mean I'm going to tell you how to get to the point where you can start a company that has as much chance of being Google as Google had of being Google. How do you get from where you are now to the point where you can start a successful startup? You need three things. You need to be good at some kind of technology, you need an idea for what you're going to build, and you need cofounders to start the company with. How do you get good at technology? And how do you choose which technology to get good at? Both of those questions turn out to have the same answer: work on your own projects. Don't try to guess whether gene editing or LLMs or rockets will turn out to be the most valuable technology to know about. No one can predict that. Just work on whatever interests you the most. You'll work much harder on something you're interested in than something you're doing because you think you're supposed to. If you're not sure what technology to get good at, get good at programming. That has been the source of the median startup for the last 30 years, and this is probably not going to change in the next 10. Those of you who are taking computer science classes in school may at this point be thinking, ok, we've got this sorted. We're already being taught all about programming. But sorry, this is not enough. You have to be working on your own projects, not just learning stuff in classes. You can do well in computer science classes without ever really learning to program. In fact you can graduate with a degree in computer science from a top university and still not be any good at programming. That's why tech companies all make you take a coding test before they'll hire you, regardless of where you went to university or how well you did there. They know grades and exam results prove nothing. If you really want to learn to program, you have to work on your own projects. You learn so much faster that way. Imagine you're writing a game and there's something you want to do in it, and you don't know how. You're going to figure out how a lot faster than you'd learn anything in a class. You don't have to learn programming, though. If you're wondering what counts as technology, it includes practically everything you could describe using the words """"make"""" or """"build."""" So welding would count, or making clothes, or making videos. Whatever you're most interested in. The critical distinction is whether you're producing or just consuming. Are you writing computer games, or just playing them? That's the cutoff. Steve Jobs, the founder of Apple, spent time when he was a teenager studying",5,4,5
What do most VCs prefer to fund?,Technical guys.,Now most VCs know they should be funding technical guys.,"willing to fund teams of MBAs who planned to use the money to pay programmers to build their product for them. This is like funding Steve Ballmer in the hope that the programmer he'll hire is Bill Gates kind of backward, as the events of the Bubble showed. Now most VCs know they should be funding technical guys. This is more pronounced among the very top funds; the lamer ones still want to fund MBAs. If you're a hacker, it's good news that investors are looking for Larry and Sergey. The bad news is, the only investors who can do it right are the ones who knew them when they were a couple of CS grad students, not the confident media stars they are today. What investors still don't get is how clueless and tentative great founders can seem at the very beginning. 10. The contribution of investors tends to be underestimated. Investors do more for startups than give them money. They're helpful in doing deals and arranging introductions, and some of the smarter ones, particularly angels, can give good advice about the product. In fact, I'd say what separates the great investors from the mediocre ones is the quality of their advice. Most investors give advice, but the top ones give good advice. Whatever help investors give a startup tends to be underestimated. It's to everyone's advantage to let the world think the founders thought of everything. The goal of the investors is for the company to become valuable, and the company seems more valuable if it seems like all the good ideas came from within. This trend is compounded by the obsession that the press has with founders. In a company founded by two people, 10% of the ideas might come from the first guy they hire. Arguably they've done a bad job of hiring otherwise. And yet this guy will be almost entirely overlooked by the press. I say this as a founder: the contribution of founders is always overestimated. The danger here is that new founders, looking at existing founders, will think that they're supermen that one couldn't possibly equal oneself. Actually they have a hundred different types of support people just offscreen making the whole show possible. 11. VCs are afraid of looking bad. I've been very surprised to discover how timid most VCs are. They seem to be afraid of looking bad to their partners, and perhaps also to the limited partnersâ€”the people whose money they invest. You can measure this fear in how much less risk VCs are willing to take. You can tell they won't make investments for their fund that they might be willing to make themselves as angels. Though it's not quite accurate to say that VCs are less willing to take risks. They're less willing to do things that might look bad. That's not the same thing. For example, most VCs would be very reluctant to invest in a startup founded by a pair of 18 year old hackers,",5,4,4
What is the main benefit of using a management company for running a business?,It offers the maximum of freedom and security.,"If such management companies existed, they'd offer the maximum of freedom and security.","But this group must be small. The way you succeed in most businesses is to be fanatically attentive to customers' needs. What are the odds that your own desires would coincide exactly with the demands of this powerful, external force? Sure, running your own company can be fairly interesting. Viaweb was more interesting than any job I'd had before. And since I made much more money from it, it offered the highest ratio of income to boringness of anything I'd done, by orders of magnitude. But was it the most interesting work I could imagine doing? No. Whether the number of founders in the same position is asymptotic or merely large, there are certainly a lot of them. For them the right approach would be to hand the company over to a professional manager eventually, if they could find one who was good enough. So far so good. But what if your manager was hit by a bus? What you really want is a management company to run your company for you. Then you don't depend on any one person. If you own rental property, there are companies you can hire to manage it for you. Some will do everything, from finding tenants to fixing leaks. Of course, running companies is a lot more complicated than managing rental property, but let's suppose there were management companies that could do it for you. They'd charge a lot, but wouldn't it be worth it? I'd sacrifice a large percentage of the income for the extra peace of mind. I realize what I'm describing already sounds too good to be true, but I can think of a way to make it even more attractive. If company management companies existed, there would be an additional service they could offer clients: they could let them insure their returns by pooling their risk. After all, even a perfect manager can't save a company when, as sometimes happens, its whole market dies, just as property managers can't save you from the building burning down. But a company that managed a large enough number of companies could say to all its clients: we'll combine the revenues from all your companies, and pay you your proportionate share. If such management companies existed, they'd offer the maximum of freedom and security. Someone would run your company for you, and you'd be protected even if it happened to die. Let's think about how such a management company might be organized. The simplest way would be to have a new kind of stock representing the total pool of companies they were managing. When you signed up, you'd trade your company's stock for shares of this pool, in proportion to an estimate of your company's value that you'd both agreed upon. Then you'd automatically get your share of the returns of the whole pool. The catch is that because this kind of trade would be hard to undo, you couldn't switch management companies. But there's a way they could fix that: suppose all",5,4,5
Who is known for investing in top startups in Silicon Valley?,Ron Conway,"No one, VC or angel, has invested in more of the top startups than Ron Conway.","a lame-sounding new startup idea is to make fun of it. Even a lot of people who should know better. When I encounter a startup with a lame-sounding idea, I ask What Microsoft is this the Altair Basic of? Now it's a puzzle, and the burden is on me to solve it. Sometimes I can't think of an answer, especially when the idea is a made-up one. But it's remarkable how often there does turn out to be an answer. Often it's one the founders themselves hadn't seen yet. Intriguingly, there are sometimes multiple answers. I talked to a startup a few days ago that could grow into 3 distinct Microsofts. They'd probably vary in size by orders of magnitude. But you can never predict how big a Microsoft is going to be, so in cases like that I encourage founders to follow whichever path is most immediately exciting to them. Their instincts got them this far. Why stop now?,What Microsoft Is this the Altair Basic of? January 2015 No one, VC or angel, has invested in more of the top startups than Ron Conway. He knows what happened in every deal in the Valley, half the time because he arranged it. And yet he's a super nice guy. In fact, nice is not the word. Ronco is good. I know of zero instances in which he has behaved badly. It's hard even to imagine. When I first came to Silicon Valley I thought """"How lucky that someone so powerful is so benevolent. But gradually I realized it wasn't luck. It was by being benevolent that Ronco became so powerful. All the deals he gets to invest in come to him through referrals. Google did. Facebook did. Twitter was a referral from Evan Williams himself. And the reason so many people refer deals to him is that he's proven himself to be a good guy. Good does not mean being a pushover. I would not want to face an angry Ronco. But if Ron's angry at you, it's because you did something wrong. Ron is so old school he's Old Testament. He will smite you in his just wrath, but there's no malice in it. In almost every domain there are advantages to seeming good. It makes people trust you. But actually being good is an expensive way to seem good. To an amoral person it might seem to be overkill. In some fields it might be, but apparently not in the startup world. Though plenty of investors are jerks, there is a clear trend among them: the most successful investors are also the most upstanding. It was not always this way. I would not feel confident saying that about investors twenty years ago. What changed? The startup world became more transparent and more unpredictable. Both make it harder to seem good without actually being good. It's obvious why transparency has that effect. When an investor maltreats a founder now, it gets out. Maybe not all the way to the",5,4,4
What is a common source of ideas for startups?,"Specific, unsolved problems identified by the founders.","Usually from some specific, unsolved problem the founders identified.","ball came my way, I used to close my eyes and hold my glove up more for protection than in the hope of catching it. Choosing a marginal project is the startup equivalent of my eight year old strategy for dealing with fly balls. If you make anything good, you're going to have competitors, so you may as well face that. You can only avoid competition by avoiding good ideas. I think this shrinking from big problems is mostly unconscious. It's not that people think of grand ideas but decide to pursue smaller ones because they seem safer. Your unconscious won't even let you think of grand ideas. So the solution may be to think about ideas without involving yourself. What would be a great idea for someone else to do as a startup? 4. Derivative Idea Many of the applications we get are imitations of some existing company. That's one source of ideas, but not the best. If you look at the origins of successful startups, few were started in imitation of some other startup. Where did they get their ideas? Usually from some specific, unsolved problem the founders identified. Our startup made software for making online stores. When we started it, there wasn't any; the few sites you could order from were hand-made at great expense by web consultants. We knew that if online shopping ever took off, these sites would have to be generated by software, so we wrote some. Pretty straightforward. It seems like the best problems to solve are ones that affect you personally. Apple happened because Steve Wozniak wanted a computer, Google because Larry and Sergey couldn't find stuff online, Hotmail because Sabeer Bhatia and Jack Smith couldn't exchange email at work. So instead of copying the Facebook, with some variation that the Facebook rightly ignored, look for ideas from the other direction. Instead of starting from companies and working back to the problems they solved, look for problems and imagine the company that might solve them. What do people complain about? What do you wish there was? 5. Obstinacy In some fields the way to succeed is to have a vision of what you want to achieve, and to hold true to it no matter what setbacks you encounter. Starting startups is not one of them. The stick-to-your-vision approach works for something like winning an Olympic gold medal, where the problem is well-defined. Startups are more like science, where you need to follow the trail wherever it leads. So don't get too attached to your original plan, because it's probably wrong. Most successful startups end up doing something different than they originally intended often so different that it doesn't even seem like the same company. You have to be prepared to see the better idea when it arrives. And the hardest part of that is often discarding your old idea. But openness to new ideas has to be tuned just right. Switching to a new idea every week will be equally fatal. Is",5,4,5
What is the best type of introduction to investors?,The best type of intro is from a well-known investor who has just invested in you.,The best type of intro is from a well-known investor who has just invested in you.,"their sites are organized that they don't really want startups to approach them directly. Intros vary greatly in effectiveness. The best type of intro is from a well-known investor who has just invested in you. So when you get an investor to commit, ask them to introduce you to other investors they respect. The next best type of intro is from a founder of a company they've funded. You can also get intros from other people in the startup community, like lawyers and reporters. There are now sites like AngelList, FundersClub, and WeFunder that can introduce you to investors. We recommend startups treat them as auxiliary sources of money. Raise money first from leads you get yourself. Those will on average be better investors. Plus you'll have an easier time raising money on these sites once you can say you've already raised some from well-known investors. Hear no till you hear yes. Treat investors as saying no till they unequivocally say yes, in the form of a definite offer with no contingencies. I mentioned earlier that investors prefer to wait if they can. What's particularly dangerous for founders is the way they wait. Essentially, they lead you on. They seem like they're about to invest right up till the moment they say no. If they even say no. Some of the worse ones never actually do say no; they just stop replying to your emails. They hope that way to get a free option on investing. If they decide later that they want to invest usually because they've heard you're a hot deal â€” they can pretend they just got distracted and then restart the conversation as if they'd been about to. That's not the worst thing investors will do. Some will use language that makes it sound as if they're committing, but which doesn't actually commit them. And wishful thinking founders are happy to meet them half way. Fortunately, the next rule is a tactic for neutralizing this behavior. But to work it depends on you not being tricked by the no that sounds like yes. It's so common for founders to be misled/mistaken about this that we designed a protocol to fix the problem. If you believe an investor has committed, get them to confirm it. If you and they have different views of reality, whether the source of the discrepancy is their sketchiness or your wishful thinking, the prospect of confirming a commitment in writing will flush it out. And till they confirm, regard them as saying no. Do breadth-first search weighted by expected value. When you talk to investors your m.o. should be breadth-first search, weighted by expected value. You should always talk to investors in parallel rather than serially. You can't afford the time it takes to talk to investors serially, plus if you only talk to one investor at a time, they don't have the pressure of other investors to make them act. But you shouldn't pay the same attention to every investor, because",5,4,4
What is the biggest surprise for many founders regarding the emotional aspect of startups?,The emotional ups and downs were the biggest surprise for me.,The emotional ups and downs were the biggest surprise for me.,"perspective on time shifts. Working on our startup, I remember time seeming to stretch out, so that a month was a huge interval. In the best case, total immersion can be exciting: It's surprising how much you become consumed by your startup, in that you think about it day and night, but never once does it feel like work. Though I have to say, that quote is from someone we funded this summer. In a couple years he may not sound so chipper. 3. It's an Emotional Roller-coaster This was another one lots of people were surprised about. The ups and downs were more extreme than they were prepared for. In a startup, things seem great one moment and hopeless the next. And by next, I mean a couple hours later. The emotional ups and downs were the biggest surprise for me. One day, we'd think of ourselves as the next Google and dream of buying islands; the next, we'd be pondering how to let our loved ones know of our utter failure; and on and on. The hard part, obviously, is the lows. For a lot of founders that was the big surprise: How hard it is to keep everyone motivated during rough days or weeks, i.e. how low the lows can be. After a while, if you don't have significant success to cheer you up, it wears you out: Your most basic advice to founders is just don't die, but the energy to keep a company going in lieu of unburdening success isn't free; it is siphoned from the founders themselves. There's a limit to how much you can take. If you get to the point where you can't keep working anymore, it's not the end of the world. Plenty of famous founders have had some failures along the way. 4. It Can Be Fun The good news is, the highs are also very high. Several founders said what surprised them most about doing a startup was how fun it was: I think you've left out just how fun it is to do a startup. I am more fulfilled in my work than pretty much any of my friends who did not start companies. What they like most is the freedom: I'm surprised by how much better it feels to be working on something that is challenging and creative, something I believe in, as opposed to the hired-gun stuff I was doing before. I knew it would feel better; what's surprising is how much better. Frankly, though, if I've misled people here, I'm not eager to fix that. I'd rather have everyone think starting a startup is grim and hard than have founders go into it expecting it to be fun, and a few months later saying This is not supposed to be fun. The truth is, it wouldn't be fun for most people. A lot of what we try to do in the application process is to weed out the people who wouldn't like it, both for",5,4,4
What is a key advantage of Web-based applications regarding data safety?,Users' data will be safer because companies offering Web-based applications will actually do backups.,"When you use a Web-based application, your data will be safer.","expected users to want to, but it turned out that many did. When you use a Web-based application, your data will be safer. Disk crashes won't be a thing of the past, but users won't hear about them anymore. They'll happen within server farms. And companies offering Web-based applications will actually do backups-- not only because they'll have real system administrators worrying about such things, but because an ASP that does lose people's data will be in big, big trouble. When people lose their own data in a disk crash, they can't get that mad, because they only have themselves to be mad at. When a company loses their data for them, they'll get a lot madder. Finally, Web-based software should be less vulnerable to viruses. If the client doesn't run anything except a browser, there's less chance of running viruses, and no data locally to damage. And a program that attacked the servers themselves should find them very well defended. For users, Web-based software will be less stressful. I think if you looked inside the average Windows user you'd find a huge and pretty much untapped desire for software meeting that description. Unleashed, it could be a powerful force. City of Code To developers, the most conspicuous difference between Web-based and desktop software is that a Web-based application is not a single piece of code. It will be a collection of programs of different types rather than a single big binary. And so designing Web-based software is like desiging a city rather than a building: as well as buildings you need roads, street signs, utilities, police and fire departments, and plans for both growth and various kinds of disasters. At Viaweb, software included fairly big applications that users talked to directly, programs that those programs used, programs that ran constantly in the background looking for problems, programs that tried to restart things if they broke, programs that ran occasionally to compile statistics or build indexes for searches, programs we ran explicitly to garbage-collect resources or to move or restore data, programs that pretended to be users (to measure performance or expose bugs), programs for diagnosing network troubles, programs for doing backups, interfaces to outside services, software that drove an impressive collection of dials displaying real-time server statistics (a hit with visitors, but indispensable for us too), modifications (including bug fixes) to open-source software, and a great many configuration files and settings. Trevor Blackwell wrote a spectacular program for moving stores to new servers across the country, without shutting them down, after we were bought by Yahoo. Programs paged us, sent faxes and email to users, conducted transactions with credit card processors, and talked to one another through sockets, pipes, http requests, ssh, udp packets, shared memory, and files. Some of Viaweb even consisted of the absence of programs, since one of the keys to Unix security is not to run unnecessary utilities that people might use to break into your servers. It did not end with software. We spent",5,4,4
What is the stated purpose of PowerPoint?,to present ideas,stated purpose of Powerpoint is to present ideas.,"stated purpose of Powerpoint is to present ideas. Its real role is to overcome people's fear of public speaking. It allows you to give an impressive-looking talk about nothing, and it causes the audience to sit in a dark room looking at slides, instead of a bright one looking at you. This kind of thing is out there for anyone to see. The key is to know to look for it-- to realize that having an idea for a startup is not like having an idea for a class project. The goal in a startup is not to write a cool piece of software. It's to make something people want. And to do that you have to look at users-- forget about hacking, and just look at users. This can be quite a mental adjustment, because little if any of the software you write in school even has users. A few steps before a Rubik's Cube is solved, it still looks like a mess. I think there are a lot of undergrads whose brains are in a similar position: they're only a few steps away from being able to start successful startups, if they wanted to, but they don't realize it. They have more than enough technical skill. They just haven't realized yet that the way to create wealth is to make what users want, and that employers are just proxies for users in which risk is pooled. If you're young and smart, you don't need either of those. You don't need someone else to tell you what users want, because you can figure it out yourself. And you don't want to pool risk, because the younger you are, the more risk you should take. A Public Service Message I'd like to conclude with a joint message from me and your parents. Don't drop out of college to start a startup. There's no rush. There will be plenty of time to start companies after you graduate. In fact, it may be just as well to go work for an existing company for a couple years after you graduate, to learn how companies work. And yet, when I think about it, I can't imagine telling Bill Gates at 19 that he should wait till he graduated to start a company. He'd have told me to get lost. And could I have honestly claimed that he was harming his future-- that he was learning less by working at ground zero of the microcomputer revolution than he would have if he'd been taking classes back at Harvard? No, probably not. And yes, while it is probably true that you'll learn some valuable things by going to work for an existing company for a couple years before starting your own, you'd learn a thing or two running your own company during that time too. The advice about going to work for someone else would get an even colder reception from the 19 year old Bill Gates. So I'm supposed to finish college, then go",5,4,5
What is one reason people are too harsh on early versions of ambitious projects?,They also do it to seem clever.,"Of course, inexperience is not the only reason people are too harsh on early versions of ambitious projects. They also do it to seem clever.","biggest things holding people back from doing great work is the fear of making something lame. And this fear is not an irrational one. Many great projects go through a stage early on where they don't seem very impressive, even to their creators. You have to push through this stage to reach the great work that lies beyond. But many people don't. Most people don't even reach the stage of making something they're embarrassed by, let alone continue past it. They're too frightened even to start. Imagine if we could turn off the fear of making something lame. Imagine how much more we'd do. Is there any hope of turning it off? I think so. I think the habits at work here are not very deeply rooted. Making new things is itself a new thing for us as a species. It has always happened, but till the last few centuries it happened so slowly as to be invisible to individual humans. And since we didn't need customs for dealing with new ideas, we didn't develop any. We just don't have enough experience with early versions of ambitious projects to know how to respond to them. We judge them as we would judge more finished work, or less ambitious projects. We don't realize they're a special case. Or at least, most of us don't. One reason I'm confident we can do better is that it's already starting to happen. There are already a few places that are living in the future in this respect. Silicon Valley is one of them: an unknown person working on a strange-sounding idea won't automatically be dismissed the way they would back home. In Silicon Valley, people have learned how dangerous that is. The right way to deal with new ideas is to treat them as a challenge to your imagination â€” not just to have lower standards, but to switch polarity entirely, from listing the reasons an idea won't work to trying to think of ways it could. That's what I do when I meet people with new ideas. I've become quite good at it, but I've had a lot of practice. Being a partner at Y Combinator means being practically immersed in strange-sounding ideas proposed by unknown people. Every six months you get thousands of new ones thrown at you and have to sort through them, knowing that in a world with a power-law distribution of outcomes, it will be painfully obvious if you miss the needle in this haystack. Optimism becomes urgent. But I'm hopeful that, with time, this kind of optimism can become widespread enough that it becomes a social custom, not just a trick used by a few specialists. It is after all an extremely lucrative trick, and those tend to spread quickly. Of course, inexperience is not the only reason people are too harsh on early versions of ambitious projects. They also do it to seem clever. And in a field where the new ideas are risky, like startups, those",5,4,4
Why do patents play a small role in software?,One reason is that software is so complicated that patents by themselves are not worth very much.,Why do patents play so small a role in software? I can think of three possible reasons. One is that software is so complicated that patents by themselves are not worth very much.,"software patents stifling innovation, but when one looks closely at the software business, the most striking thing is how little patents seem to matter. In other fields, companies regularly sue competitors for patent infringement. For example, the airport baggage scanning business was for many years a cozy duopoly shared between two companies, InVision and L-3. In 2002 a startup called Reveal appeared, with new technology that let them build scanners a third the size. They were sued for patent infringement before they'd even released a product. You rarely hear that kind of story in our world. The one example I've found is, embarrassingly enough, Yahoo, which filed a patent suit against a gaming startup called Xfire in 2005. Xfire doesn't seem to be a very big deal, and it's hard to say why Yahoo felt threatened. Xfire's VP of engineering had worked at Yahoo on similar stuff-- in fact, he was listed as an inventor on the patent Yahoo sued over-- so perhaps there was something personal about it. My guess is that someone at Yahoo goofed. At any rate they didn't pursue the suit very vigorously. Why do patents play so small a role in software? I can think of three possible reasons. One is that software is so complicated that patents by themselves are not worth very much. I may be maligning other fields here, but it seems that in most types of engineering you can hand the details of some new technique to a group of medium-high quality people and get the desired result. For example, if someone develops a new process for smelting ore that gets a better yield, and you assemble a team of qualified experts and tell them about it, they'll be able to get the same yield. This doesn't seem to work in software. Software is so subtle and unpredictable that qualified experts don't get you very far. That's why we rarely hear phrases like qualified expert in the software business. What that level of ability can get you is, say, to make your software compatible with some other piece of software-- in eight months, at enormous cost. To do anything harder you need individual brilliance. If you assemble a team of qualified experts and tell them to make a new web-based email program, they'll get their asses kicked by a team of inspired nineteen year olds. Experts can implement, but they can't design. Or rather, expertise in implementation is the only kind most people, including the experts themselves, can measure. But design is a definite skill. It's not just an airy intangible. Things always seem intangible when you don't understand them. Electricity seemed an airy intangible to most people in 1800. Who knew there was so much to know about it? So it is with design. Some people are good at it and some people are bad at it, and there's something very tangible they're good or bad at. The reason design counts so much in software is probably that there are",5,4,4
What has decreased the cost of starting a startup?,Technology has decreased the cost of starting a startup so much that founders now have the upper hand over investors.,Technology has decreased the cost of starting a startup so much that founders now have the upper hand over investors.,"an anomaly a unique combination of circumstances that compressed American society not just economically but culturally too. And while some of the growth in economic inequality we've seen since then has been due to bad behavior of various kinds, there has simultaneously been a huge increase in individuals' ability to create wealth. Startups are almost entirely a product of this period. And even within the startup world, there has been a qualitative change in the last 10 years. Technology has decreased the cost of starting a startup so much that founders now have the upper hand over investors. Founders get less diluted, and it is now common for them to retain board control as well. Both further increase economic inequality, the former because founders own more stock, and the latter because, as investors have learned, founders tend to be better at running their companies than investors. While the surface manifestations change, the underlying forces are very, very old. The acceleration of productivity we see in Silicon Valley has been happening for thousands of years. If you look at the history of stone tools, technology was already accelerating in the Mesolithic. The acceleration would have been too slow to perceive in one lifetime. Such is the nature of the leftmost part of an exponential curve. But it was the same curve. You do not want to design your society in a way that's incompatible with this curve. The evolution of technology is one of the most powerful forces in history. Louis Brandeis said We may have democracy, or we may have wealth concentrated in the hands of a few, but we can't have both. That sounds plausible. But if I have to choose between ignoring him and ignoring an exponential curve that has been operating for thousands of years, I'll bet on the curve. Ignoring any trend that has been operating for thousands of years is dangerous. But exponential growth, especially, tends to bite you. If accelerating variation in productivity is always going to produce some baseline growth in economic inequality, it would be a good idea to spend some time thinking about that future. Can you have a healthy society with great variation in wealth? What would it look like? Notice how novel it feels to think about that. The public conversation so far has been exclusively about the need to decrease economic inequality. We've barely given a thought to how to live with it. I'm hopeful we'll be able to. Brandeis was a product of the Gilded Age, and things have changed since then. It's harder to hide wrongdoing now. And to get rich now you don't have to buy politicians the way railroad or oil magnates did. The great concentrations of wealth I see around me in Silicon Valley don't seem to be destroying democracy. There are lots of things wrong with the US that have economic inequality as a symptom. We should fix those things. In the process we may decrease economic inequality. But we can't start",5,4,4
What should you do if someone misinterprets your writing?,You should explicitly forestall likely misinterpretations if they're misinterpretations a reasonably smart and well-intentioned person might make.,"Should you explicitly forestall likely misinterpretations? Yes, if they're misinterpretations a reasonably smart and well-intentioned person might make.","ask someone who does this to quote a specific sentence or passage you wrote that they believe is false, and explain why. I say """"for what it's worth"""" because they never do. So although it might seem that this could get a broken discussion back on track, the truth is that it was never on track in the first place. Should you explicitly forestall likely misinterpretations? Yes, if they're misinterpretations a reasonably smart and well-intentioned person might make. In fact it's sometimes better to say something slightly misleading and then add the correction than to try to get an idea right in one shot. That can be more efficient, and can also model the way such an idea would be discovered. But I don't think you should explicitly forestall intentional misinterpretations in the body of an essay. An essay is a place to meet honest readers. You don't want to spoil your house by putting bars on the windows to protect against dishonest ones. The place to protect against intentional misinterpretations is in end-notes. But don't think you can predict them all. People are as ingenious at misrepresenting you when you say something they don't want to hear as they are at coming up with rationalizations for things they want to do but know they shouldn't. I suspect it's the same skill. As with most other things, the way to get better at writing essays is to practice. But how do you start? Now that we've examined the structure of useful writing, we can rephrase that question more precisely. Which constraint do you relax initially? The answer is, the first component of importance: the number of people who care about what you write. If you narrow the topic sufficiently, you can probably find something you're an expert on. Write about that to start with. If you only have ten readers who care, that's fine. You're helping them, and you're writing. Later you can expand the breadth of topics you write about. The other constraint you can relax is a little surprising: publication. Writing essays doesn't have to mean publishing them. That may seem strange now that the trend is to publish every random thought, but it worked for me. I wrote what amounted to essays in notebooks for about 15 years. I never published any of them and never expected to. I wrote them as a way of figuring things out. But when the web came along I'd had a lot of practice. Incidentally, Steve Wozniak did the same thing. In high school he designed computers on paper for fun. He couldn't build them because he couldn't afford the components. But when Intel launched 4K DRAMs in 1975, he was ready. How many essays are there left to write though? The answer to that question is probably the most exciting thing I've learned about essay writing. Nearly all of them are left to write. Although the essay is an old form, it hasn't been assiduously cultivated. In the print era,",4,4,5
Why are undergraduates considered undervalued?,"Few realize the huge spread in the value of 20 year olds, with some being more capable than all but a handful of 30 year olds.","Or more precisely, I think few realize the huge spread in the value of 20 year olds.","ramen. The less it costs to start a company, the less you need the permission of investors to do it. So a lot of people will be able to start companies now who never could have before. The most interesting subset may be those in their early twenties. I'm not so excited about founders who have everything investors want except intelligence, or everything except energy. The most promising group to be liberated by the new, lower threshold are those who have everything investors want except experience. Market Rate I once claimed that nerds were unpopular in secondary school mainly because they had better things to do than work full-time at being popular. Some said I was just telling people what they wanted to hear. Well, I'm now about to do that in a spectacular way: I think undergraduates are undervalued. Or more precisely, I think few realize the huge spread in the value of 20 year olds. Some, it's true, are not very capable. But others are more capable than all but a handful of 30 year olds. Till now the problem has always been that it's difficult to pick them out. Every VC in the world, if they could go back in time, would try to invest in Microsoft. But which would have then? How many would have understood that this particular 19 year old was Bill Gates? It's hard to judge the young because (a) they change rapidly, (b) there is great variation between them, and (c) they're individually inconsistent. That last one is a big problem. When you're young, you occasionally say and do stupid things even when you're smart. So if the algorithm is to filter out people who say stupid things, as many investors and employers unconsciously do, you're going to get a lot of false positives. Most organizations who hire people right out of college are only aware of the average value of 22 year olds, which is not that high. And so the idea for most of the twentieth century was that everyone had to begin as a trainee in some entry-level job. Organizations realized there was a lot of variation in the incoming stream, but instead of pursuing this thought they tended to suppress it, in the belief that it was good for even the most promising kids to start at the bottom, so they didn't get swelled heads. The most productive young people will always be undervalued by large organizations, because the young have no performance to measure yet, and any error in guessing their ability will tend toward the mean. What's an especially productive 22 year old to do? One thing you can do is go over the heads of organizations, directly to the users. Any company that hires you is, economically, acting as a proxy for the customer. The rate at which they value you (though they may not consciously realize it) is an attempt to guess your value to the user. But there's a way to appeal their",5,4,4
What does ramen profitable mean?,Ramen profitable means a startup makes just enough to pay the founders' living expenses.,"Now that the term ramen profitable has become widespread, I ought to explain precisely what the idea entails. Ramen profitable means a startup makes just enough to pay the founders' living expenses.","When you're riding a Segway you're just standing there. And someone who's being whisked along while seeming to do no work someone in a sedan chair, for example can't help but look smug. Try this thought experiment and it becomes clear: imagine something that worked like the Segway, but that you rode with one foot in front of the other, like a skateboard. That wouldn't seem nearly as uncool. So there may be a way to capture more of the market Segway hoped to reach: make a version that doesn't look so easy for the rider. It would also be helpful if the styling was in the tradition of skateboards or bicycles rather than medical devices. Curiously enough, what got Segway into this problem was that the company was itself a kind of Segway. It was too easy for them; they were too successful raising money. If they'd had to grow the company gradually, by iterating through several versions they sold to real users, they'd have learned pretty quickly that people looked stupid riding them. Instead they had enough to work in secret. They had focus groups aplenty, I'm sure, but they didn't have the people yelling insults out of cars. So they never realized they were zooming confidently down a blind alley."",The Trouble with the Segway Now that the term ramen profitable has become widespread, I ought to explain precisely what the idea entails. Ramen profitable means a startup makes just enough to pay the founders' living expenses. This is a different form of profitability than startups have traditionally aimed for. Traditional profitability means a big bet is finally paying off, whereas the main importance of ramen profitability is that it buys you time. In the past, a startup would usually become profitable only after raising and spending quite a lot of money. A company making computer hardware might not become profitable for 5 years, during which they spent $50 million. But when they did they might have revenues of $50 million a year. This kind of profitability means the startup has succeeded. Ramen profitability is the other extreme: a startup that becomes profitable after 2 months, even though its revenues are only $3000 a month, because the only employees are a couple 25 year old founders who can live on practically nothing. Revenues of $3000 a month do not mean the company has succeeded. But it does share something with the one that's profitable in the traditional way: they don't need to raise money to survive. Ramen profitability is an unfamiliar idea to most people because it only recently became feasible. It's still not feasible for a lot of startups; it would not be for most biotech startups, for example; but it is for many software startups because they're now so cheap. For many, the only real cost is the founders' living expenses. The main significance of this type of profitability is that you're no longer at the mercy of investors. If you're still losing money, then eventually",5,4,5
What is the best thing colleges can do to help students start startups?,Leave them alone in the right way.,"The empirical evidence suggests that if colleges want to help their students start startups, the best thing they can do is leave them alone in the right way.","brief entry listing the gaps and anomalies you'd noticed that day. Not startup ideas, just the raw gaps and anomalies. Sam Altman points out that taking time to come up with an idea is not merely a better strategy in an absolute sense, but also like an undervalued stock in that so few founders do it. There's comparatively little competition for the best ideas, because few founders are willing to put in the time required to notice them. Whereas there is a great deal of competition for mediocre ideas, because when people make up startup ideas, they tend to make up the same ones. For the computer hardware and software companies, summer jobs are the first phase of the recruiting funnel. But if you're good you can skip the first phase. If you're good you'll have no trouble getting hired by these companies when you graduate, regardless of how you spent your summers. The empirical evidence suggests that if colleges want to help their students start startups, the best thing they can do is leave them alone in the right way. I'm speaking here of IT startups; in biotech things are different. This is an instance of a more general rule: focus on users, not competitors. The most important information about competitors is what you learn via users anyway. In practice most successful startups have elements of both. And you can describe each strategy in terms of the other by adjusting the boundaries of what you call the market. But it's useful to consider these two ideas separately. I almost hesitate to raise that point though. Startups are businesses; the point of a business is to make money; and with that additional constraint, you can't expect you'll be able to spend all your time working on what interests you most. The need has to be a strong one. You can retroactively describe any made-up idea as something you need. But do you really need that recipe site or local event aggregator as much as Drew Houston needed Dropbox, or Brian Chesky and Joe Gebbia needed Airbnb? Quite often at YC I find myself asking founders Would you use this thing yourself, if you hadn't written it? and you'd be surprised how often the answer is no. Paul Buchheit points out that trying to sell something bad can be a source of better ideas: The best technique I've found for dealing with YC companies that have bad ideas is to tell them to go sell the product ASAP (before wasting time building it). Not only do they learn that nobody wants what they are building, they very often come back with a real idea that they discovered in the process of trying to sell the bad idea. Here's a recipe that might produce the next Facebook, if you're college students. If you have a connection to one of the more powerful sororities at your school, approach the queen bees thereof and offer to be their personal IT consultants, building anything they",5,5,4
What is the main argument against using web-based applications for companies?,"The argument against this approach usually hinges on security: if access is easier for employees, it will be for bad guys too.","The argument against this approach usually hinges on security: if access is easier for employees, it will be for bad guys too.","of new technology. Web-based applications will often be the best thing for big companies too though they'll be slow to realize it. The best intranet is the Internet. If a company uses true Web-based applications, the software will work better, the servers will be better administered, and employees will have access to the system from anywhere. The argument against this approach usually hinges on security: if access is easier for employees, it will be for bad guys too. Some larger merchants were reluctant to use Viaweb because they thought customers' credit card information would be safer on their own servers. It was not easy to make this point diplomatically, but in fact the data was almost certainly safer in our hands than theirs. Who can hire better people to manage security, a technology startup whose whole business is running servers, or a clothing retailer? Not only did we have better people worrying about security, we worried more about it. If someone broke into the clothing retailer's servers, it would affect at most one merchant, could probably be hushed up, and in the worst case might get one person fired. If someone broke into ours, it could affect thousands of merchants, would probably end up as news on CNet, and could put us out of business. If you want to keep your money safe, do you keep it under your mattress at home, or put it in a bank? This argument applies to every aspect of server administration: not just security, but uptime, bandwidth, load management, backups, etc. Our existence depended on doing these things right. Server problems were the big no-no for us, like a dangerous toy would be for a toy maker, or a salmonella outbreak for a food processor. A big company that uses Web-based applications is to that extent outsourcing IT. Drastic as it sounds, I think this is generally a good idea. Companies are likely to get better service this way than they would from in-house system administrators. System administrators can become cranky and unresponsive because they're not directly exposed to competitive pressure: a salesman has to deal with customers, and a developer has to deal with competitors' software, but a system administrator, like an old bachelor, has few external forces to keep him in line. At Viaweb we had external forces in plenty to keep us in line. The people calling us were customers, not just co-workers. If a server got wedged, we jumped; just thinking about it gives me a jolt of adrenaline, years later. So Web-based applications will ordinarily be the right answer for big companies too. They will be the last to realize it, however, just as they were with desktop computers. And partly for the same reason: it will be worth a lot of money to convince big companies that they need something more expensive. There is always a tendency for rich customers to buy expensive solutions, even when cheap solutions are better, because the people offering expensive solutions can spend",5,4,4
What is the root cause of variation in income?,The root cause of variation in income is the same as the root cause of variation in every other human skill.,"The root cause of variation in income, as Occam's Razor implies, is the same as the root cause of variation in every other human skill.","was obvious then too that the wealth of the world was not a fixed quantity that had to be shared out, like slices of a pie. If you wanted more wealth, you could make it. This is just as true today, though few of us create wealth directly for ourselves (except for a few vestigial domestic tasks). Mostly we create wealth for other people in exchange for money, which we then trade for the forms of wealth we want. Because kids are unable to create wealth, whatever they have has to be given to them. And when wealth is something you're given, then of course it seems that it should be distributed equally. As in most families it is. The kids see to that. Unfair, they cry, when one sibling gets more than another. In the real world, you can't keep living off your parents. If you want something, you either have to make it, or do something of equivalent value for someone else, in order to get them to give you enough money to buy it In the real world, wealth is (except for a few specialists like thieves and speculators) something you have to create, not something that's distributed by Daddy. And since the ability and desire to create it vary from person to person, it's not made equally. You get paid by doing or making something people want, and those who make more money are often simply better at doing what people want. Top actors make a lot more money than B-list actors. The B-list actors might be almost as charismatic, but when people go to the theater and look at the list of movies playing, they want that extra oomph that the big stars have. Doing what people want is not the only way to get money, of course. You could also rob banks, or solicit bribes, or establish a monopoly. Such tricks account for some variation in wealth, and indeed for some of the biggest individual fortunes, but they are not the root cause of variation in income. The root cause of variation in income, as Occam's Razor implies, is the same as the root cause of variation in every other human skill. In the United States, the CEO of a large public company makes about 100 times as much as the average person. Basketball players make about 128 times as much, and baseball players 72 times as much. Editorials quote this kind of statistic with horror. But I have no trouble imagining that one person could be 100 times as productive as another. In ancient Rome the price of slaves varied by a factor of 50 depending on their skills. And that's without considering motivation, or the extra leverage in productivity that you can get from modern technology. Editorials about athletes' or CEOs' salaries remind me of early Christian writers, arguing from first principles about whether the Earth was round, when they could just walk outside and check. How much someone's work is worth",5,5,4
What do kids often want to believe about their world?,"They want to believe they're living in a comfortable, safe world.","Kids often want to be lied to. They want to believe they're living in a comfortable, safe world as much as their parents want them to believe it.","can see how: questions about death are gently but firmly turned aside. On this topic, especially, they're met half-way by kids. Kids often want to be lied to. They want to believe they're living in a comfortable, safe world as much as their parents want them to believe it. Identity Some parents feel a strong adherence to an ethnic or religious group and want their kids to feel it too. This usually requires two different kinds of lying: the first is to tell the child that he or she is an X, and the second is whatever specific lies Xes differentiate themselves by believing. Telling a child they have a particular ethnic or religious identity is one of the stickiest things you can tell them. Almost anything else you tell a kid, they can change their mind about later when they start to think for themselves. But if you tell a kid they're a member of a certain group, that seems nearly impossible to shake. This despite the fact that it can be one of the most premeditated lies parents tell. When parents are of different religions, they'll often agree between themselves that their children will be """"raised as Xes. And it works. The kids obligingly grow up considering themselves as Xes, despite the fact that if their parents had chosen the other way, they'd have grown up considering themselves as Ys. One reason this works so well is the second kind of lie involved. The truth is common property. You can't distinguish your group by doing things that are rational, and believing things that are true. If you want to set yourself apart from other people, you have to do things that are arbitrary, and believe things that are false. And after having spent their whole lives doing things that are arbitrary and believing things that are false, and being regarded as odd by """"outsiders"""" on that account, the cognitive dissonance pushing children to regard themselves as Xes must be enormous. If they aren't an X, why are they attached to all these arbitrary beliefs and customs? If they aren't an X, why do all the non-Xes call them one? This form of lie is not without its uses. You can use it to carry a payload of beneficial beliefs, and they will also become part of the child's identity. You can tell the child that in addition to never wearing the color yellow, believing the world was created by a giant rabbit, and always snapping their fingers before eating fish, Xes are also particularly honest and industrious. Then X children will grow up feeling it's part of their identity to be honest and industrious. This probably accounts for a lot of the spread of modern religions, and explains why their doctrines are a combination of the useful and the bizarre. The bizarre half is what makes the religion stick, and the useful half is the payload. Authority One of the least excusable reasons adults lie to kids is",5,4,5
What is a recommended way for someone with a family to start a startup?,Start a consulting business you can then gradually turn into a product business.,"What you can do, if you have a family and want to start a startup, is start a consulting business you can then gradually turn into a product business.","would have considered effeminate luxuries, like whole buildings heated to spring temperatures year round. And if things go well, our descendants will take for granted things we would consider shockingly luxurious. There is no absolute standard for material wealth. Health care is a component of it, and that alone is a black hole. For the foreseeable future, people will want ever more material wealth, so there is no limit to the amount of work available for companies, and for startups in particular. Usually the limited-room fallacy is not expressed directly. Usually it's implicit in statements like there are only so many startups Google, Microsoft, and Yahoo can buy. Maybe, though the list of acquirers is a lot longer than that. And whatever you think of other acquirers, Google is not stupid. The reason big companies buy startups is that they've created something valuable. And why should there be any limit to the number of valuable startups companies can acquire, any more than there is a limit to the amount of wealth individual people want? Maybe there would be practical limits on the number of startups any one acquirer could assimilate, but if there is value to be had, in the form of upside that founders are willing to forgo in return for an immediate payment, acquirers will evolve to consume it. Markets are pretty smart that way. 9. Family to support This one is real. I wouldn't advise anyone with a family to start a startup. I'm not saying it's a bad idea, just that I don't want to take responsibility for advising it. I'm willing to take responsibility for telling 22 year olds to start startups. So what if they fail? They'll learn a lot, and that job at Microsoft will still be waiting for them if they need it. But I'm not prepared to cross moms. What you can do, if you have a family and want to start a startup, is start a consulting business you can then gradually turn into a product business. Empirically the chances of pulling that off seem very small. You're never going to produce Google this way. But at least you'll never be without an income. Another way to decrease the risk is to join an existing startup instead of starting your own. Being one of the first employees of a startup is a lot like being a founder, in both the good ways and the bad. You'll be roughly 1/n^2 founder, where n is your employee number. As with the question of cofounders, the real lesson here is to start startups when you're young. 10. Independently wealthy This is my excuse for not starting a startup. Startups are stressful. Why do it if you don't need the money? For every serial entrepreneur, there are probably twenty sane ones who think Start another company? Are you crazy? I've come close to starting new startups a couple times, but I always pull back because I don't want four years of my life to",4,4,4
Why do startups prosper in certain cities?,That's where the experts are.,the reason startups prosper in them is probably the same as it is for any industry: that's where the experts are.,"or publishing? Whatever they are they're probably so far from the top that it would be misleading even to call them centers. It's an interesting question why cities become startup hubs, but the reason startups prosper in them is probably the same as it is for any industry: that's where the experts are. Standards are higher; people are more sympathetic to what you're doing; the kind of people you want to hire want to live there; supporting industries are there; the people you run into in chance meetings are in the same business. Who knows exactly how these factors combine to boost startups in Silicon Valley and squish them in Detroit, but it's clear they do from the number of startups per capita in each. 3. Marginal Niche Most of the groups that apply to Y Combinator suffer from a common problem: choosing a small, obscure niche in the hope of avoiding competition. If you watch little kids playing sports, you notice that below a certain age they're afraid of the ball. When the ball comes near them their instinct is to avoid it. I didn't make a lot of catches as an eight year old outfielder, because whenever a fly ball came my way, I used to close my eyes and hold my glove up more for protection than in the hope of catching it. Choosing a marginal project is the startup equivalent of my eight year old strategy for dealing with fly balls. If you make anything good, you're going to have competitors, so you may as well face that. You can only avoid competition by avoiding good ideas. I think this shrinking from big problems is mostly unconscious. It's not that people think of grand ideas but decide to pursue smaller ones because they seem safer. Your unconscious won't even let you think of grand ideas. So the solution may be to think about ideas without involving yourself. What would be a great idea for someone else to do as a startup? 4. Derivative Idea Many of the applications we get are imitations of some existing company. That's one source of ideas, but not the best. If you look at the origins of successful startups, few were started in imitation of some other startup. Where did they get their ideas? Usually from some specific, unsolved problem the founders identified. Our startup made software for making online stores. When we started it, there wasn't any; the few sites you could order from were hand-made at great expense by web consultants. We knew that if online shopping ever took off, these sites would have to be generated by software, so we wrote some. Pretty straightforward. It seems like the best problems to solve are ones that affect you personally. Apple happened because Steve Wozniak wanted a computer, Google because Larry and Sergey couldn't find stuff online, Hotmail because Sabeer Bhatia and Jack Smith couldn't exchange email at work. So instead of copying the Facebook, with some variation that the",5,5,4
What is a key lesson learned from open source and blogging?,"Ideas can bubble up from the bottom, instead of flowing down from the top.","The third big lesson we can learn from open source and blogging is that ideas can bubble up from the bottom, instead of flowing down from the top.","key tenets of professionalism. Work and life are supposed to be separate. But that part, I'm convinced, is a mistake. Bottom-Up The third big lesson we can learn from open source and blogging is that ideas can bubble up from the bottom, instead of flowing down from the top. Open source and blogging both work bottom-up: people make what they want, and the best stuff prevails. Does this sound familiar? It's the principle of a market economy. Ironically, though open source and blogs are done for free, those worlds resemble market economies, while most companies, for all their talk about the value of free markets, are run internally like communist states. There are two forces that together steer design: ideas about what to do next, and the enforcement of quality. In the channel era, both flowed down from the top. For example, newspaper editors assigned stories to reporters, then edited what they wrote. Open source and blogging show us things don't have to work that way. Ideas and even the enforcement of quality can flow bottom-up. And in both cases the results are not merely acceptable, but better. For example, open source software is more reliable precisely because it's open source; anyone can find mistakes. The same happens with writing. As we got close to publication, I found I was very worried about the essays in Hackers & Painters that hadn't been online. Once an essay has had a couple thousand page views I feel reasonably confident about it. But these had had literally orders of magnitude less scrutiny. It felt like releasing software without testing it. That's what all publishing used to be like. If you got ten people to read a manuscript, you were lucky. But I'd become so used to publishing online that the old method now seemed alarmingly unreliable, like navigating by dead reckoning once you'd gotten used to a GPS. The other thing I like about publishing online is that you can write what you want and publish when you want. Earlier this year I wrote something that seemed suitable for a magazine, so I sent it to an editor I know. As I was waiting to hear back, I found to my surprise that I was hoping they'd reject it. Then I could put it online right away. If they accepted it, it wouldn't be read by anyone for months, and in the meantime I'd have to fight word-by-word to save it from being mangled by some twenty five year old copy editor. Many employees would like to build great things for the companies they work for, but more often than not management won't let them. How many of us have heard stories of employees going to management and saying, please let us build this thing to make money for you-- and the company saying no? The most famous example is probably Steve Wozniak, who originally wanted to build microcomputers for his then-employer, HP. And they turned him down. On the blunderometer, this episode",5,4,4
What is Sarbanes-Oxley?,"Sarbanes-Oxley is a law, passed after the Bubble, that drastically increases the regulatory burden on public companies.","Sarbanes-Oxley is a law, passed after the Bubble, that drastically increases the regulatory burden on public companies.","still haven't invested. This by itself is not the end of the world. In fact, it's just a more extreme version of the norm in the VC business: too much money chasing too few deals. Unfortunately, those few deals now want less and less money, because it's getting so cheap to start a startup. The four causes: open source, which makes software free; Moore's law, which makes hardware geometrically closer to free; the Web, which makes promotion free if you're good; and better languages, which make development a lot cheaper. When we started our startup in 1995, the first three were our biggest expenses. We had to pay $5000 for the Netscape Commerce Server, the only software that then supported secure http connections. We paid $3000 for a server with a 90 MHz processor and 32 meg of memory. And we paid a PR firm about $30,000 to promote our launch. Now you could get all three for nothing. You can get the software for free; people throw away computers more powerful than our first server; and if you make something good you can generate ten times as much traffic by word of mouth online than our first PR firm got through the print media. And of course another big change for the average startup is that programming languages have improved-- or rather, the median language has. At most startups ten years ago, software development meant ten programmers writing code in C++. Now the same work might be done by one or two using Python or Ruby. During the Bubble, a lot of people predicted that startups would outsource their development to India. I think a better model for the future is David Heinemeier Hansson, who outsourced his development to a more powerful language instead. A lot of well-known applications are now, like BaseCamp, written by just one programmer. And one guy is more than 10x cheaper than ten, because (a) he won't waste any time in meetings, and (b) since he's probably a founder, he can pay himself nothing. Because starting a startup is so cheap, venture capitalists now often want to give startups more money than the startups want to take. VCs like to invest several million at a time. But as one VC told me after a startup he funded would only take about half a million, I don't know what we're going to do. Maybe we'll just have to give some of it back. Meaning give some of the fund back to the institutional investors who supplied it, because it wasn't going to be possible to invest it all. Into this already bad situation comes the third problem: Sarbanes-Oxley. Sarbanes-Oxley is a law, passed after the Bubble, that drastically increases the regulatory burden on public companies. And in addition to the cost of compliance, which is at least two million dollars a year, the law introduces frightening legal exposure for corporate officers. An experienced CFO I know said flatly: I would not want to be CFO",5,4,4
How many hours of TV does the average American watch a day?,4 hours,recently that the average American watches 4 hours of TV a day.,"recently that the average American watches 4 hours of TV a day. A quarter of their life. TV is in decline now, but only because people have found even more addictive ways of wasting time. And what's especially dangerous is that many happen at your computer. This is no accident. An ever larger percentage of office workers sit in front of computers connected to the Internet, and distractions always evolve toward the procrastinators. I remember when computers were, for me at least, exclusively for work. I might occasionally dial up a server to get mail or ftp files, but most of the time I was offline. All I could do was write and program. Now I feel as if someone snuck a television onto my desk. Terribly addictive things are just a click away. Run into an obstacle in what you're working on? Hmm, I wonder what's new online. Better check. After years of carefully avoiding classic time sinks like TV, games, and Usenet, I still managed to fall prey to distraction, because I didn't realize that it evolves. Something that used to be safe, using the Internet, gradually became more and more dangerous. Some days I'd wake up, get a cup of tea and check the news, then check email, then check the news again, then answer a few emails, then suddenly notice it was almost lunchtime and I hadn't gotten any real work done. And this started to happen more and more often. It took me surprisingly long to realize how distracting the Internet had become, because the problem was intermittent. I ignored it the way you let yourself ignore a bug that only appears intermittently. When I was in the middle of a project, distractions weren't really a problem. It was when I'd finished one project and was deciding what to do next that they always bit me. Another reason it was hard to notice the danger of this new type of distraction was that social customs hadn't yet caught up with it. If I'd spent a whole morning sitting on a sofa watching TV, I'd have noticed very quickly. That's a known danger sign, like drinking alone. But using the Internet still looked and felt a lot like work. Eventually, though, it became clear that the Internet had become so much more distracting that I had to start treating it differently. Basically, I had to add a new application to my list of known time sinks: Firefox. * * * The problem is a hard one to solve because most people still need the Internet for some things. If you drink too much, you can solve that problem by stopping entirely. But you can't solve the problem of overeating by stopping eating. I couldn't simply avoid the Internet entirely, as I'd done with previous time sinks. At first I tried rules. For example, I'd tell myself I was only going to use the Internet twice a day. But these schemes never worked for long. Eventually something",5,4,5
Why is character important in startup cofounder relationships?,Character is important because it is tested more severely than in most other situations.,The reason character is so important is that it's tested more severely than in most other situations.,"haven't seen someone's true colors unless you've worked with them on a startup. The reason character is so important is that it's tested more severely than in most other situations. One founder said explicitly that the relationship between founders was more important than ability: I would rather cofound a startup with a friend than a stranger with higher output. Startups are so hard and emotional that the bonds and emotional and social support that come with friendship outweigh the extra output lost. We learned this lesson a long time ago. If you look at the YC application, there are more questions about the commitment and relationship of the founders than their ability. Founders of successful startups talked less about choosing cofounders and more about how hard they worked to maintain their relationship. One thing that surprised me is how the relationship of startup founders goes from a friendship to a marriage. My relationship with my cofounder went from just being friends to seeing each other all the time, fretting over the finances and cleaning up shit. And the startup was our baby. I summed it up once like this: It's like we're married, but we're not fucking. Several people used that word married. It's a far more intense relationship than you usually see between coworkersâ€”partly because the stresses are so much greater, and partly because at first the founders are the whole company. So this relationship has to be built of top quality materials and carefully maintained. It's the basis of everything. 2. Startups Take Over Your Life Just as the relationship between cofounders is more intense than it usually is between coworkers, so is the relationship between the founders and the company. Running a startup is not like having a job or being a student, because it never stops. This is so foreign to most people's experience that they don't get it till it happens. I didn't realize I would spend almost every waking moment either working or thinking about our startup. You enter a whole different way of life when it's your company vs. working for someone else's company. It's exacerbated by the fast pace of startups, which makes it seem like time slows down: I think the thing that's been most surprising to me is how one's perspective on time shifts. Working on our startup, I remember time seeming to stretch out, so that a month was a huge interval. In the best case, total immersion can be exciting: It's surprising how much you become consumed by your startup, in that you think about it day and night, but never once does it feel like work. Though I have to say, that quote is from someone we funded this summer. In a couple years he may not sound so chipper. 3. It's an Emotional Roller-coaster This was another one lots of people were surprised about. The ups and downs were more extreme than they were prepared for. In a startup, things seem great one moment and hopeless",5,5,4
What is one of the biggest unexploited opportunities in startup investing?,Angel-sized investments made quickly.,I think one of the biggest unexploited opportunities in startup investing right now is angel-sized investments made quickly.,"to the best deals, unless you got lucky like Andy Bechtolsheim, and when you did invest in a startup, VCs might try to strip you of your stock when they arrived later. Now an angel can go to something like Demo Day or AngelList and have access to the same deals VCs do. And the days when VCs could wash angels out of the cap table are long gone. I think one of the biggest unexploited opportunities in startup investing right now is angel-sized investments made quickly. Few investors understand the cost that raising money from them imposes on startups. When the company consists only of the founders, everything grinds to a halt during fundraising, which can easily take 6 weeks. The current high cost of fundraising means there is room for low-cost investors to undercut the rest. And in this context, low-cost means deciding quickly. If there were a reputable investor who invested $100k on good terms and promised to decide yes or no within 24 hours, they'd get access to almost all the best deals, because every good startup would approach them first. It would be up to them to pick, because every bad startup would approach them first too, but at least they'd see everything. Whereas if an investor is notorious for taking a long time to make up their mind or negotiating a lot about valuation, founders will save them for last. And in the case of the most promising startups, which tend to have an easy time raising money, last can easily become never. Will the number of big hits grow linearly with the total number of new startups? Probably not, for two reasons. One is that the scariness of starting a startup in the old days was a pretty effective filter. Now that the cost of failing is becoming lower, we should expect founders to do it more. That's not a bad thing. It's common in technology for an innovation that decreases the cost of failure to increase the number of failures and yet leave you net ahead. The other reason the number of big hits won't grow proportionately to the number of startups is that there will start to be an increasing number of idea clashes. Although the finiteness of the number of good ideas is not the reason there are only 15 big hits a year, the number has to be finite, and the more startups there are, the more we'll see multiple companies doing the same thing at the same time. It will be interesting, in a bad way, if idea clashes become a lot more common. Mostly because of the increasing number of early failures, the startup business of the future won't simply be the same shape, scaled up. What used to be an obelisk will become a pyramid. It will be a little wider at the top, but a lot wider at the bottom. What does that mean for investors? One thing it means is that there will be",5,4,4
What do the conventional-minded say about shutting down discussions of ideas?,"They say they don't want to shut down the discussion of all ideas, just the bad ones.","The conventional-minded say, as they always do, that they don't want to shut down the discussion of all ideas, just the bad ones.","noticed that the customs protecting free inquiry have been weakened. Some say we're overreacting â€” that they haven't been weakened very much, or that they've been weakened in the service of a greater good. The latter I'll dispose of immediately. When the conventional-minded get the upper hand, they always say it's in the service of a greater good. It just happens to be a different, incompatible greater good each time. As for the former worry, that the independent-minded are being oversensitive, and that free inquiry hasn't been shut down that much, you can't judge that unless you are yourself independent-minded. You can't know how much of the space of ideas is being lopped off unless you have them, and only the independent-minded have the ones at the edges. Precisely because of this, they tend to be very sensitive to changes in how freely one can explore ideas. They're the canaries in this coalmine. The conventional-minded say, as they always do, that they don't want to shut down the discussion of all ideas, just the bad ones. You'd think it would be obvious just from that sentence what a dangerous game they're playing. But I'll spell it out. There are two reasons why we need to be able to discuss even """"bad"""" ideas. The first is that any process for deciding which ideas to ban is bound to make mistakes. All the more so because no one intelligent wants to undertake that kind of work, so it ends up being done by the stupid. And when a process makes a lot of mistakes, you need to leave a margin for error. Which in this case means you need to ban fewer ideas than you'd like to. But that's hard for the aggressively conventional-minded to do, partly because they enjoy seeing people punished, as they have since they were children, and partly because they compete with one another. Enforcers of orthodoxy can't allow a borderline idea to exist, because that gives other enforcers an opportunity to one-up them in the moral purity department, and perhaps even to turn enforcer upon them. So instead of getting the margin for error we need, we get the opposite: a race to the bottom in which any idea that seems at all bannable ends up being banned. The second reason it's dangerous to ban the discussion of ideas is that ideas are more closely related than they look. Which means if you restrict the discussion of some topics, it doesn't only affect those topics. The restrictions propagate back into any topic that yields implications in the forbidden ones. And that is not an edge case. The best ideas do exactly that: they have consequences in fields far removed from their origins. Having ideas in a world where some ideas are banned is like playing soccer on a pitch that has a minefield in one corner. You don't just play the same game you would have, but on a different shaped pitch. You play a much more",5,4,4
Why do parents tend to be more conservative for their kids?,Parents end up sharing more of their kids' ill fortune than good fortune.,Parents end up sharing more of their kids' ill fortune than good fortune.,"work anyway and sit in front of your screen and pretend to. To someone who likes work, as most good hackers do, this is torture. In a startup, you skip all that. There's no concept of office hours in most startups. Work and life just get mixed together. But the good thing about that is that no one minds if you have a life at work. In a startup you can do whatever you want most of the time. If you're a founder, what you want to do most of the time is work. But you never have to pretend to. If you took a nap in your office in a big company, it would seem unprofessional. But if you're starting a startup and you fall asleep in the middle of the day, your cofounders will just assume you were tired. 15. Parents want you to be a doctor A significant number of would-be startup founders are probably dissuaded from doing it by their parents. I'm not going to say you shouldn't listen to them. Families are entitled to their own traditions, and who am I to argue with them? But I will give you a couple reasons why a safe career might not be what your parents really want for you. One is that parents tend to be more conservative for their kids than they would be for themselves. This is actually a rational response to their situation. Parents end up sharing more of their kids' ill fortune than good fortune. Most parents don't mind this; it's part of the job; but it does tend to make them excessively conservative. And erring on the side of conservatism is still erring. In almost everything, reward is proportionate to risk. So by protecting their kids from risk, parents are, without realizing it, also protecting them from rewards. If they saw that, they'd want you to take more risks. The other reason parents may be mistaken is that, like generals, they're always fighting the last war. If they want you to be a doctor, odds are it's not just because they want you to help the sick, but also because it's a prestigious and lucrative career. But not so lucrative or prestigious as it was when their opinions were formed. When I was a kid in the seventies, a doctor was the thing to be. There was a sort of golden triangle involving doctors, Mercedes 450SLs, and tennis. All three vertices now seem pretty dated. The parents who want you to be a doctor may simply not realize how much things have changed. Would they be that unhappy if you were Steve Jobs instead? So I think the way to deal with your parents' opinions about what you should do is to treat them like feature requests. Even if your only goal is to please them, the way to do that is not simply to give them what they ask for. Instead think about why they're asking for something, and see if",5,4,4
What are the four factors in doing great work?,"ability, interest, effort, and luck","The factors in doing great work are factors in the literal, mathematical sense, and they are: ability, interest, effort, and luck.","can nurture it and let it drive you. Curiosity is the key to all four steps in doing great work: it will choose the field for you, get you to the frontier, cause you to notice the gaps in it, and drive you to explore them. The whole process is a kind of dance with curiosity. Believe it or not, I tried to make this essay as short as I could. But its length at least means it acts as a filter. If you made it this far, you must be interested in doing great work. And if so you're already further along than you might realize, because the set of people willing to want to is small. The factors in doing great work are factors in the literal, mathematical sense, and they are: ability, interest, effort, and luck. Luck by definition you can't do anything about, so we can ignore that. And we can assume effort, if you do in fact want to do great work. So the problem boils down to ability and interest. Can you find a kind of work where your ability and interest will combine to yield an explosion of new ideas? Here there are grounds for optimism. There are so many different ways to do great work, and even more that are still undiscovered. Out of all those different types of work, the one you're most suited for is probably a pretty close match. Probably a comically close match. It's just a question of finding it, and how far into it your ability and interest can take you. And you can only answer that by trying. Many more people could try to do great work than do. What holds them back is a combination of modesty and fear. It seems presumptuous to try to be Newton or Shakespeare. It also seems hard; surely if you tried something like that, you'd fail. Presumably the calculation is rarely explicit. Few people consciously decide not to try to do great work. But that's what's going on subconsciously; they shy away from the question. So I'm going to pull a sneaky trick on you. Do you want to do great work, or not? Now you have to decide consciously. Sorry about that. I wouldn't have done it to a general audience. But we already know you're interested. Don't worry about being presumptuous. You don't have to tell anyone. And if it's too hard and you fail, so what? Lots of people have worse problems than that. In fact you'll be lucky if it's the worst problem you have. Yes, you'll have to work hard. But again, lots of people have to work hard. And if you're working on something you find very interesting, which you necessarily will if you're on the right path, the work will probably feel less burdensome than a lot of your peers'. The discoveries are out there, waiting to be made. Why not by you? I don't think you could give a precise definition",5,4,4
What is required for an essay to be evergreen and timeless?,"An essay has to be ineffective, in the sense that its discoveries aren't assimilated into our shared culture.","To be the evergreen kind of timeless, an essay has to be ineffective, in the sense that its discoveries aren't assimilated into our shared culture.","you've covered enough interesting ground, you start to lose your appetite for new questions. Which is just as well, because the reader is probably feeling sated too. And it's not lazy to stop asking questions, because you could instead be asking the initial question of a new essay. That's the ultimate source of drag on the connectedness of ideas: the discoveries you make along the way. If you discover enough starting from question A, you'll never make it to question B. Though if you keep writing essays you'll gradually fix this problem by burning off such discoveries. So bizarrely enough, writing lots of essays makes it as if the space of ideas were more highly connected. When a subtree comes to an end, you can do one of two things. You can either stop, or pull the Cubist trick of laying separate subtrees end to end by returning to a question you skipped earlier. Usually it requires some sleight of hand to make the essay flow continuously at this point, but not this time. This time I actually need an example of the phenomenon. For example, we discovered earlier that the best possible essay wouldn't usually be timeless in the way the best painting would. This seems surprising enough to be worth investigating further. There are two senses in which an essay can be timeless: to be about a matter of permanent importance, and always to have the same effect on readers. With art these two senses blend together. Art that looked beautiful to the ancient Greeks still looks beautiful to us. But with essays the two senses diverge, because essays teach, and you can't teach people something they already know. Natural selection is certainly a matter of permanent importance, but an essay explaining it couldn't have the same effect on us that it would have had on Darwin's contemporaries, precisely because his ideas were so successful that everyone already knows about them. I imagined when I started writing this that the best possible essay would be timeless in the stricter, evergreen sense: that it would contain some deep, timeless wisdom that would appeal equally to Aristotle and Feynman. That doesn't seem to be true. But if the best possible essay wouldn't usually be timeless in this stricter sense, what would it take to write essays that were? The answer to that turns out to be very strange: to be the evergreen kind of timeless, an essay has to be ineffective, in the sense that its discoveries aren't assimilated into our shared culture. Otherwise there will be nothing new in it for the second generation of readers. If you want to surprise readers not just now but in the future as well, you have to write essays that won't stick â€” essays that, no matter how good they are, won't become part of what people in the future learn before they read them. I can imagine several ways to do that. One would be to write about things people never",5,5,5
What should you avoid doing with slides during a presentation?,Don't put too many words on slides.,11. Don't put too many words on slides.,"favor by letting them invest, why are you investing your time in it? 10. Don't try to seem more than you are. Don't worry if your company is just a few months old and doesn't have an office yet, or your founders are technical people with no business experience. Google was like that once, and they turned out ok. Smart investors can see past such superficial flaws. They're not looking for finished, smooth presentations. They're looking for raw talent. All you need to convince them of is that you're smart and that you're onto something good. If you try too hard to conceal your rawness by trying to seem corporate, or pretending to know about stuff you don't you may just conceal your talent. You can afford to be candid about what you haven't figured out yet. Don't go out of your way to bring it up (e.g. by having a slide about what might go wrong), but don't try to pretend either that you're further along than you are. If you're a hacker and you're presenting to experienced investors, they're probably better at detecting bullshit than you are at producing it. 11. Don't put too many words on slides. When there are a lot of words on a slide, people just skip reading it. So look at your slides and ask of each word could I cross this out? This includes gratuitous clip art. Try to get your slides under 20 words if you can. Don't read your slides. They should be something in the background as you face the audience and talk to them, not something you face and read to an audience sitting behind you. Cluttered sites don't do well in demos, especially when they're projected onto a screen. At the very least, crank up the font size big enough to make all the text legible. But cluttered sites are bad anyway, so perhaps you should use this opportunity to make your design simpler. 12. Specific numbers are good. If you have any kind of data, however preliminary, tell the audience. Numbers stick in people's heads. If you can claim that the median visitor generates 12 page views, that's great. But don't give them more than four or five numbers, and only give them numbers specific to you. You don't need to tell them the size of the market you're in. Who cares, really, if it's 500 million or 5 billion a year? Talking about that is like an actor at the beginning of his career telling his parents how much Tom Hanks makes. Yeah, sure, but first you have to become Tom Hanks. The important part is not whether he makes ten million a year or a hundred, but how you get there. 13. Tell stories about users. The biggest fear of investors looking at early stage startups is that you've built something based on your own a priori theories of what the world needs, but that no one will actually want. So it's good if",5,4,5
What is the expected value of starting a successful startup if the chance of succeeding is 1% and it could make a founder $100 million?,$1 million,"If a successful startup could make a founder $100 million, then even if the chance of succeeding were only 1%, the expected value of starting one would be $1 million.","being influenced by some initial vision, just as a scientist is better off following the truth wherever it leads rather than being influenced by what he wishes were the case. When Richard Feynman said that the imagination of nature was greater than the imagination of man, he meant that if you just keep following the truth you'll discover cooler things than you could ever have made up. For startups, growth is a constraint much like truth. Every successful startup is at least partly a product of the imagination of growth. Value: It's hard to find something that grows consistently at several percent a week, but if you do you may have found something surprisingly valuable. A company that grows at 1% a week will grow 1.7x a year, whereas a company that grows at 5% a week will grow 12.6x. A company making $1000 a month (a typical number early in YC) and growing at 1% a week will 4 years later be making $7900 a month, which is less than a good programmer makes in salary in Silicon Valley. A startup that grows at 5% a week will in 4 years be making $25 million a month. Our ancestors must rarely have encountered cases of exponential growth, because our intuitions are no guide here. What happens to fast growing startups tends to surprise even the founders. Small variations in growth rate produce qualitatively different outcomes. That's why there's a separate word for startups, and why startups do things that ordinary companies don't, like raising money and getting acquired. And, strangely enough, it's also why they fail so frequently. Considering how valuable a successful startup can become, anyone familiar with the concept of expected value would be surprised if the failure rate weren't high. If a successful startup could make a founder $100 million, then even if the chance of succeeding were only 1%, the expected value of starting one would be $1 million. And the probability of a group of sufficiently smart and determined founders succeeding on that scale might be significantly over 1%. For the right people e.g. the young Bill Gates the probability might be 20% or even 50%. So it's not surprising that so many want to take a shot at it. In an efficient market, the number of failed startups should be proportionate to the size of the successes. And since the latter is huge the former should be too. What this means is that at any given time, the great majority of startups will be working on something that's never going to go anywhere, and yet glorifying their doomed efforts with the grandiose title of startup. This doesn't bother me. It's the same with other high-beta vocations, like being an actor or a novelist. I've long since gotten used to it. But it seems to bother a lot of people, particularly those who've started ordinary businesses. Many are annoyed that these so-called startups get all the attention, when hardly any of them will amount",5,4,4
"What is the best way to begin writing a big, complex program?",To write a prototype that solves a subset of the problem.,"So if you need to write a big, complex program, the best way to begin may not be to write a spec for it, but to write a prototype that solves a subset of the problem.","make code too dense. Some parts of a program may be easiest to read if you spread things out, like an introductory textbook. Whereas if you're writing code to make it easy to reload into your head, it may be best to go for brevity. Work in small groups. When you manipulate a program in your head, your vision tends to stop at the edge of the code you own. Other parts you don't understand as well, and more importantly, can't take liberties with. So the smaller the number of programmers, the more completely a project can mutate. If there's just one programmer, as there often is at first, you can do all-encompassing redesigns. Don't have multiple people editing the same piece of code. You never understand other people's code as well as your own. No matter how thoroughly you've read it, you've only read it, not written it. So if a piece of code is written by multiple authors, none of them understand it as well as a single author would. And of course you can't safely redesign something other people are working on. It's not just that you'd have to ask permission. You don't even let yourself think of such things. Redesigning code with several authors is like changing laws; redesigningcode you alone control is like seeing the other interpretation of an ambiguous image. If you want to put several people to work on a project, divide it into components and give each to one person. Start small. A program gets easier to hold in your head as you become familiar with it. You can start to treat parts as black boxes once you feel confident you've fully explored them. But when you first start working on a project, you're forced to see everything. If you start with too big a problem, you may never quite be able to encompass it. So if you need to write a big, complex program, the best way to begin may not be to write a spec for it, but to write a prototype that solves a subset of the problem. Whatever the advantages of planning, they're often outweighed by the advantages of being able to keep a program in your head. It's striking how often programmers manage to hit all eight points by accident. Someone has an idea for a new project, but because it's not officially sanctioned, he has to do it in off hours which turn out to be more productive because there are no distractions. Driven by his enthusiasm for the new project he works on it for many hours at a stretch. Because it's initially just an experiment, instead of a production language he uses a mere scripting language which is in fact far more powerful. He completely rewrites the program several times; that wouldn't be justifiable for an official project, but this is a labor of love and he wants it to be perfect. And since no one is going to see it except him, he",5,4,4
What are the two main categories of investors?,Angels and VCs.,"The two main categories are angels and VCs: VCs invest other people's money, and angels invest their own.","I tried to figure out what you'd need to reproduce Silicon Valley. I decided the critical ingredients were rich people and nerdsâ€”investors and founders. People are all you need to make technology, and all the other people will move. If I had to narrow that down, I'd say investors are the limiting factor. Not because they contribute more to the startup, but simply because they're least willing to move. They're rich. They're not going to move to Albuquerque just because there are some smart hackers there they could invest in. Whereas hackers will move to the Bay Area to find investors. 2. Angel investors are the most critical. There are several types of investors. The two main categories are angels and VCs: VCs invest other people's money, and angels invest their own. Though they're less well known, the angel investors are probably the more critical ingredient in creating a silicon valley. Most companies that VCs invest in would never have made it that far if angels hadn't invested first. VCs say between half and three quarters of companies that raise series A rounds have taken some outside investment already. Angels are willing to fund riskier projects than VCs. They also give valuable advice, because (unlike VCs) many have been startup founders themselves. Google's story shows the key role angels play. A lot of people know Google raised money from Kleiner and Sequoia. What most don't realize is how late. That VC round was a series B round; the premoney valuation was $75 million. Google was already a successful company at that point. Really, Google was funded with angel money. It may seem odd that the canonical Silicon Valley startup was funded by angels, but this is not so surprising. Risk is always proportionate to reward. So the most successful startup of all is likely to have seemed an extremely risky bet at first, and that is exactly the kind VCs won't touch. Where do angel investors come from? From other startups. So startup hubs like Silicon Valley benefit from something like the marketplace effect, but shifted in time: startups are there because startups were there. 3. Angels don't like publicity. If angels are so important, why do we hear more about VCs? Because VCs like publicity. They need to market themselves to the investors who are their customers the endowments and pension funds and rich families whose money they investâ€”and also to founders who might come to them for funding. Angels don't need to market themselves to investors because they invest their own money. Nor do they want to market themselves to founders: they don't want random people pestering them with business plans. Actually, neither do VCs. Both angels and VCs get deals almost exclusively through personal introductions. The reason VCs want a strong brand is not to draw in more business plans over the transom, but so they win deals when competing against other VCs. Whereas angels are rarely in direct competition, because (a) they do fewer deals, (b)",5,4,5
What is the main focus for success in startups?,"You have to make something people want, and you prosper only to the extent you do.","You have to make something people want, and you prosper only to the extent you do.","continue to work if you go to work for a big company. Depending on how broken the company is, you can succeed by sucking up to the right people, giving the impression of productivity, and so on. But that doesn't work with startups. There is no boss to trick, only users, and all users care about is whether your product does what they want. Startups are as impersonal as physics. You have to make something people want, and you prosper only to the extent you do. The dangerous thing is, faking does work to some degree on investors. If you're super good at sounding like you know what you're talking about, you can fool investors for at least one and perhaps even two rounds of funding. But it's not in your interest to. The company is ultimately doomed. All you're doing is wasting your own time riding it down. So stop looking for the trick. There are tricks in startups, as there are in any domain, but they are an order of magnitude less important than solving the real problem. A founder who knows nothing about fundraising but has made something users love will have an easier time raising money than one who knows every trick in the book but has a flat usage graph. And more importantly, the founder who has made something users love is the one who will go on to succeed after raising the money. Though in a sense it's bad news in that you're deprived of one of your most powerful weapons, I think it's exciting that gaming the system stops working when you start a startup. It's exciting that there even exist parts of the world where you win by doing good work. Imagine how depressing the world would be if it were all like school and big companies, where you either have to spend a lot of time on bullshit things or lose to people who do. I would have been delighted if I'd realized in college that there were parts of the real world where gaming the system mattered less than others, and a few where it hardly mattered at all. But there are, and this variation is one of the most important things to consider when you're thinking about your future. How do you win in each type of work, and what would you like to win by doing? All-Consuming That brings us to our fourth counterintuitive point: startups are all-consuming. If you start a startup, it will take over your life to a degree you cannot imagine. And if your startup succeeds, it will take over your life for a long time: for several years at the very least, maybe for a decade, maybe for the rest of your working life. So there is a real opportunity cost here. Larry Page may seem to have an enviable life, but there are aspects of it that are unenviable. Basically at 25 he started running as fast as he could and it",5,4,5
What programming language is mentioned as having powerful string libraries?,Perl,"yet use Perl by default, because it has powerful string libraries and can talk to the os.","yet use Perl by default, because it has powerful string libraries and can talk to the os. There are two possible problems with prefix notation: that it is unfamiliar to programmers, and that it is not dense enough. The conventional wisdom in the Lisp world is that the first problem is the real one. I'm not so sure. Yes, prefix notation makes ordinary programmers panic. But I don't think ordinary programmers' opinions matter. Languages become popular or unpopular based on what expert hackers think of them, and I think expert hackers might be able to deal with prefix notation. Perl syntax can be pretty incomprehensible, but that has not stood in the way of Perl's popularity. If anything it may have helped foster a Perl cult. A more serious problem is the diffuseness of prefix notation. For expert hackers, that really is a problem. No one wants to write (aref a x y) when they could write a[x,y]. In this particular case there is a way to finesse our way out of the problem. If we treat data structures as if they were functions on indexes, we could write (a x y) instead, which is even shorter than the Perl form. Similar tricks may shorten other types of expressions. We can get rid of (or make optional) a lot of parentheses by making indentation significant. That's how programmers read code anyway: when indentation says one thing and delimiters say another, we go by the indentation. Treating indentation as significant would eliminate this common source of bugs as well as making programs shorter. Sometimes infix syntax is easier to read. This is especially true for math expressions. I've used Lisp my whole programming life and I still don't find prefix math expressions natural. And yet it is convenient, especially when you're generating code, to have operators that take any number of arguments. So if we do have infix syntax, it should probably be implemented as some kind of read-macro. I don't think we should be religiously opposed to introducing syntax into Lisp, as long as it translates in a well-understood way into underlying s-expressions. There is already a good deal of syntax in Lisp. It's not necessarily bad to introduce more, as long as no one is forced to use it. In Common Lisp, some delimiters are reserved for the language, suggesting that at least some of the designers intended to have more syntax in the future. One of the most egregiously unlispy pieces of syntax in Common Lisp occurs in format strings; format is a language in its own right, and that language is not Lisp. If there were a plan for introducing more syntax into Lisp, format specifiers might be able to be included in it. It would be a good thing if macros could generate format specifiers the way they generate any other kind of code. An eminent Lisp hacker told me that his copy of CLTL falls open to the section format. Mine too. This probably indicates",5,4,5
What is the most common type of startup failure?,"The most common type is not the one that makes spectacular mistakes, but the one that doesn't do much of anything.","The most common type is not the one that makes spectacular mistakes, but the one that doesn't do much of anything the one we never even hear about, because it was some project a couple guys started on the side while working on their day jobs, but which never got anywhere and was gradually abandoned.","are the spectacular flameouts. Those are actually the elite of failures. The most common type is not the one that makes spectacular mistakes, but the one that doesn't do much of anything the one we never even hear about, because it was some project a couple guys started on the side while working on their day jobs, but which never got anywhere and was gradually abandoned. Statistically, if you want to avoid failure, it would seem like the most important thing is to quit your day job. Most founders of failed startups don't quit their day jobs, and most founders of successful ones do. If startup failure were a disease, the CDC would be issuing bulletins warning people to avoid day jobs. Does that mean you should quit your day job? Not necessarily. I'm guessing here, but I'd guess that many of these would-be founders may not have the kind of determination it takes to start a company, and that in the back of their minds, they know it. The reason they don't invest more time in their startup is that they know it's a bad investment. I'd also guess there's some band of people who could have succeeded if they'd taken the leap and done it full-time, but didn't. I have no idea how wide this band is, but if the winner/borderline/hopeless progression has the sort of distribution you'd expect, the number of people who could have made it, if they'd quit their day job, is probably an order of magnitude larger than the number who do make it. If that's true, most startups that could succeed fail because the founders don't devote their whole efforts to them. That certainly accords with what I see out in the world. Most startups fail because they don't make something people want, and the reason most don't is that they don't try hard enough. In other words, starting startups is just like everything else. The biggest mistake you can make is not to try hard enough. To the extent there's a secret to success, it's not to be in denial about that. This is not a complete list of the causes of failure, just those you can control. There are also several you can't, notably ineptitude and bad luck. Ironically, one variant of the Facebook that might work is a facebook exclusively for college students. Steve Jobs tried to motivate people by saying Real artists ship. This is a fine sentence, but unfortunately not true. Many famous works of art are unfinished. It's true in fields that have hard deadlines, like architecture and filmmaking, but even there people tend to be tweaking stuff till it's yanked out of their hands. There's probably also a second factor: startup founders tend to be at the leading edge of technology, so problems they face are probably especially valuable. You should take more than you think you'll need, maybe 50% to 100% more, because software takes longer to write and deals longer to close than you",5,4,4
What law outlawed price discrimination in the U.S.?,The Robinson-Patman Act of 1936.,Price discrimination is so pervasive (how often have you heard a retailer claim that their buying power meant lower prices for you?) that I was surprised to find it was outlawed in the U.S. by the Robinson-Patman Act of 1936.,"everyone was going to use to develop server-based applications. Applets seemed to us an old-fashioned idea. Download programs to run on the client? Simpler just to go all the way and run the programs on the server. We wasted little time on applets, but countless other startups must have been lured into this tar pit. Few can have escaped alive, or Microsoft could not have gotten away with dropping Java in the most recent version of Explorer. This point is due to Trevor Blackwell, who adds the cost of writing software goes up more than linearly with its size. Perhaps this is mainly due to fixing old bugs, and the cost can be more linear if all bugs are found quickly. The hardest kind of bug to find may be a variant of compound bug where one bug happens to compensate for another. When you fix one bug, the other becomes visible. But it will seem as if the fix is at fault, since that was the last thing you changed. Within Viaweb we once had a contest to describe the worst thing about our software. Two customer support people tied for first prize with entries I still shiver to recall. We fixed both problems immediately. [Robert Morris wrote the ordering system, which shoppers used to place orders. Trevor Blackwell wrote the image generator and the manager, which merchants used to retrieve orders, view statistics, and configure domain names etc. I wrote the editor, which merchants used to build their sites. The ordering system and image generator were written in C and C++, the manager mostly in Perl, and the editor in Lisp. Price discrimination is so pervasive (how often have you heard a retailer claim that their buying power meant lower prices for you?) that I was surprised to find it was outlawed in the U.S. by the Robinson-Patman Act of 1936. This law does not appear to be vigorously enforced. In No Logo, Naomi Klein says that clothing brands favored by urban youth do not try too hard to prevent shoplifting because in their target market the shoplifters are also the fashion leaders. Companies often wonder what to outsource and what not to. One possible answer: outsource any job that's not directly exposed to competitive pressure, because outsourcing it will thereby expose it to competitive pressure. The two guys were Dan Bricklin and Bob Frankston. Dan wrote a prototype in Basic in a couple days, then over the course of the next year they worked together (mostly at night) to make a more powerful version written in 6502 machine language. Dan was at Harvard Business School at the time and Bob nominally had a day job writing software. There was no great risk in doing a business, Bob wrote, If it failed it failed. No big deal. It's not quite as easy as I make it sound. It took a painfully long time for word of mouth to get going, and we did not start to get a",5,4,4
What is the single most important issue for technology startups?,Understanding users.,"That is the single most important issue for technology startups, and the rock that sinks more of them than anything else.","nonsense. There's nothing about knowing how to program that prevents hackers from understanding users, or about not knowing how to program that magically enables business people to understand them. If you can't understand users, however, you should either learn how or find a co-founder who can. That is the single most important issue for technology startups, and the rock that sinks more of them than anything else. What Customers Want It's not just startups that have to worry about this. I think most businesses that fail do it because they don't give customers what they want. Look at restaurants. A large percentage fail, about a quarter in the first year. But can you think of one restaurant that had really good food and went out of business? Restaurants with great food seem to prosper no matter what. A restaurant with great food can be expensive, crowded, noisy, dingy, out of the way, and even have bad service, and people will keep coming. It's true that a restaurant with mediocre food can sometimes attract customers through gimmicks. But that approach is very risky. It's more straightforward just to make the food good. It's the same with technology. You hear all kinds of reasons why startups fail. But can you think of one that had a massively popular product and still failed? In nearly every failed startup, the real problem was that customers didn't want the product. For most, the cause of death is listed as ran out of funding, but that's only the immediate cause. Why couldn't they get more funding? Probably because the product was a dog, or never seemed likely to be done, or both. When I was trying to think of the things every startup needed to do, I almost included a fourth: get a version 1 out as soon as you can. But I decided not to, because that's implicit in making something customers want. The only way to make something customers want is to get a prototype in front of them and refine it based on their reactions. The other approach is what I call the Hail Mary strategy. You make elaborate plans for a product, hire a team of engineers to develop it (people who do this tend to use the term engineer for hackers), and then find after a year that you've spent two million dollars to develop something no one wants. This was not uncommon during the Bubble, especially in companies run by business types, who thought of software development as something terrifying that therefore had to be carefully planned. We never even considered that approach. As a Lisp hacker, I come from the tradition of rapid prototyping. I would not claim (at least, not here) that this is the right way to write every program, but it's certainly the right way to write software for a startup. In a startup, your initial plans are almost certain to be wrong in some way, and your first priority should be to figure out where.",5,4,4
What do most people regret about high school?,That they wasted so much time.,"When I ask people what they regret most about high school, they nearly all say the same thing: that they wasted so much time.","you're making will come out badly, or that you won't be able to understand something you're studying, then it isn't hard enough. There has to be suspense. Well, this seems a grim view of the world, you may think. What I'm telling you is that you should worry? Yes, but it's not as bad as it sounds. It's exhilarating to overcome worries. You don't see faces much happier than people winning gold medals. And you know why they're so happy? Relief. I'm not saying this is the only way to be happy. Just that some kinds of worry are not as bad as they sound. Ambition In practice, stay upwind reduces to work on hard problems. And you can start today. I wish I'd grasped that in high school. Most people like to be good at what they do. In the so-called real world this need is a powerful force. But high school students rarely benefit from it, because they're given a fake thing to do. When I was in high school, I let myself believe that my job was to be a high school student. And so I let my need to be good at what I did be satisfied by merely doing well in school. If you'd asked me in high school what the difference was between high school kids and adults, I'd have said it was that adults had to earn a living. Wrong. It's that adults take responsibility for themselves. Making a living is only a small part of it. Far more important is to take intellectual responsibility for oneself. If I had to go through high school again, I'd treat it like a day job. I don't mean that I'd slack in school. Working at something as a day job doesn't mean doing it badly. It means not being defined by it. I mean I wouldn't think of myself as a high school student, just as a musician with a day job as a waiter doesn't think of himself as a waiter. And when I wasn't working at my day job I'd start trying to do real work. When I ask people what they regret most about high school, they nearly all say the same thing: that they wasted so much time. If you're wondering what you're doing now that you'll regret most later, that's probably it. Some people say this is inevitable that high school students aren't capable of getting anything done yet. But I don't think this is true. And the proof is that you're bored. You probably weren't bored when you were eight. When you're eight it's called playing instead of hanging out, but it's the same thing. And when I was eight, I was rarely bored. Give me a back yard and a few other kids and I could play all day. The reason this got stale in middle school and high school, I now realize, is that I was ready for something else. Childhood was getting old. I'm not saying",5,4,4
What is the typical amount of seed investment for most startups?,Several months' living expenses.,"The phrase seed investment covers a broad range. To some VC firms it means $500,000, but to most startups it means several months' living expenses.","do by saying that they're standard in the industry. Standard, schmandard; the whole industry is only a few decades old, and rapidly evolving. The concept of standard is a useful one when you're operating on a small scale (Y Combinator uses identical terms for every deal because for tiny seed-stage investments it's not worth the overhead of negotiating individual deals), but it doesn't apply at the VC level. On that scale, every negotiation is unique. Most successful startups get money from more than one of the preceding five sources. And, confusingly, the names of funding sources also tend to be used as the names of different rounds. The best way to explain how it all works is to follow the case of a hypothetical startup. Stage 1: Seed Round Our startup begins when a group of three friends have an idea-- either an idea for something they might build, or simply the idea let's start a company. Presumably they already have some source of food and shelter. But if you have food and shelter, you probably also have something you're supposed to be working on: either classwork, or a job. So if you want to work full-time on a startup, your money situation will probably change too. A lot of startup founders say they started the company without any idea of what they planned to do. This is actually less common than it seems: many have to claim they thought of the idea after quitting because otherwise their former employer would own it. The three friends decide to take the leap. Since most startups are in competitive businesses, you not only want to work full-time on them, but more than full-time. So some or all of the friends quit their jobs or leave school. (Some of the founders in a startup can stay in grad school, but at least one has to make the company his full-time job.) They're going to run the company out of one of their apartments at first, and since they don't have any users they don't have to pay much for infrastructure. Their main expenses are setting up the company, which costs a couple thousand dollars in legal work and registration fees, and the living expenses of the founders. The phrase seed investment covers a broad range. To some VC firms it means $500,000, but to most startups it means several months' living expenses. We'll suppose our group of friends start with $15,000 from their friend's rich uncle, who they give 5% of the company in return. There's only common stock at this stage. They leave 20% as an options pool for later employees (but they set things up so that they can issue this stock to themselves if they get bought early and most is still unissued), and the three founders each get 25%. By living really cheaply they think they can make the remaining money last five months. When you have five months' runway left, how soon do you need to start looking",4,4,4
What are the two initial things needed to start a startup in college?,An idea and cofounders.,There are only two things you need initially: an idea and cofounders.,"and how well their companies do. I've read that the same is true in the military â€” that the swaggering recruits are no more likely to turn out to be really tough than the quiet ones. And probably for the same reason: that the tests involved are so different from the ones in their previous lives. If you're absolutely terrified of starting a startup, you probably shouldn't do it. But if you're merely unsure whether you're up to it, the only way to find out is to try. Just not now. Ideas So if you want to start a startup one day, what should you do in college? There are only two things you need initially: an idea and cofounders. And the m.o. for getting both is the same. Which leads to our sixth and last counterintuitive point: that the way to get startup ideas is not to try to think of startup ideas. I've written a whole essay on this, so I won't repeat it all here. But the short version is that if you make a conscious effort to think of startup ideas, the ideas you come up with will not merely be bad, but bad and plausible-sounding, meaning you'll waste a lot of time on them before realizing they're bad. The way to come up with good startup ideas is to take a step back. Instead of making a conscious effort to think of startup ideas, turn your mind into the type that startup ideas form in without any conscious effort. In fact, so unconsciously that you don't even realize at first that they're startup ideas. This is not only possible, it's how Apple, Yahoo, Google, and Facebook all got started. None of these companies were even meant to be companies at first. They were all just side projects. The best startups almost have to start as side projects, because great ideas tend to be such outliers that your conscious mind would reject them as ideas for companies. Ok, so how do you turn your mind into the type that startup ideas form in unconsciously? (1) Learn a lot about things that matter, then (2) work on problems that interest you (3) with people you like and respect. The third part, incidentally, is how you get cofounders at the same time as the idea. The first time I wrote that paragraph, instead of learn a lot about things that matter, I wrote become good at some technology. But that prescription, though sufficient, is too narrow. What was special about Brian Chesky and Joe Gebbia was not that they were experts in technology. They were good at design, and perhaps even more importantly, they were good at organizing groups and making projects happen. So you don't have to work on technology per se, so long as you work on problems demanding enough to stretch you. What kind of problems are those? That is very hard to answer in the general case. History is full of examples of young",5,4,4
What is the main expense for startups in their early stages?,The company's main expense is the founders' living expenses.,Their living expenses are the company's main expense.,"our end, money is almost a negligible factor. The startup usually consists of just the founders. Their living expenses are the company's main expense, and since most founders are under 30, their living expenses are low. But at this early stage companies need a lot of help. Practically every question is still unanswered. Some companies we've funded have been working on their software for a year or more, but others haven't decided what to work on, or even who the founders should be. When PR people and journalists recount the histories of startups after they've become big, they always underestimate how uncertain things were at first. They're not being deliberately misleading. When you look at a company like Google, it's hard to imagine they could once have been small and helpless. Sure, at one point they were a just a couple guys in a garage but even then their greatness was assured, and all they had to do was roll forward along the railroad tracks of destiny. Far from it. A lot of startups with just as promising beginnings end up failing. Google has such momentum now that it would be hard for anyone to stop them. But all it would have taken in the beginning would have been for two Google employees to focus on the wrong things for six months, and the company could have died. We know, because we've been there, just how vulnerable startups are in the earliest phases. Curiously enough, that's why founders tend to get so rich from them. Reward is always proportionate to risk, and very early stage startups are insanely risky. What we really do at Y Combinator is get startups launched straight. One of many metaphors you could use for YC is a steam catapult on an aircraft carrier. We get startups airborne. Barely airborne, but enough that they can accelerate fast. When you're launching planes they have to be set up properly or you're just launching projectiles. They have to be pointed straight down the deck; the wings have to be trimmed properly; the engines have to be at full power; the pilot has to be ready. These are the kind of problems we deal with. After we fund startups we work closely with them for three months so closely in fact that we insist they move to where we are. And what we do in those three months is make sure everything is set up for launch. If there are tensions between cofounders we help sort them out. We get all the paperwork set up properly so there are no nasty surprises later. If the founders aren't sure what to focus on first, we try to figure that out. If there is some obstacle right in front of them, we either try to remove it, or shift the startup sideways. The goal is to get every distraction out of the way so the founders can use that time to build (or finish building) something impressive. And then near the",5,4,4
What are Lisp macros used for?,A Lisp macro can be anything from an abbreviation to a compiler for a new language.,A Lisp macro can be anything from an abbreviation to a compiler for a new language.,"be the most interesting of the lot. Ideas 8 and 9 only became part of Lisp by accident, because Steve Russell implemented something McCarthy had never intended to be implemented. And yet these ideas turn out to be responsible for both Lisp's strange appearance and its most distinctive features. Lisp looks strange not so much because it has a strange syntax as because it has no syntax; you express programs directly in the parse trees that get built behind the scenes when other languages are parsed, and these trees are made of lists, which are Lisp data structures. Expressing the language in its own data structures turns out to be a very powerful feature. Ideas 8 and 9 together mean that you can write programs that write programs. That may sound like a bizarre idea, but it's an everyday thing in Lisp. The most common way to do it is with something called a macro. The term macro does not mean in Lisp what it means in other languages. A Lisp macro can be anything from an abbreviation to a compiler for a new language. If you want to really understand Lisp, or just expand your programming horizons, I would learn more about macros. Macros (in the Lisp sense) are still, as far as I know, unique to Lisp. This is partly because in order to have macros you probably have to make your language look as strange as Lisp. It may also be because if you do add that final increment of power, you can no longer claim to have invented a new language, but only a new dialect of Lisp. I mention this mostly as a joke, but it is quite true. If you define a language that has car, cdr, cons, quote, cond, atom, eq, and a notation for functions expressed as lists, then you can build all the rest of Lisp out of it. That is in fact the defining quality of Lisp: it was in order to make this so that McCarthy gave Lisp the shape it has. So suppose Lisp does represent a kind of limit that mainstream languages are approaching asymptotically-- does that mean you should actually use it to write software? How much do you lose by using a less powerful language? Isn't it wiser, sometimes, not to be at the very edge of innovation? And isn't popularity to some extent its own justification? Isn't the pointy-haired boss right, for example, to want to use a language for which he can easily hire programmers? There are, of course, projects where the choice of programming language doesn't matter much. As a rule, the more demanding the application, the more leverage you get from using a powerful language. But plenty of projects are not demanding at all. Most programming probably consists of writing little glue programs, and for little glue programs you can use any language that you're already familiar with and that has good libraries for whatever you need to do. If you",5,4,4
What is a common mistake when generating startup ideas?,It yields bad ideas that sound plausible enough to fool you into working on them.,That m.o. is doubly dangerous: it doesn't merely yield few good ideas; it yields bad ideas that sound plausible enough to fool you into working on them.,"begin by trying to think of startup ideas. That m.o. is doubly dangerous: it doesn't merely yield few good ideas; it yields bad ideas that sound plausible enough to fool you into working on them. At YC we call these made-up or sitcom startup ideas. Imagine one of the characters on a TV show was starting a startup. The writers would have to invent something for it to do. But coming up with good startup ideas is hard. It's not something you can do for the asking. So (unless they got amazingly lucky) the writers would come up with an idea that sounded plausible, but was actually bad. For example, a social network for pet owners. It doesn't sound obviously mistaken. Millions of people have pets. Often they care a lot about their pets and spend a lot of money on them. Surely many of these people would like a site where they could talk to other pet owners. Not all of them perhaps, but if just 2 or 3 percent were regular visitors, you could have millions of users. You could serve them targeted offers, and maybe charge for premium features. The danger of an idea like this is that when you run it by your friends with pets, they don't say I would never use this. They say Yeah, maybe I could see using something like that. Even when the startup launches, it will sound plausible to a lot of people. They don't want to use it themselves, at least not right now, but they could imagine other people wanting it. Sum that reaction across the entire population, and you have zero users. Well When a startup launches, there have to be at least some users who really need what they're making not just people who could see themselves using it one day, but who want it urgently. Usually this initial group of users is small, for the simple reason that if there were something that large numbers of people urgently needed and that could be built with the amount of effort a startup usually puts into a version one, it would probably already exist. Which means you have to compromise on one dimension: you can either build something a large number of people want a small amount, or something a small number of people want a large amount. Choose the latter. Not all ideas of that type are good startup ideas, but nearly all good startup ideas are of that type. Imagine a graph whose x axis represents all the people who might want what you're making and whose y axis represents how much they want it. If you invert the scale on the y axis, you can envision companies as holes. Google is an immense crater: hundreds of millions of people use it, and they need it a lot. A startup just starting out can't expect to excavate that much volume. So you have two choices about the shape of hole you start with. You can",5,4,4
What do users care about in a product?,Whether the product does what they want.,"In fact, one of the most striking things about startups is the degree to which you win by simply doing good work. There are edge cases, as there are in anything, but in general you win by getting users, and what users care about is whether the product does what they want.","launch that would get them exposure. They needed influential people to talk about them. They even knew they needed to launch on a tuesday, because that's when one gets the most attention. No, I would explain, that is not how to get lots of users. The way you get lots of users is to make the product really great. Then people will not only use it but recommend it to their friends, so your growth will be exponential once you get it started. At this point I've told the founders something you'd think would be completely obvious: that they should make a good company by making a good product. And yet their reaction would be something like the reaction many physicists must have had when they first heard about the theory of relativity: a mixture of astonishment at its apparent genius, combined with a suspicion that anything so weird couldn't possibly be right. Ok, they would say, dutifully. And could you introduce us to such-and-such influential person? And remember, we want to launch on Tuesday. It would sometimes take founders years to grasp these simple lessons. And not because they were lazy or stupid. They just seemed blind to what was right in front of them. Why, I would ask myself, do they always make things so complicated? And then one day I realized this was not a rhetorical question. Why did founders tie themselves in knots doing the wrong things when the answer was right in front of them? Because that was what they'd been trained to do. Their education had taught them that the way to win was to hack the test. And without even telling them they were being trained to do this. The younger ones, the recent graduates, had never faced a non-artificial test. They thought this was just how the world worked: that the first thing you did, when facing any kind of challenge, was to figure out what the trick was for hacking the test. That's why the conversation would always start with how to raise money, because that read as the test. It came at the end of YC. It had numbers attached to it, and higher numbers seemed to be better. It must be the test. There are certainly big chunks of the world where the way to win is to hack the test. This phenomenon isn't limited to schools. And some people, either due to ideology or ignorance, claim that this is true of startups too. But it isn't. In fact, one of the most striking things about startups is the degree to which you win by simply doing good work. There are edge cases, as there are in anything, but in general you win by getting users, and what users care about is whether the product does what they want. Why did it take me so long to understand why founders made startups overcomplicated? Because I hadn't realized explicitly that schools train us to win by hacking bad tests. And",5,4,5
What do big companies typically struggle with in terms of product development?,"Big companies are good at extracting the value from existing products, but bad at creating new ones.","Big companies are good at extracting the value from existing products, but bad at creating new ones.","over the heads of organizations, directly to the users. Any company that hires you is, economically, acting as a proxy for the customer. The rate at which they value you (though they may not consciously realize it) is an attempt to guess your value to the user. But there's a way to appeal their judgement. If you want, you can opt to be valued directly by users, by starting your own company. The market is a lot more discerning than any employer. And it is completely non-discriminatory. On the Internet, nobody knows you're a dog. And more to the point, nobody knows you're 22. All users care about is whether your site or software gives them what they want. They don't care if the person behind it is a high school kid. If you're really productive, why not make employers pay market rate for you? Why go work as an ordinary employee for a big company, when you could start a startup and make them buy it to get you? When most people hear the word startup, they think of the famous ones that have gone public. But most startups that succeed do it by getting bought. And usually the acquirer doesn't just want the technology, but the people who created it as well. Often big companies buy startups before they're profitable. Obviously in such cases they're not after revenues. What they want is the development team and the software they've built so far. When a startup gets bought for 2 or 3 million six months in, it's really more of a hiring bonus than an acquisition. I think this sort of thing will happen more and more, and that it will be better for everyone. It's obviously better for the people who start the startup, because they get a big chunk of money up front. But I think it will be better for the acquirers too. The central problem in big companies, and the main reason they're so much less productive than small companies, is the difficulty of valuing each person's work. Buying larval startups solves that problem for them: the acquirer doesn't pay till the developers have proven themselves. Acquirers are protected on the downside, but still get most of the upside. Product Development Buying startups also solves another problem afflicting big companies: they can't do product development. Big companies are good at extracting the value from existing products, but bad at creating new ones. Why? It's worth studying this phenomenon in detail, because this is the raison d'etre of startups. To start with, most big companies have some kind of turf to protect, and this tends to warp their development decisions. For example, Web-based applications are hot now, but within Microsoft there must be a lot of ambivalence about them, because the very idea of Web-based software threatens the desktop. So any Web-based application that Microsoft ends up with, will probably, like Hotmail, be something developed outside the company. Another reason big companies are bad at developing",5,4,4
"What percentage of American kids attend private, non-sectarian schools?",about 1.7%,"According to a 2002 report by the National Center for Education Statistics, about 1.7% of American kids attend private, non-sectarian schools.","was a special recipient of favour, being offered large bribes by the Dutch not to make peace with Spain, and large bribes by Spain to make peace. Though Balzac made a lot of money from writing, he was notoriously improvident and was troubled by debts all his life. A Timex will gain or lose about .5 seconds per day. The most accurate mechanical watch, the Patek Philippe 10 Day Tourbillon, is rated at -1.5 to +2 seconds. Its retail price is about $220,000. If asked to choose which was more expensive, a well-preserved 1989 Lincoln Town Car ten-passenger limousine ($5,000) or a 2004 Mercedes S600 sedan ($122,000), the average Edwardian might well guess wrong. To say anything meaningful about income trends, you have to talk about real income, or income as measured in what it can buy. But the usual way of calculating real income ignores much of the growth in wealth over time, because it depends on a consumer price index created by bolting end to end a series of numbers that are only locally accurate, and that don't include the prices of new inventions until they become so common that their prices stabilize. So while we might think it was very much better to live in a world with antibiotics or air travel or an electric power grid than without, real income statistics calculated in the usual way will prove to us that we are only slightly richer for having these things. Another approach would be to ask, if you were going back to the year x in a time machine, how much would you have to spend on trade goods to make your fortune? For example, if you were going back to 1970 it would certainly be less than $500, because the processing power you can get for $500 today would have been worth at least $150 million in 1970. The function goes asymptotic fairly quickly, because for times over a hundred years or so you could get all you needed in present-day trash. In 1800 an empty plastic drink bottle with a screw top would have seemed a miracle of workmanship. Some will say this amounts to the same thing, because the rich have better opportunities for education. That's a valid point. It is still possible, to a degree, to buy your kids' way into top colleges by sending them to private schools that in effect hack the college admissions process. According to a 2002 report by the National Center for Education Statistics, about 1.7% of American kids attend private, non-sectarian schools. At Princeton, 36% of the class of 2007 came from such schools. (Interestingly, the number at Harvard is significantly lower, about 28%.) Obviously this is a huge loophole. It does at least seem to be closing, not widening. Perhaps the designers of admissions processes should take a lesson from the example of computer security, and instead of just assuming that their system can't be hacked, measure the degree to which it is Mind the",5,4,5
What is the predicted increase in computer speed according to Moore's Law?,"74 quintillion (73,786,976,294,838,206,464) times faster.","If Moore's Law continues to put out, they will be 74 quintillion (73,786,976,294,838,206,464) times faster.","chosen, but that there be few of them. Mathematicians have always felt this way about axioms-- the fewer, the better-- and I think they're onto something. At the very least, it has to be a useful exercise to look closely at the core of a language to see if there are any axioms that could be weeded out. I've found in my long career as a slob that cruft breeds cruft, and I've seen this happen in software as well as under beds and in the corners of rooms. I have a hunch that the main branches of the evolutionary tree pass through the languages that have the smallest, cleanest cores. The more of a language you can write in itself, the better. Of course, I'm making a big assumption in even asking what programming languages will be like in a hundred years. Will we even be writing programs in a hundred years? Won't we just tell computers what we want them to do? There hasn't been a lot of progress in that department so far. My guess is that a hundred years from now people will still tell computers what to do using programs we would recognize as such. There may be tasks that we solve now by writing programs and which in a hundred years you won't have to write programs to solve, but I think there will still be a good deal of programming of the type that we do today. It may seem presumptuous to think anyone can predict what any technology will look like in a hundred years. But remember that we already have almost fifty years of history behind us. Looking forward a hundred years is a graspable idea when we consider how slowly languages have evolved in the past fifty. Languages evolve slowly because they're not really technologies. Languages are notation. A program is a formal description of the problem you want a computer to solve for you. So the rate of evolution in programming languages is more like the rate of evolution in mathematical notation than, say, transportation or communications. Mathematical notation does evolve, but not with the giant leaps you see in technology. Whatever computers are made of in a hundred years, it seems safe to predict they will be much faster than they are now. If Moore's Law continues to put out, they will be 74 quintillion (73,786,976,294,838,206,464) times faster. That's kind of hard to imagine. And indeed, the most likely prediction in the speed department may be that Moore's Law will stop working. Anything that is supposed to double every eighteen months seems likely to run up against some kind of fundamental limit eventually. But I have no trouble believing that computers will be very much faster. Even if they only end up being a paltry million times faster, that should change the ground rules for programming languages substantially. Among other things, there will be more room for what would now be considered slow languages, meaning languages that don't",5,4,4
What do super-angels focus on when investing in startups?,Super-angels focus on getting the right valuations instead of the right companies.,"So I think at least some super-angels are looking for companies that will get bought. That's the only rational explanation for focusing on getting the right valuations, instead of the right companies.","not a problem for the startups; by definition a high valuation means enough investors were willing to accept it. But it was mysterious to me that the super-angels would quibble about valuations. Did they not understand that the big returns come from a few big successes, and that it therefore mattered far more which startups you picked than how much you paid for them? After thinking about it for a while and observing certain other signs, I have a theory that explains why the super-angels may be smarter than they seem. It would make sense for super-angels to want low valuations if they're hoping to invest in startups that get bought early. If you're hoping to hit the next Google, you shouldn't care if the valuation is 20 million. But if you're looking for companies that are going to get bought for 30 million, you care. If you invest at 20 and the company gets bought for 30, you only get 1.5x. You might as well buy Apple. So if some of the super-angels were looking for companies that could get acquired quickly, that would explain why they'd care about valuations. But why would they be looking for those? Because depending on the meaning of """"quickly,"""" it could actually be very profitable. A company that gets acquired for 30 million is a failure to a VC, but it could be a 10x return for an angel, and moreover, a quick 10x return. Rate of return is what matters in investing not the multiple you get, but the multiple per year. If a super-angel gets 10x in one year, that's a higher rate of return than a VC could ever hope to get from a company that took 6 years to go public. To get the same rate of return, the VC would have to get a multiple of 10^6â€”one million x. Even Google didn't come close to that. So I think at least some super-angels are looking for companies that will get bought. That's the only rational explanation for focusing on getting the right valuations, instead of the right companies. And if so they'll be different to deal with than VCs. They'll be tougher on valuations, but more accommodating if you want to sell early. Prognosis Who will win, the super-angels or the VCs? I think the answer to that is, some of each. They'll each become more like one another. The super-angels will start to invest larger amounts, and the VCs will gradually figure out ways to make more, smaller investments faster. A decade from now the players will be hard to tell apart, and there will probably be survivors from each group. What does that mean for founders? One thing it means is that the high valuations startups are presently getting may not last forever. To the extent that valuations are being driven up by price-insensitive VCs, they'll fall again if VCs become more like super-angels and start to become more miserly about valuations. Fortunately if this does",4,4,4
Why do startups often avoid direct competition with big companies?,Startups rarely attack big companies head-on; they beat established companies by transcending them.,"The second reason patents don't count for much in our world is that startups rarely attack big companies head-on, the way Reveal did.","bad at it, and there's something very tangible they're good or bad at. The reason design counts so much in software is probably that there are fewer constraints than on physical things. Building physical things is expensive and dangerous. The space of possible choices is smaller; you tend to have to work as part of a larger group; and you're subject to a lot of regulations. You don't have any of that if you and a couple friends decide to create a new web-based application. Because there's so much scope for design in software, a successful application tends to be way more than the sum of its patents. What protects little companies from being copied by bigger competitors is not just their patents, but the thousand little things the big company will get wrong if they try. The second reason patents don't count for much in our world is that startups rarely attack big companies head-on, the way Reveal did. In the software business, startups beat established companies by transcending them. Startups don't build desktop word processing programs to compete with Microsoft Word. They build Writely. If this paradigm is crowded, just wait for the next one; they run pretty frequently on this route. Fortunately for startups, big companies are extremely good at denial. If you take the trouble to attack them from an oblique angle, they'll meet you half-way and maneuver to keep you in their blind spot. To sue a startup would mean admitting it was dangerous, and that often means seeing something the big company doesn't want to see. IBM used to sue its mainframe competitors regularly, but they didn't bother much about the microcomputer industry because they didn't want to see the threat it posed. Companies building web based apps are similarly protected from Microsoft, which even now doesn't want to imagine a world in which Windows is irrelevant. The third reason patents don't seem to matter very much in software is public opinion-- or rather, hacker opinion. In a recent interview, Steve Ballmer coyly left open the possibility of attacking Linux on patent grounds. But I doubt Microsoft would ever be so stupid. They'd face the mother of all boycotts. And not just from the technical community in general; a lot of their own people would rebel. Good hackers care a lot about matters of principle, and they are highly mobile. If a company starts misbehaving, smart people won't work there. For some reason this seems to be more true in software than other businesses. I don't think it's because hackers have intrinsically higher principles so much as that their skills are easily transferrable. Perhaps we can split the difference and say that mobility gives hackers the luxury of being principled. Google's don't be evil policy may for this reason be the most valuable thing they've discovered. It's very constraining in some ways. If Google does do something evil, they get doubly whacked for it: once for whatever they did, and again for hypocrisy. But",5,4,5
What is the main tradeoff when rehearsing a prewritten speech?,The tradeoff is between smoothness and ideas.,But here again there's a tradeoff between smoothness and ideas.,"and halting by comparison. Afterward I put my talk online like I usually do. As I was doing it I tried to imagine what a transcript of the other guy's talk would be like, and it was only then I realized he hadn't said very much. Maybe this would have been obvious to someone who knew more about speaking, but it was a revelation to me how much less ideas mattered in speaking than writing. A few years later I heard a talk by someone who was not merely a better speaker than me, but a famous speaker. Boy was he good. So I decided I'd pay close attention to what he said, to learn how he did it. After about ten sentences I found myself thinking I don't want to be a good speaker. Being a really good speaker is not merely orthogonal to having good ideas, but in many ways pushes you in the opposite direction. For example, when I give a talk, I usually write it out beforehand. I know that's a mistake; I know delivering a prewritten talk makes it harder to engage with an audience. The way to get the attention of an audience is to give them your full attention, and when you're delivering a prewritten talk, your attention is always divided between the audience and the talk â€” even if you've memorized it. If you want to engage an audience, it's better to start with no more than an outline of what you want to say and ad lib the individual sentences. But if you do that, you might spend no more time thinking about each sentence than it takes to say it. Occasionally the stimulation of talking to a live audience makes you think of new things, but in general this is not going to generate ideas as well as writing does, where you can spend as long on each sentence as you want. If you rehearse a prewritten speech enough, you can get asymptotically close to the sort of engagement you get when speaking ad lib. Actors do. But here again there's a tradeoff between smoothness and ideas. All the time you spend practicing a talk, you could instead spend making it better. Actors don't face that temptation, except in the rare cases where they've written the script, but any speaker does. Before I give a talk I can usually be found sitting in a corner somewhere with a copy printed out on paper, trying to rehearse it in my head. But I always end up spending most of the time rewriting it instead. Every talk I give ends up being given from a manuscript full of things crossed out and rewritten. Which of course makes me um even more, because I haven't had any time to practice the new bits. Depending on your audience, there are even worse tradeoffs than these. Audiences like to be flattered; they like jokes; they like to be swept off their feet by a vigorous",5,4,4
What is one of the most important principles in Silicon Valley?,You make what you measure.,One of the most important principles in Silicon Valley is that you make what you measure.,"because you can't pay the bill, it doesn't make any difference what Larry Page's net worth is compared to yours. He might only be a few times richer than you, and it would still be just as much of a problem that your water was getting turned off. Closely related to poverty is lack of social mobility. I've seen this myself: you don't have to grow up rich or even upper middle class to get rich as a startup founder, but few successful founders grew up desperately poor. But again, the problem here is not simply economic inequality. There is an enormous difference in wealth between the household Larry Page grew up in and that of a successful startup founder, but that didn't prevent him from joining their ranks. It's not economic inequality per se that's blocking social mobility, but some specific combination of things that go wrong when kids grow up sufficiently poor. One of the most important principles in Silicon Valley is that you make what you measure. It means that if you pick some number to focus on, it will tend to improve, but that you have to choose the right number, because only the one you choose will improve; another that seems conceptually adjacent might not. For example, if you're a university president and you decide to focus on graduation rates, then you'll improve graduation rates. But only graduation rates, not how much students learn. Students could learn less, if to improve graduation rates you made classes easier. Economic inequality is sufficiently far from identical with the various problems that have it as a symptom that we'll probably only hit whichever of the two we aim at. If we aim at economic inequality, we won't fix these problems. So I say let's aim at the problems. For example, let's attack poverty, and if necessary damage wealth in the process. That's much more likely to work than attacking wealth in the hope that you will thereby fix poverty. And if there are people getting rich by tricking consumers or lobbying the government for anti-competitive regulations or tax loopholes, then let's stop them. Not because it's causing economic inequality, but because it's stealing. If all you have is statistics, it seems like that's what you need to fix. But behind a broad statistical measure like economic inequality there are some things that are good and some that are bad, some that are historical trends with immense momentum and others that are random accidents. If we want to fix the world behind the statistics, we have to understand it, and focus our efforts where they'll do the most good. Particularly since economic inequality is a matter of outliers, and outliers are disproportionately likely to have gotten where they are by ways that have little do with the sort of things economists usually think about, like wages and productivity, but rather by, say, ending up on the wrong side of the """"War on Drugs."""" Determination is the most important factor",5,4,4
What quality does Robert possess that is described as almost superhuman?,He has an almost superhuman integrity.,He has an almost superhuman integrity.,"be suitable for real hacking. It's wrong to call it a trick in his case, though. If it were a conscious trick, he would have slipped in a moment of excitement. With Robert this quality is wired-in. He has an almost superhuman integrity. He's not just generally correct, but also correct about how correct he is. You'd think it would be such a great thing never to be wrong that everyone would do this. It doesn't seem like that much extra work to pay as much attention to the error on an idea as to the idea itself. And yet practically no one does. I know how hard it is, because since meeting Robert I've tried to do in software what he seems to do in hardware. P. G. Wodehouse: People are finally starting to admit that Wodehouse was a great writer. If you want to be thought a great novelist in your own time, you have to sound intellectual. If what you write is popular, or entertaining, or funny, you're ipso facto suspect. That makes Wodehouse doubly impressive, because it meant that to write as he wanted to, he had to commit to being despised in his own lifetime. Evelyn Waugh called him a great writer, but to most people at the time that would have read as a chivalrous or deliberately perverse gesture. At the time any random autobiographical novel by a recent college grad could count on more respectful treatment from the literary establishment. Wodehouse may have begun with simple atoms, but the way he composed them into molecules was near faultless. His rhythm in particular. It makes me self-conscious to write about it. I can think of only two other writers who came near him for style: Evelyn Waugh and Nancy Mitford. Those three used the English language like they owned it. But Wodehouse has something neither of them did. He's at ease. Evelyn Waugh and Nancy Mitford cared what other people thought of them: he wanted to seem aristocratic; she was afraid she wasn't smart enough. But Wodehouse didn't give a damn what anyone thought of him. He wrote exactly what he wanted. Alexander Calder: Calder's on this list because he makes me happy. Can his work stand up to Leonardo's? Probably not. There might not be anything from the 20th Century that can. But what was good about Modernism, Calder had, and had in a way that he made seem effortless. What was good about Modernism was its freshness. Art became stuffy in the nineteenth century. The paintings that were popular at the time were mostly the art equivalent of McMansionsâ€”big, pretentious, and fake. Modernism meant starting over, making things with the same earnest motives that children might. The artists who benefited most from this were the ones who had preserved a child's confidence, like Klee and Calder. Klee was impressive because he could work in so many different styles. But between the two I like Calder better, because his work seemed happier. Ultimately",5,4,4
What is a distinctive feature of successful startups?,They're not tightly constrained in reaching and serving customers.,The distinctive feature of successful startups is that they're not.,"people want, and (b) reach and serve all those people. Barbershops are doing fine in the (a) department. Almost everyone needs their hair cut. The problem for a barbershop, as for any retail establishment, is (b). A barbershop serves customers in person, and few will travel far for a haircut. And even if they did, the barbershop couldn't accomodate them. Writing software is a great way to solve (b), but you can still end up constrained in (a). If you write software to teach Tibetan to Hungarian speakers, you'll be able to reach most of the people who want it, but there won't be many of them. If you make software to teach English to Chinese speakers, however, you're in startup territory. Most businesses are tightly constrained in (a) or (b). The distinctive feature of successful startups is that they're not. Ideas: It might seem that it would always be better to start a startup than an ordinary business. If you're going to start a company, why not start the type with the most potential? The catch is that this is a (fairly) efficient market. If you write software to teach Tibetan to Hungarians, you won't have much competition. If you write software to teach English to Chinese speakers, you'll face ferocious competition, precisely because that's such a larger prize. The constraints that limit ordinary companies also protect them. That's the tradeoff. If you start a barbershop, you only have to compete with other local barbers. If you start a search engine you have to compete with the whole world. The most important thing that the constraints on a normal business protect it from is not competition, however, but the difficulty of coming up with new ideas. If you open a bar in a particular neighborhood, as well as limiting your potential and protecting you from competitors, that geographic constraint also helps define your company. Bar + neighborhood is a sufficient idea for a small business. Similarly for companies constrained in (a). Your niche both protects and defines you. Whereas if you want to start a startup, you're probably going to have to think of something fairly novel. A startup has to make something it can deliver to a large market, and ideas of that type are so valuable that all the obvious ones are already taken. That space of ideas has been so thoroughly picked over that a startup generally has to work on something everyone else has overlooked. I was going to write that one has to make a conscious effort to find ideas everyone else has overlooked. But that's not how most startups get started. Usually successful startups happen because the founders are sufficiently different from other people that ideas few others can see seem obvious to them. Perhaps later they step back and notice they've found an idea in everyone else's blind spot, and from that point make a deliberate effort to stay there. But at the moment when successful startups get started, much of the",5,5,5
Why do parents tend to be more conservative for their kids?,Parents end up sharing more of their kids' ill fortune than good fortune.,Parents end up sharing more of their kids' ill fortune than good fortune.,"to do most of the time is work. But you never have to pretend to. If you took a nap in your office in a big company, it would seem unprofessional. But if you're starting a startup and you fall asleep in the middle of the day, your cofounders will just assume you were tired. 15. Parents want you to be a doctor A significant number of would-be startup founders are probably dissuaded from doing it by their parents. I'm not going to say you shouldn't listen to them. Families are entitled to their own traditions, and who am I to argue with them? But I will give you a couple reasons why a safe career might not be what your parents really want for you. One is that parents tend to be more conservative for their kids than they would be for themselves. This is actually a rational response to their situation. Parents end up sharing more of their kids' ill fortune than good fortune. Most parents don't mind this; it's part of the job; but it does tend to make them excessively conservative. And erring on the side of conservatism is still erring. In almost everything, reward is proportionate to risk. So by protecting their kids from risk, parents are, without realizing it, also protecting them from rewards. If they saw that, they'd want you to take more risks. The other reason parents may be mistaken is that, like generals, they're always fighting the last war. If they want you to be a doctor, odds are it's not just because they want you to help the sick, but also because it's a prestigious and lucrative career. But not so lucrative or prestigious as it was when their opinions were formed. When I was a kid in the seventies, a doctor was the thing to be. There was a sort of golden triangle involving doctors, Mercedes 450SLs, and tennis. All three vertices now seem pretty dated. The parents who want you to be a doctor may simply not realize how much things have changed. Would they be that unhappy if you were Steve Jobs instead? So I think the way to deal with your parents' opinions about what you should do is to treat them like feature requests. Even if your only goal is to please them, the way to do that is not simply to give them what they ask for. Instead think about why they're asking for something, and see if there's a better way to give them what they need. 16. A job is the default This leads us to the last and probably most powerful reason people get regular jobs: it's the default thing to do. Defaults are enormously powerful, precisely because they operate without any conscious choice. To almost everyone except criminals, it seems an axiom that if you need money, you should get a job. Actually this tradition is not much more than a hundred years old. Before that, the default way to",5,4,4
What is a common cause of startup failure?,Running out of money or a critical founder bailing.,"When startups die, the official cause of death is always either running out of money or a critical founder bailing.","as it sounds. You've probably noticed that having dinners every Tuesday with us and the other founders causes you to get more done than you would otherwise, because every dinner is a mini Demo Day. Every dinner is a kind of a deadline. So the mere constraint of staying in regular contact with us will push you to make things happen, because otherwise you'll be embarrassed to tell us that you haven't done anything new since the last time we talked. If this works, it would be an amazing hack. It would be pretty cool if merely by staying in regular contact with us you could get rich. It sounds crazy, but there's a good chance that would work. A variant is to stay in touch with other YC-funded startups. There is now a whole neighborhood of them in San Francisco. If you move there, the peer pressure that made you work harder all summer will continue to operate. When startups die, the official cause of death is always either running out of money or a critical founder bailing. Often the two occur simultaneously. But I think the underlying cause is usually that they've become demoralized. You rarely hear of a startup that's working around the clock doing deals and pumping out new features, and dies because they can't pay their bills and their ISP unplugs their server. Startups rarely die in mid keystroke. So keep typing! If so many startups get demoralized and fail when merely by hanging on they could get rich, you have to assume that running a startup can be demoralizing. That is certainly true. I've been there, and that's why I've never done another startup. The low points in a startup are just unbelievably low. I bet even Google had moments where things seemed hopeless. Knowing that should help. If you know it's going to feel terrible sometimes, then when it feels terrible you won't think ouch, this feels terrible, I give up. It feels that way for everyone. And if you just hang on, things will probably get better. The metaphor people use to describe the way a startup feels is at least a roller coaster and not drowning. You don't just sink and sink; there are ups after the downs. Another feeling that seems alarming but is in fact normal in a startup is the feeling that what you're doing isn't working. The reason you can expect to feel this is that what you do probably won't work. Startups almost never get it right the first time. Much more commonly you launch something, and no one cares. Don't assume when this happens that you've failed. That's normal for startups. But don't sit around doing nothing. Iterate. I like Paul Buchheit's suggestion of trying to make something that at least someone really loves. As long as you've made something that a few users are ecstatic about, you're on the right track. It will be good for your morale to have even a handful of",5,4,5
Why do patents play a small role in software?,One reason is that software is so complicated that patents by themselves are not worth very much.,Why do patents play so small a role in software? I can think of three possible reasons. One is that software is so complicated that patents by themselves are not worth very much.,"buying to building: that if they built their own, they'd screw it up. But few big companies are smart enough yet to admit this to themselves. It's usually the acquirer's engineers who are asked how hard it would be for the company to build their own, and they overestimate their abilities. A patent seems to change the balance. It gives the acquirer an excuse to admit they couldn't copy what you're doing. It may also help them to grasp what's special about your technology. Frankly, it surprises me how small a role patents play in the software business. It's kind of ironic, considering all the dire things experts say about software patents stifling innovation, but when one looks closely at the software business, the most striking thing is how little patents seem to matter. In other fields, companies regularly sue competitors for patent infringement. For example, the airport baggage scanning business was for many years a cozy duopoly shared between two companies, InVision and L-3. In 2002 a startup called Reveal appeared, with new technology that let them build scanners a third the size. They were sued for patent infringement before they'd even released a product. You rarely hear that kind of story in our world. The one example I've found is, embarrassingly enough, Yahoo, which filed a patent suit against a gaming startup called Xfire in 2005. Xfire doesn't seem to be a very big deal, and it's hard to say why Yahoo felt threatened. Xfire's VP of engineering had worked at Yahoo on similar stuff-- in fact, he was listed as an inventor on the patent Yahoo sued over-- so perhaps there was something personal about it. My guess is that someone at Yahoo goofed. At any rate they didn't pursue the suit very vigorously. Why do patents play so small a role in software? I can think of three possible reasons. One is that software is so complicated that patents by themselves are not worth very much. I may be maligning other fields here, but it seems that in most types of engineering you can hand the details of some new technique to a group of medium-high quality people and get the desired result. For example, if someone develops a new process for smelting ore that gets a better yield, and you assemble a team of qualified experts and tell them about it, they'll be able to get the same yield. This doesn't seem to work in software. Software is so subtle and unpredictable that qualified experts don't get you very far. That's why we rarely hear phrases like qualified expert in the software business. What that level of ability can get you is, say, to make your software compatible with some other piece of software-- in eight months, at enormous cost. To do anything harder you need individual brilliance. If you assemble a team of qualified experts and tell them to make a new web-based email program, they'll get their asses kicked by a team of",5,4,4
When does Y Combinator fund startups?,"Y Combinator funds startups twice a year, in January and June.","Y Combinator funds startups twice a year, in January and June.","code written while you were still employed in your previous job, or (b) get your employer to renounce, in writing, any claim to the code you write for your side project. Many will consent to (b) rather than lose a prized employee. The downside is that you'll have to tell them exactly what your project does. Geshke and Warnock only founded Adobe because Xerox ignored them. If Xerox had used what they built, they would probably never have left PARC. In a few days it will be Demo Day, when the startups we funded this summer present to investors. Y Combinator funds startups twice a year, in January and June. Ten weeks later we invite all the investors we know to hear them present what they've built so far. Ten weeks is not much time. The average startup probably doesn't have much to show for itself after ten weeks. But the average startup fails. When you look at the ones that went on to do great things, you find a lot that began with someone pounding out a prototype in a week or two of nonstop work. Startups are a counterexample to the rule that haste makes waste. (Too much money seems to be as bad for startups as too much time, so we don't give them much money either.) A week before Demo Day, we have a dress rehearsal called Rehearsal Day. At other Y Combinator events we allow outside guests, but not at Rehearsal Day. No one except the other founders gets to see the rehearsals. The presentations on Rehearsal Day are often pretty rough. But this is to be expected. We try to pick founders who are good at building things, not ones who are slick presenters. Some of the founders are just out of college, or even still in it, and have never spoken to a group of people they didn't already know. So we concentrate on the basics. On Demo Day each startup will only get ten minutes, so we encourage them to focus on just two goals: (a) explain what you're doing, and (b) explain why users will want it. That might sound easy, but it's not when the speakers have no experience presenting, and they're explaining technical matters to an audience that's mostly non-technical. This situation is constantly repeated when startups present to investors: people who are bad at explaining, talking to people who are bad at understanding. Practically every successful startup, including stars like Google, presented at some point to investors who didn't get it and turned them down. Was it because the founders were bad at presenting, or because the investors were obtuse? It's probably always some of both. At the most recent Rehearsal Day, we four Y Combinator partners found ourselves saying a lot of the same things we said at the last two. So at dinner afterward we collected all our tips about presenting to investors. Most startups face similar challenges, so we hope these will be useful to",5,4,4
What is the medium of exchange that has been commonly used recently?,the dollar,"Historically metals have been the most common, but recently we've been using a medium of exchange, called the dollar, that doesn't physically exist.","unless you plan to get rich by counterfeiting, talking about making money can make it harder to understand how to make money. Money is a side effect of specialization. In a specialized society, most of the things you need, you can't make for yourself. If you want a potato or a pencil or a place to live, you have to get it from someone else. How do you get the person who grows the potatoes to give you some? By giving him something he wants in return. But you can't get very far by trading things directly with the people who need them. If you make violins, and none of the local farmers wants one, how will you eat? The solution societies find, as they get more specialized, is to make the trade into a two-step process. Instead of trading violins directly for potatoes, you trade violins for, say, silver, which you can then trade again for anything else you need. The intermediate stuff-- the medium of exchange-- can be anything that's rare and portable. Historically metals have been the most common, but recently we've been using a medium of exchange, called the dollar, that doesn't physically exist. It works as a medium of exchange, however, because its rarity is guaranteed by the U.S. Government. The advantage of a medium of exchange is that it makes trade work. The disadvantage is that it tends to obscure what trade really means. People think that what a business does is make money. But money is just the intermediate stage-- just a shorthand-- for whatever people want. What most businesses really do is make wealth. They do something people want. A surprising number of people retain from childhood the idea that there is a fixed amount of wealth in the world. There is, in any normal family, a fixed amount of money at any moment. But that's not the same thing. When wealth is talked about in this context, it is often described as a pie. You can't make the pie larger, say politicians. When you're talking about the amount of money in one family's bank account, or the amount available to a government from one year's tax revenue, this is true. If one person gets more, someone else has to get less. I can remember believing, as a child, that if a few rich people had all the money, it left less for everyone else. Many people seem to continue to believe something like this well into adulthood. This fallacy is usually there in the background when you hear someone talking about how x percent of the population have y percent of the wealth. If you plan to start a startup, then whether you realize it or not, you're planning to disprove the Pie Fallacy. What leads people astray here is the abstraction of money. Money is not wealth. It's just something we use to move wealth around. So although there may be, in certain specific moments (like your family, this month)",5,4,5
Why do patents play a small role in software?,One reason is that software is so complicated that patents by themselves are not worth very much.,One is that software is so complicated that patents by themselves are not worth very much.,"At any rate they didn't pursue the suit very vigorously. Why do patents play so small a role in software? I can think of three possible reasons. One is that software is so complicated that patents by themselves are not worth very much. I may be maligning other fields here, but it seems that in most types of engineering you can hand the details of some new technique to a group of medium-high quality people and get the desired result. For example, if someone develops a new process for smelting ore that gets a better yield, and you assemble a team of qualified experts and tell them about it, they'll be able to get the same yield. This doesn't seem to work in software. Software is so subtle and unpredictable that qualified experts don't get you very far. That's why we rarely hear phrases like qualified expert in the software business. What that level of ability can get you is, say, to make your software compatible with some other piece of software-- in eight months, at enormous cost. To do anything harder you need individual brilliance. If you assemble a team of qualified experts and tell them to make a new web-based email program, they'll get their asses kicked by a team of inspired nineteen year olds. Experts can implement, but they can't design. Or rather, expertise in implementation is the only kind most people, including the experts themselves, can measure. But design is a definite skill. It's not just an airy intangible. Things always seem intangible when you don't understand them. Electricity seemed an airy intangible to most people in 1800. Who knew there was so much to know about it? So it is with design. Some people are good at it and some people are bad at it, and there's something very tangible they're good or bad at. The reason design counts so much in software is probably that there are fewer constraints than on physical things. Building physical things is expensive and dangerous. The space of possible choices is smaller; you tend to have to work as part of a larger group; and you're subject to a lot of regulations. You don't have any of that if you and a couple friends decide to create a new web-based application. Because there's so much scope for design in software, a successful application tends to be way more than the sum of its patents. What protects little companies from being copied by bigger competitors is not just their patents, but the thousand little things the big company will get wrong if they try. The second reason patents don't count for much in our world is that startups rarely attack big companies head-on, the way Reveal did. In the software business, startups beat established companies by transcending them. Startups don't build desktop word processing programs to compete with Microsoft Word. They build Writely. If this paradigm is crowded, just wait for the next one; they run pretty frequently on this",5,4,4
What should founders assume about an investor's interest until they get a definite commitment?,Founders should assume the worst that an investor is just feigning interest.,The solution for this is to assume the worst that an investor is just feigning interest â€” until you get a definite commitment.,"because they suit investors' interests. One YC founder who read a draft of this essay wrote: This is the most important section. I think it might bear stating even more clearly. Investors will deliberately affect more interest than they have to preserve optionality. If an investor seems very interested in you, they still probably won't invest. The solution for this is to assume the worst that an investor is just feigning interest â€” until you get a definite commitment. Though you should probably pack investor meetings as closely as you can, Jeff Byun mentions one reason not to: if you pack investor meetings too closely, you'll have less time for your pitch to evolve. Some founders deliberately schedule a handful of lame investors first, to get the bugs out of their pitch. There is not an efficient market in this respect. Some of the most useless investors are also the highest maintenance. Incidentally, this paragraph is sales 101. If you want to see I know one very smooth founder who used to end investor meetings with """"So, can I count you in? delivered as if it were """"Can you pass the salt? Unless you're very smooth (if you're not sure...), do not do this yourself. There is nothing more unconvincing, for an investor, than a nerdy founder trying to deliver the lines meant for a smooth one. Investors are fine with funding nerds. So if you're a nerd, just try to be a good nerd, rather than doing a bad imitation of a smooth salesman. Ian Hogarth suggests a good way to tell how serious potential investors are: the resources they expend on you after the first meeting. An investor who's seriously interested will already be working to help you even before they've committed. In principle you might have to think about so-called signalling risk. If a prestigious VC makes a small seed investment in you, what if they don't want to invest the next time you raise money? Other investors might assume that the VC knows you well, since they're an existing investor, and if they don't want to invest in your next round, that must mean you suck. The reason I say in principle is that in practice signalling hasn't been much of a problem so far. It rarely arises, and in the few cases where it does, the startup in question usually is doing badly and is doomed anyway. If you have the luxury of choosing among seed investors, you can play it safe by excluding VC firms. But it isn't critical to. Sometimes a competitor will deliberately threaten you with a lawsuit just as you start fundraising, because they know you'll have to disclose the threat to potential investors and they hope this will make it harder for you to raise money. If this happens it will probably frighten you more than investors. Experienced investors know about this trick, and know the actual lawsuits rarely happen. So if you're attacked in this way, be forthright with",5,4,4
What is a key factor that attracts young people to Pittsburgh?,The neighborhoods they're in.,But the appeal of Pittsburgh is not just the buildings themselves. It's the neighborhoods they're in.,"the Times article said, is cheap housing. That's a big advantage. But that phrase """"cheap housing"""" is a bit misleading. There are plenty of places that are cheaper. What's special about Pittsburgh is not that it's cheap, but that it's a cheap place you'd actually want to live. Part of that is the buildings themselves. I realized a long time ago, back when I was a poor twenty-something myself, that the best deals were places that had once been rich, and then became poor. If a place has always been rich, it's nice but too expensive. If a place has always been poor, it's cheap but grim. But if a place was once rich and then got poor, you can find palaces for cheap. And that's what's bringing people here. When Pittsburgh was rich, a hundred years ago, the people who lived here built big solid buildings. Not always in the best taste, but definitely solid. So here is another piece of advice for becoming a startup hub: don't destroy the buildings that are bringing people here. When cities are on the way back up, like Pittsburgh is now, developers race to tear down the old buildings. Don't let that happen. Focus on historic preservation. Big real estate development projects are not what's bringing the twenty-somethings here. They're the opposite of the new restaurants and cafes; they subtract personality from the city. The empirical evidence suggests you cannot be too strict about historic preservation. The tougher cities are about it, the better they seem to do. But the appeal of Pittsburgh is not just the buildings themselves. It's the neighborhoods they're in. Like San Francisco and New York, Pittsburgh is fortunate in being a pre-car city. It's not too spread out. Because those 25 to 29 year olds do not like driving. They prefer walking, or bicycling, or taking public transport. If you've been to San Francisco recently you can't help noticing the huge number of bicyclists. And this is not just a fad that the twenty-somethings have adopted. In this respect they have discovered a better way to live. The beards will go, but not the bikes. Cities where you can get around without driving are just better period. So I would suggest you do everything you can to capitalize on this. As with historic preservation, it seems impossible to go too far. Why not make Pittsburgh the most bicycle and pedestrian friendly city in the country? See if you can go so far that you make San Francisco seem backward by comparison. If you do, it's very unlikely you'll regret it. The city will seem like a paradise to the young people you want to attract. If they do leave to get jobs elsewhere, it will be with regret at leaving behind such a place. And what's the downside? Can you imagine a headline City ruined by becoming too bicycle-friendly? It just doesn't happen. So suppose cool old neighborhoods and cool little restaurants make this the next Portland.",5,4,4
What are the three general suggestions about hiring?,"(a) don't do it if you can avoid it, (b) pay people with equity rather than salary, and (c) only hire people who are either going to write code or go out and get users.","We have three general suggestions about hiring: (a) don't do it if you can avoid it, (b) pay people with equity rather than salary, not just to save money, but because you want the kind of people who are committed enough to prefer that, and (c) only hire people who are either going to write code or go out and get users, because those are the only things you need at first.","we've funded have. (And not just because we make small investments; many have gone on to raise further rounds.) The classic way to burn through cash is by hiring a lot of people. This bites you twice: in addition to increasing your costs, it slows you down so money that's getting consumed faster has to last longer. Most hackers understand why that happens; Fred Brooks explained it in The Mythical Man-Month. We have three general suggestions about hiring: (a) don't do it if you can avoid it, (b) pay people with equity rather than salary, not just to save money, but because you want the kind of people who are committed enough to prefer that, and (c) only hire people who are either going to write code or go out and get users, because those are the only things you need at first. 13. Raising Too Much Money It's obvious how too little money could kill you, but is there such a thing as having too much? Yes and no. The problem is not so much the money itself as what comes with it. As one VC who spoke at Y Combinator said, Once you take several million dollars of my money, the clock is ticking. If VCs fund you, they're not going to let you just put the money in the bank and keep operating as two guys living on ramen. They want that money to go to work. At the very least you'll move into proper office space and hire more people. That will change the atmosphere, and not entirely for the better. Now most of your people will be employees rather than founders. They won't be as committed; they'll need to be told what to do; they'll start to engage in office politics. When you raise a lot of money, your company moves to the suburbs and has kids. Perhaps more dangerously, once you take a lot of money it gets harder to change direction. Suppose your initial plan was to sell something to companies. After taking VC money you hire a sales force to do that. What happens now if you realize you should be making this for consumers instead of businesses? That's a completely different kind of selling. What happens, in practice, is that you don't realize that. The more people you have, the more you stay pointed in the same direction. Another drawback of large investments is the time they take. The time required to raise money grows with the amount. When the amount rises into the millions, investors get very cautious. VCs never quite say yes or no; they just engage you in an apparently endless conversation. Raising VC scale investments is thus a huge time sink more work, probably, than the startup itself. And you don't want to be spending all your time talking to investors while your competitors are spending theirs building things. We advise founders who go on to seek VC money to take the first reasonable deal they get.",5,4,4
What do large-scale investors prioritize in their investments?,Their portfolio as a whole.,"They don't need any given startup to succeed, like founders do, just their portfolio as a whole to.","probably wouldn't be a competitor funded by the other. Splitting deals thus has similar advantages to confusing paternity. But I think the main reason VCs like splitting deals is the fear of looking bad. If another firm shares the deal, then in the event of failure it will seem to have been a prudent choice a consensus decision, rather than just the whim of an individual partner. 16. Investors collude. Investing is not covered by antitrust law. At least, it better not be, because investors regularly do things that would be illegal otherwise. I know personally of cases where one investor has talked another out of making a competitive offer, using the promise of sharing future deals. In principle investors are all competing for the same deals, but the spirit of cooperation is stronger than the spirit of competition. The reason, again, is that there are so many deals. Though a professional investor may have a closer relationship with a founder he invests in than with other investors, his relationship with the founder is only going to last a couple years, whereas his relationship with other firms will last his whole career. There isn't so much at stake in his interactions with other investors, but there will be a lot of them. Professional investors are constantly trading little favors. Another reason investors stick together is to preserve the power of investors as a whole. So you will not, as of this writing, be able to get investors into an auction for your series A round. They'd rather lose the deal than establish a precedent of VCs competitively bidding against one another. An efficient startup funding market may be coming in the distant future; things tend to move in that direction; but it's certainly not here now. 17. Large-scale investors care about their portfolio, not any individual company. The reason startups work so well is that everyone with power also has equity. The only way any of them can succeed is if they all do. This makes everyone naturally pull in the same direction, subject to differences of opinion about tactics. The problem is, larger scale investors don't have exactly the same motivation. Close, but not identical. They don't need any given startup to succeed, like founders do, just their portfolio as a whole to. So in borderline cases the rational thing for them to do is to sacrifice unpromising startups. Large-scale investors tend to put startups in three categories: successes, failures, and the living dead companies that are plugging along but don't seem likely in the immediate future to get bought or go public. To the founders, living dead sounds harsh. These companies may be far from failures by ordinary standards. But they might as well be from a venture investor's point of view, and they suck up just as much time and attention as the successes. So if such a company has two possible strategies, a conservative one that's slightly more likely to work in the end, or a",5,5,4
What is the patent pledge regarding software patents?,No first use of software patents against companies with less than 25 people.,Here's the pledge: No first use of software patents against companies with less than 25 people.,"are above pulling this sort of trick to pledge publicly not to. Then the ones that won't make such a pledge will be very conspicuous. Potential employees won't want to work for them. And investors, too, will be able to see that they're the sort of company that competes by litigation rather than by making good products. Here's the pledge: No first use of software patents against companies with less than 25 people. I've deliberately traded precision for brevity. The patent pledge is not legally binding. It's like Google's Don't be evil. They don't define what evil is, but by publicly saying that, they're saying they're willing to be held to a standard that, say, Altria is not. And though constraining, Don't be evil has been good for Google. Technology companies win by attracting the most productive people, and the most productive people are attracted to employers who hold themselves to a higher standard than the law requires. The patent pledge is in effect a narrower but open source Don't be evil. I encourage every technology company to adopt it. If you want to help fix patents, encourage your employer to. Already most technology companies wouldn't sink to using patents on startups. You don't see Google or Facebook suing startups for patent infringement. They don't need to. So for the better technology companies, the patent pledge requires no change in behavior. They're just promising to do what they'd do anyway. And when all the companies that won't use patents on startups have said so, the holdouts will be very conspicuous. The patent pledge doesn't fix every problem with patents. It won't stop patent trolls, for example; they're already pariahs. But the problem the patent pledge does fix may be more serious than the problem of patent trolls. Patent trolls are just parasites. A clumsy parasite may occasionally kill the host, but that's not its goal. Whereas companies that sue startups for patent infringement generally do it with explicit goal of keeping their product off the market. Companies that use patents on startups are attacking innovation at the root. Now there's something any individual can do about this problem, without waiting for the government: ask companies where they stand. Patent Pledge Site Because the pledge is deliberately vague, we're going to need common sense when intepreting it. And even more vice versa: the pledge is vague in order to make people use common sense when interpreting it. So for example I've deliberately avoided saying whether the 25 people have to be employees, or whether contractors count too. If a company has to split hairs that fine about whether a suit would violate the patent pledge, it's probably still a dick move. The Patent Pledge Yesterday Fred Wilson published a remarkable post about missing Airbnb. VCs miss good startups all the time, but it's extraordinarily rare for one to talk about it publicly till long afterward. So that post is further evidence what a rare bird Fred is. He's probably the nicest",5,4,4
What is one quality needed to discover new ideas?,independent-mindedness,Another quality you need in order to discover new ideas is independent-mindedness.,"perfect storm for fostering this illusion. Intelligence is much easier to measure than the value of new ideas, and you're constantly being judged by it. Whereas even the kids who will ultimately discover new things aren't usually discovering them yet. For kids that way inclined, intelligence is the only game in town. There are more subtle reasons too, which persist long into adulthood. Intelligence wins in conversation, and thus becomes the basis of the dominance hierarchy. Plus having new ideas is such a new thing historically, and even now done by so few people, that society hasn't yet assimilated the fact that this is the actual destination, and intelligence merely a means to an end. Why do so many smart people fail to discover anything new? Viewed from that direction, the question seems a rather depressing one. But there's another way to look at it that's not just more optimistic, but more interesting as well. Clearly intelligence is not the only ingredient in having new ideas. What are the other ingredients? Are they things we could cultivate? Because the trouble with intelligence, they say, is that it's mostly inborn. The evidence for this seems fairly convincing, especially considering that most of us don't want it to be true, and the evidence thus has to face a stiff headwind. But I'm not going to get into that question here, because it's the other ingredients in new ideas that I care about, and it's clear that many of them can be cultivated. That means the truth is excitingly different from the story I got as a kid. If intelligence is what matters, and also mostly inborn, the natural consequence is a sort of Brave New World fatalism. The best you can do is figure out what sort of work you have an aptitude for, so that whatever intelligence you were born with will at least be put to the best use, and then work as hard as you can at it. Whereas if intelligence isn't what matters, but only one of several ingredients in what does, and many of those aren't inborn, things get more interesting. You have a lot more control, but the problem of how to arrange your life becomes that much more complicated. So what are the other ingredients in having new ideas? The fact that I can even ask this question proves the point I raised earlier â€” that society hasn't assimilated the fact that it's this and not intelligence that matters. Otherwise we'd all know the answers to such a fundamental question. I'm not going to try to provide a complete catalogue of the other ingredients here. This is the first time I've posed the question to myself this way, and I think it may take a while to answer. But I wrote recently about one of the most important: an obsessive interest in a particular topic. And this can definitely be cultivated. Another quality you need in order to discover new ideas is independent-mindedness. I wouldn't",5,4,5
What is the most reliable way to become a billionaire?,"To start a company that grows fast, and the way to grow fast is to make what users want.","The most reliable way to become a billionaire is to start a company that grows fast, and the way to grow fast is to make what users want.","who make a lot of money have a moral obligation to use it for the common good. The mistake they make is to jump from feeling bad that some people are much richer than others to the conclusion that there's no legitimate way to make a very large amount of money. Now we're getting into statements that are not only falsifiable, but false. There are certainly some people who become rich by doing bad things. But there are also plenty of people who behave badly and don't make that much from it. There is no correlation â€” in fact, probably an inverse correlation â€” between how badly you behave and how much money you make. The greatest danger of this nonsense may not even be that it sends policy astray, but that it misleads ambitious people. Can you imagine a better way to destroy social mobility than by telling poor kids that the way to get rich is by exploiting people, while the rich kids know, from having watched the preceding generation do it, how it's really done? I'll tell you how it's really done, so you can at least tell your own kids the truth. It's all about users. The most reliable way to become a billionaire is to start a company that grows fast, and the way to grow fast is to make what users want. Newly started startups have no choice but to delight users, or they'll never even get rolling. But this never stops being the lodestar, and bigger companies take their eye off it at their peril. Stop delighting users, and eventually someone else will. Users are what the partners want to know about in YC interviews, and what I want to know about when I talk to founders that we funded ten years ago and who are billionaires now. What do users want? What new things could you build for them? Founders who've become billionaires are always eager to talk about that topic. That's how they became billionaires. The YC partners have so much practice doing this that they sometimes see paths that the founders themselves haven't seen yet. The partners don't try to seem skeptical, as buyers in transactions often do to increase their leverage. Although the founders feel their job is to convince the partners of the potential of their idea, these roles are not infrequently reversed, and the founders leave the interview feeling their idea has more potential than they realized. In practice, 7 minutes would be enough. You rarely change your mind at minute 8. But 10 minutes is socially convenient. I myself took the first sufficiently large acquisition offer in my first startup, so I don't blame founders for doing this. There's nothing wrong with starting a startup to make money. You need to make money somehow, and for some people startups are the most efficient way to do it. I'm just saying that these are not the startups that get really big. Not these days, anyway. There were",5,4,5
What is one way to ensure autonomy in a project?,Not to have a boss at all.,One way to ensure autonomy is not to have a boss at all.,"up net ahead, despite the shocking waste of characters. Indeed, it may be one of the advantages of capitalism that it encourages such rewriting. A company that needs software to do something can't use the software already written to do it at another company, and thus has to write their own, which often turns out better. The natural alignment between skating and solving new problems is one of the reasons the payoffs from startups are so high. Not only is the market price of unsolved problems higher, you also get a discount on productivity when you work on them. In fact, you get a double increase in productivity: when you're doing a clean-sheet design, it's easier to recruit skaters, and they get to spend all their time skating. Steve Jobs knew a thing or two about skaters from having watched Steve Wozniak. If you can find the right people, you only have to tell them what to do at the highest level. They'll handle the details. Indeed, they insist on it. For a project to feel like your own, you must have sufficient autonomy. You can't be working to order, or slowed down by bureaucracy. One way to ensure autonomy is not to have a boss at all. There are two ways to do that: to be the boss yourself, and to work on projects outside of work. Though they're at opposite ends of the scale financially, startups and open source projects have a lot in common, including the fact that they're often run by skaters. And indeed, there's a wormhole from one end of the scale to the other: one of the best ways to discover startup ideas is to work on a project just for fun. If your projects are the kind that make money, it's easy to work on them. It's harder when they're not. And the hardest part, usually, is morale. That's where adults have it harder than kids. Kids just plunge in and build their treehouse without worrying about whether they're wasting their time, or how it compares to other treehouses. And frankly we could learn a lot from kids here. The high standards most grownups have for """"real"""" work do not always serve us well. The most important phase in a project of one's own is at the beginning: when you go from thinking it might be cool to do x to actually doing x. And at that point high standards are not merely useless but positively harmful. There are a few people who start too many new projects, but far more, I suspect, who are deterred by fear of failure from starting projects that would have succeeded if they had. But if we couldn't benefit as kids from the knowledge that our treehouses were on the path to grownup projects, we can at least benefit as grownups from knowing that our projects are on a path that stretches back to treehouses. Remember that careless confidence you had as a kid when starting something",5,4,4
